Heading,Link,Summary,Date
I&B Ministry working for Deemed University status for IIMC,http://economictimes.indiatimes.com/industry/services/education/ib-ministry-working-for-deemed-university-status-for-iimc/articleshow/53197306.cms,The official said the proposal will have to be submitted to the HRD Ministry for evaluation and according of Deemed University status to Indian Institute of Mass Communication (IIMC).,"Jul 13, 2016, 10:03 PM IST"
Prakash Javadekar speeds up implementation of pending PMO-backed projects,http://economictimes.indiatimes.com/industry/services/education/prakash-javadekar-speeds-up-implementation-of-pending-pmo-backed-projects/articleshow/53200027.cms,"In a late evening statement, the HRD ministry announced an ‘interim measure’ for IIITs, allowing them to apply for the status of deemed university.","Jul 14, 2016, 01:09 AM IST"
HRD mulls assisting IIT students in getting loans,http://economictimes.indiatimes.com/industry/services/education/hrd-mulls-assisting-iit-students-in-getting-loans/articleshow/53180896.cms,"Sources said that when the IIT fees were hiked, several categories got a waiver and it was mentioned that students would be able to get interest free loans under the 'Vidyalakshmi' scheme.","Jul 12, 2016, 11:10 PM IST"
No Indian varsities in world's top 250: What Prakash Javadekar can do,http://economictimes.indiatimes.com/industry/services/education/no-indian-varsities-in-worlds-top-250-what-prakash-javadekar-can-do/articleshow/53190086.cms,Prime Minister Narendra Modi wants 10 public and private institutions to be world-class teaching and research institutions over the next five years,"Jul 13, 2016, 02:35 PM IST"
Geography isn't just about latitude,http://economictimes.indiatimes.com/industry/services/education/geography-isnt-just-about-latitude/articleshow/53185824.cms,Balachandran holds a PhD in the subject from the Kent State University and taught at Bridge water State University before returning to Bengaluru in 2000.,"Jul 13, 2016, 10:02 AM IST"
HRD ministry to bring in separate bill for IIITs,http://economictimes.indiatimes.com/industry/services/education/hrd-ministry-to-bring-in-separate-bill-for-iiits/articleshow/53198180.cms,The ministry has also decided to allow increased intake of foreign students in IIITs and prepare a roadmap for brand building these institutes.,"Jul 13, 2016, 10:47 PM IST"
NIC entrusted with task of compiling school education data,http://economictimes.indiatimes.com/industry/services/education/nic-entrusted-with-task-of-compiling-school-education-data/articleshow/53029081.cms,"To begin with, NIC will be involved in government's Shala Asmita Yojna (SAY) that will have a ready database of 25 crore schoolgoing children.","Jul 3, 2016, 10:40 AM IST"
Reserved category candidates can get admission in unreserved category if they meet criteria: DU,http://economictimes.indiatimes.com/industry/services/education/reserved-category-candidates-can-get-admission-in-unreserved-category-if-they-meet-criteria-du/articleshow/53026209.cms,The notice comes a day after some students alleged that they were refused admission in the unreserved category even though they were meeting the cutoff for unreserved category.,"Jul 2, 2016, 11:45 PM IST"
Delhi University to announce second cut-off tonight for UG admissions,http://economictimes.indiatimes.com/industry/services/education/delhi-university-to-announce-second-cut-off-tonight-for-ug-admissions/articleshow/53047114.cms,"Some of the colleges, however, are likely to close admissions for a few courses where seats have been filled under the first list.","Jul 4, 2016, 06:28 PM IST"
Is CBSE inflating class XII marks to compete with other boards?,http://economictimes.indiatimes.com/industry/services/education/is-cbse-inflating-class-xii-marks-to-compete-with-other-boards/articleshow/53041225.cms,"CBSE doesn't bunch subjects according to streams, but a candidate with physics, chemistry, mathematics and English core may have gotten 42 'extra' marks.","Jul 4, 2016, 11:36 AM IST"
"FTII to have choice-based credit system, 22 courses",http://economictimes.indiatimes.com/industry/services/education/ftii-to-have-choice-based-credit-system-22-courses/articleshow/53064312.cms,"The Academic Council of FTII, headed by the filmmaker and television producer B P Singh, had drawn up an action plan for broad-basing the course content.","Jul 5, 2016, 07:17 PM IST"
"PM Narendra Modi to launch Swayam, Massive Open Online Courses platform on Aug 15",http://economictimes.indiatimes.com/industry/services/education/pm-narendra-modi-to-launch-swayam-massive-open-online-courses-platform-on-aug-15/articleshow/53029959.cms,Sources said preparations for getting the system ready for the ambitious project is on in full swing and it is likely to be launched by PM Narendra Modi.,"Jul 3, 2016, 12:03 PM IST"
IIT-Dharwad yet to get the promised land,http://economictimes.indiatimes.com/industry/services/education/iit-dharwad-yet-to-get-the-promised-land/articleshow/53073872.cms,"As the Indian Institute of Technology-Dharwad prepares itself for a grand start in about a month's time, it is facing hurdles in getting hold of the land to set up a campus due to payment issues.","Jul 6, 2016, 10:26 AM IST"
Digest this: VC of a 'university' in UP is a churan seller,http://economictimes.indiatimes.com/industry/services/education/digest-this-vc-of-a-university-in-up-is-a-churan-seller/articleshow/53028733.cms,"""The university is fake,"" says a book seller whose shop is beside Sharma's. ""But you can meet the VC 'sahab'. Aaj kal churan bechte hain'","Jul 3, 2016, 10:06 AM IST"
‘Top-ranked’ IIT Madras is fifth choice for JEE toppers this year,http://economictimes.indiatimes.com/industry/services/education/top-ranked-iit-madras-is-fifth-choice-for-jee-toppers-this-year/articleshow/53053447.cms,"IIT Madras ranks at number 5 for the top rankers in the JEE Advanced with only 103 takers. Last year too, 103 students opted for IIT Madras among the top 1,000 rankers.","Jul 5, 2016, 05:29 AM IST"
IIT-Kharagpur to set up centre for science of happiness,http://economictimes.indiatimes.com/industry/services/education/iit-kharagpur-to-set-up-centre-for-science-of-happiness/articleshow/53044189.cms,"The IIT-Kharagpur has said it will start a 'centre for science of happiness', which will not only help students embrace more happiness.","Jul 4, 2016, 03:16 PM IST"
"Delhi University portal crashes on day 1 of admissions, chaos in colleges",http://economictimes.indiatimes.com/industry/services/education/delhi-university-portal-crashes-on-day-1-of-admissions-chaos-in-colleges/articleshow/52991682.cms,"The university had announced its first cut-off late last night and the applicants had to first study the list, then select course and college on the admission.","Jun 30, 2016, 06:35 PM IST"
Revised cost estimate for eight new IITs more than doubled,http://economictimes.indiatimes.com/industry/services/education/revised-cost-estimate-for-eight-new-iits-more-than-doubled/articleshow/52976308.cms,"The Union Cabinet approved the revised cost estimates for setting up eight New IITs at Bhubaneswar, Gandhinagar, Hyderabad, Indore, Jodhpur, Mandi, Patna and Ropar.","Jun 30, 2016, 02:10 AM IST"
Female students discouraged from joining STEM: Survey,http://economictimes.indiatimes.com/industry/services/education/female-students-discouraged-from-joining-stem-survey/articleshow/52999030.cms,"“A glaring gender gap in STEM is worrying,” said Kamal Karanth, MD, Kelly Services & KellyOCG India.","Jul 1, 2016, 03:55 AM IST"
MDI to organise talks on Raghuram Rajan’s leadership for MBA students,http://economictimes.indiatimes.com/industry/services/education/mdi-to-organise-talks-on-raghuram-rajans-leadership-for-mba-students/articleshow/52981217.cms,"“There are very important takeaways from Raghuram Rajan’s leadership style for budding managers around decision-making,” said Leela A Kaushal.","Jun 30, 2016, 03:07 AM IST"
Harvard-backed portal woos Super 30 founder Anand Kumar,http://economictimes.indiatimes.com/industry/services/education/harvard-backed-portal-woos-super-30-founder-anand-kumar/articleshow/53002372.cms,"Anand Kumar has been invited by edX, an online learning destination promoted by Harvard University and MIT, to teach mathematics.","Jul 1, 2016, 11:12 AM IST"
UGC puts on its websites list of unrecognised institutions,http://economictimes.indiatimes.com/industry/services/education/ugc-puts-on-its-websites-list-of-unrecognised-institutions/articleshow/52997145.cms,"Some other institutions named in the UGC notice include ADR-Centric Juridical University, Rajendra Place, New Delhi, St John's University, Kerala, Uttar Pradesh Vishwavidyalaya, Kosi Kalan, Mathura.","Jun 30, 2016, 11:30 PM IST"
"IITs plan entrance test in SAARC, UAE but not in Pakistan",http://economictimes.indiatimes.com/industry/services/education/iits-plan-entrance-test-in-saarc-uae-but-not-in-pakistan/articleshow/52972924.cms,Officials had held that seats to be offered to foreign nationals would be additional in nature and would not reduce those available to Indians at the IITs.,"Jun 29, 2016, 04:36 PM IST"
DU announces first cut-off list for admission,http://economictimes.indiatimes.com/industry/services/education/du-announces-first-cut-off-list-for-admission/articleshow/52981303.cms,"Admissions to the academic session 2016-17, for which the varsity had received 2.5 lakh applications, will begin tomorrow.","Jun 30, 2016, 03:25 AM IST"
National Ranking to have separate parameters for IISERs: Smriti Irani,http://economictimes.indiatimes.com/industry/services/education/national-ranking-to-have-separate-parameters-for-iisers-smriti-irani/articleshow/52961338.cms,"The students now have the choice in doing two semesters in foreign institution in under graduate courses and also one semester in post graduate courses, she said.","Jun 28, 2016, 10:10 PM IST"
"No Detention till class V only, says HRD's draft education policy",http://economictimes.indiatimes.com/industry/services/education/no-detention-till-class-v-only-says-hrds-draft-education-policy/articleshow/52977087.cms,"In the draft, put out by the ministry, it is mentioned that the present provisions of no-detention policy will be amended, as it has seriously affected the academic performance of students.","Jun 29, 2016, 09:08 PM IST"
Guidelines framed for transfer of online credits to regular courses: UGC,http://economictimes.indiatimes.com/industry/services/education/guidelines-framed-for-transfer-of-online-credits-to-regular-courses-ugc/articleshow/52901758.cms,The guidelines have been framed keeping in mind the HRD Ministry's massive open online courses (MOOC) platform 'Swayam'.,"Jun 24, 2016, 04:40 PM IST"
"IIT-Kharagpur, IACS to offer MSc-PhD in chemical, molecular biology",http://economictimes.indiatimes.com/industry/services/education/iit-kharagpur-iacs-to-offer-msc-phd-in-chemical-molecular-biology/articleshow/52936494.cms,The Indian Institute of Technology-Kharagpur and Kolkata-based IACS signed a memorandum of understanding to develop and offer the integrated course.,"Jun 27, 2016, 01:46 PM IST"
Online education firm Coursera keen to partner with Indian companies,http://economictimes.indiatimes.com/industry/services/education/online-education-firm-coursera-keen-to-partner-with-indian-companies/articleshow/52923140.cms,"Its user base in India has grown from 0.7 million in November 2014 to 1.3 million till now. Its top courses in the country include computer science, business and data science.","Jun 26, 2016, 11:14 AM IST"
Aircraft engineer course may become degree programme,http://economictimes.indiatimes.com/industry/services/education/aircraft-engineer-course-may-become-degree-programme/articleshow/52892835.cms,The government is considering to convert the three-year aircraft maintenance engineer (AME) certificate course into a fullfledged degree programme.,"Jun 24, 2016, 04:04 AM IST"
IIT JEE Main rankings out; boys dominate list,http://economictimes.indiatimes.com/industry/services/education/iit-jee-main-rankings-out-boys-dominate-list/articleshow/52888861.cms,"Of the top 1,000 positions, 853 have been secured by boys and 147 by girls. Ryali Gayathri from Telangana has emerged on the top among girls, securing the 11th rank.","Jun 23, 2016, 09:18 PM IST"
"A Super 30 for law: How IDIA, a nonprofit, is helping poor students enter India's elite law schools",http://economictimes.indiatimes.com/industry/services/education/a-super-30-for-law-how-idia-a-nonprofit-is-helping-poor-students-enter-indias-elite-law-schools/articleshow/52918022.cms,"Both NLU and NLSIU in Bengaluru give a full fee waiver to IDIA scholars while students at other law universities are financed by donors, mainly other lawyers, such as Zia Mody.","Jun 26, 2016, 04:12 AM IST"
Chicago University teams up with Tata Trusts to launch Delhi centre,http://economictimes.indiatimes.com/industry/services/education/chicago-university-teams-up-with-tata-trusts-to-launch-delhi-centre/articleshow/52885060.cms,"Tata Centre for Development will be located at university’s centre in Delhi and will help build capacity for government, corporate and non-profit groups.","Jun 23, 2016, 04:44 PM IST"
Delhi government introduces 'Change-makers in education' fellowship,http://economictimes.indiatimes.com/industry/services/education/delhi-government-introduces-change-makers-in-education-fellowship/articleshow/52918049.cms,"Fifty-four fellows, under the age of 35, will be selected from a wide range of academic and professional disciplines.","Jun 25, 2016, 08:27 PM IST"
Guidelines framed for transfer of online credits to regular courses,http://economictimes.indiatimes.com/industry/services/education/guidelines-framed-for-transfer-of-online-credits-to-regular-courses/articleshow/52904527.cms,The guidelines have been framed for the HRD Ministry's massive open online courses (MOOC) platform Swayam.,"Jun 24, 2016, 08:00 PM IST"
"After IITs, NIT fee hiked to Rs 1.25 lakh from Rs 70, 000 per annum",http://economictimes.indiatimes.com/industry/services/education/after-iits-nit-fee-hiked-to-rs-1-25-lakh-from-rs-70-000-per-annum/articleshow/52907233.cms,"""The fee hike would only for new students who get admission and not for those who are already studying,"" the official said.","Jun 24, 2016, 10:34 PM IST"
"No seat of choice: IIT, NIT aspirants can withdraw their admissions",http://economictimes.indiatimes.com/industry/services/education/no-seat-of-choice-iit-nit-aspirants-can-withdraw-their-admissions/articleshow/52791906.cms,"The seat allotment process is likely to begin from June 24, subject to the availability of class XII scores of the various state boards.","Jun 17, 2016, 11:49 AM IST"
Mumbai student is top scorer in entrance examination,http://economictimes.indiatimes.com/industry/services/education/mumbai-student-is-top-scorer-in-entrance-examination/articleshow/52798245.cms,Dean of Academics in JIPMER Dr Mahadevan said that Kushagra Pandey coming under unreserved category has scored 100 percentile in the test for admission to the course.,"Jun 17, 2016, 07:17 PM IST"
Wait for UGC approval gets longer for Azim Premji University as 'further compliance' sought,http://economictimes.indiatimes.com/industry/services/education/wait-for-ugc-approval-gets-longer-for-azim-premji-university-as-further-compliance-sought/articleshow/52824967.cms,"Although they are taken aback, APU officials said they will work on the ""shortcomings"" pointed out by the UGC committee.","Jun 20, 2016, 01:29 AM IST"
Cracking the IITs: RISE institute is Kashmir’s very own 'Super 30',http://economictimes.indiatimes.com/industry/services/education/cracking-the-iits-rise-institute-is-kashmirs-very-own-super-30/articleshow/52803431.cms,"The coaching institute has been set up by three IIT alumni including Mubeen Masudi, an IIT-Bombay alumnus and a second rank holder in CAT (2012-13).","Jun 18, 2016, 02:15 AM IST"
Digital partnerships key to India's educational transformation: Adobe,http://economictimes.indiatimes.com/industry/services/education/digital-partnerships-key-to-indias-educational-transformation-adobe/articleshow/52833206.cms,"To keep up with this digital transformation, preparing students with the digital skills needed for success was seen by 73 per cent of Indian respondents as most critical.","Jun 20, 2016, 04:38 PM IST"
Yoga to get boost under new education policy,http://economictimes.indiatimes.com/industry/services/education/yoga-to-get-boost-under-new-education-policy/articleshow/52807709.cms,"Yoga Olympiad will be held every year to enable participation of all states with an aim that school children learn Yoga, an official said.","Jun 18, 2016, 01:24 PM IST"
"Hold national test after class 12 for college admissions, recommends panel",http://economictimes.indiatimes.com/industry/services/education/hold-national-test-after-class-12-for-college-admissions-recommends-panel/articleshow/52805796.cms,The committee proposed a SAT-type test irrespective of examination board to fix the problem of multiple entrance tests for admission to college.,"Jun 18, 2016, 10:18 AM IST"
Will not allow mid-session fee hike by private schools: Smriti Irani,http://economictimes.indiatimes.com/industry/services/education/will-not-allow-mid-session-fee-hike-by-private-schools-smriti-irani/articleshow/52822046.cms,"The Centre has proposed this to states, Irani said, adding the Punjab government will soon take a decision on this matter.","Jun 19, 2016, 08:18 PM IST"
Over 20 students from tribal village of Madhya Pradesh crack IIT,http://economictimes.indiatimes.com/industry/services/education/over-20-students-from-tribal-village-of-madhya-pradesh-crack-iit/articleshow/52817341.cms,"Under the ""Choo lo aasman programme"", special classrooms having video lectures from experienced teacher of city schools, television and computer programmes helped them.","Jun 19, 2016, 11:44 AM IST"
Delhi University admission likely to start late,http://economictimes.indiatimes.com/industry/services/education/delhi-university-admission-likely-to-start-late/articleshow/52791684.cms,"The change has nothing to do with DU Teachers' Association's boycott of admission process, but is due to OBC-category candidates seeking more time.","Jun 17, 2016, 11:34 AM IST"
Bengaluru school buses go hi-tech as safety concerns spike,http://economictimes.indiatimes.com/industry/services/education/bengaluru-school-buses-go-hi-tech-as-safety-concerns-spike/articleshow/52741123.cms,"Companies like Magnasoft, Agent Technologies and Ospox are offering various safety solutions to schools and school bus manufacturers alike.","Jun 14, 2016, 10:18 AM IST"
"UGC bows to teachers demands, amends API criteria again",http://economictimes.indiatimes.com/industry/services/education/ugc-bows-to-teachers-demands-amends-api-criteria-again/articleshow/52768856.cms,The UGC had recently changed the API criteria which had led to continuous protests by teachers body as it was feared they could lead to retrenchement .,"Jun 15, 2016, 10:29 PM IST"
"Dell, Shiv Nadar University tie-up to collaborate on research",http://economictimes.indiatimes.com/industry/services/education/dell-shiv-nadar-university-tie-up-to-collaborate-on-research/articleshow/52731013.cms,"Under the pact, Dell and the university have jointly set up two laboratories to integrate theoretical concepts with practical experience, it joint statement said.","Jun 13, 2016, 06:42 PM IST"
IISc Bangalore is India’s best university: QS,http://economictimes.indiatimes.com/industry/services/education/iisc-bangalore-is-indias-best-university-qs/articleshow/52738734.cms,The QS Asia rankings for 2016 also see IIT Madras and IIT Kanpur break into the list of top 50 Asian universities.,"Jun 14, 2016, 05:14 AM IST"
"More girls qualify for IITs, but fail to make it to top 100",http://economictimes.indiatimes.com/industry/services/education/more-girls-qualify-for-iits-but-fail-to-make-it-to-top-100/articleshow/52719850.cms,"In 2014, there were five girls in the top 100. Of the 36,566 who qualified to join IITs from the 1,47,678 appeared, girls comprised 12.49%, better than last year’s 11.54%.","Jun 13, 2016, 01:27 AM IST"
Dell and Shiv Nadar University sign agreement to drive research and innovation,http://economictimes.indiatimes.com/industry/services/education/dell-and-shiv-nadar-university-sign-agreement-to-drive-research-and-innovation/articleshow/52724635.cms,"Labs sponsored by Dell will allow students to gain learning opportunities by working on projects related to key business issues, focus on solving real-world challenges.","Jun 13, 2016, 12:15 PM IST"
"CII, ISB, GE join hands to launch compliance management course",http://economictimes.indiatimes.com/industry/services/education/cii-isb-ge-join-hands-to-launch-compliance-management-course/articleshow/52743597.cms,"The Confederation of Indian Industry (CII), Indian School of Business(ISB) and GE have come together to launch a compliance management course for executives.","Jun 14, 2016, 01:11 PM IST"
Technology interventions in schools and colleges creating new productive platforms,http://economictimes.indiatimes.com/industry/services/education/technology-interventions-in-schools-and-colleges-creating-new-productive-platforms/articleshow/52771464.cms,A number of technology platforms that help improve outcomes for students by tracking their performance and interests over the years have been developed.,"Jun 16, 2016, 01:49 AM IST"
"Jawahar Navodaya shine, 233 of 315 kids get into IITs",http://economictimes.indiatimes.com/industry/services/education/jawahar-navodaya-shine-233-of-315-kids-get-into-iits/articleshow/52741015.cms,"Though the success rate of 73.9% is less than the 95% success rate achieved at JEE (main) stage, it is better than what many coaching institutes can boast of.","Jun 14, 2016, 10:09 AM IST"
"India protests against 'negative, incorrect' Malaysian university module",http://economictimes.indiatimes.com/industry/services/education/india-protests-against-negative-incorrect-malaysian-university-module/articleshow/52762061.cms,"""We also note the ""utmost regret and deep remorse"" conveyed by UTM on this incident and their assurance that such incident will not recur, a statement said.","Jun 15, 2016, 03:25 PM IST"
Develop a culture of innovation and research in higher education: President Pranab Mukherjee,http://economictimes.indiatimes.com/industry/services/education/develop-a-culture-of-innovation-and-research-in-higher-education-president-pranab-mukherjee/articleshow/52656788.cms,President Mukherjee said he learnt a number of things after being a 'visitor' to a number of higher learning institutions of the country by virtue of the post he held.,"Jun 8, 2016, 06:02 PM IST"
Haryana to open 21 new educational institutes for girls: Manohar Lal Khattar,http://economictimes.indiatimes.com/industry/services/education/haryana-to-open-21-new-educational-institutes-for-girls-manohar-lal-khattar/articleshow/52694030.cms,CM Manohar Lal Khattar said that a university would also be set up in Faridabad which will offer couses in skill development.,"Jun 10, 2016, 10:11 PM IST"
Should there be space for more seats at IITs?,http://economictimes.indiatimes.com/industry/services/education/should-there-be-space-for-more-seats-at-iits/articleshow/52706792.cms,"When IIT results come out, around two lakh students will know whether they are among the 10,000-odd who have made it to the 23 coveted institutes.","Jun 12, 2016, 12:07 PM IST"
"JEE-Advanced 2016 results; 36,566 qualify for entry into IITs",http://economictimes.indiatimes.com/industry/services/education/jee-advanced-2016-results-36566-qualify-for-entry-into-iits/articleshow/52711419.cms,"According to reports, Jaipur’s Aman Bansal has topped the exam followed by Bhavesh Dhingra and Kunal Goyal.","Jun 12, 2016, 11:21 AM IST"
Will prepare ICSE board students for competitive exams: Council,http://economictimes.indiatimes.com/industry/services/education/will-prepare-icse-board-students-for-competitive-exams-council/articleshow/52640148.cms,"He said they have noticed that many students go to coaching centres for preparing for various competitive exams like JEE, which effect their school classes and results.","Jun 7, 2016, 07:48 PM IST"
"Kota coaching ""factories"": Where stress, anxiety overpower students",http://economictimes.indiatimes.com/industry/services/education/kota-coaching-factories-where-stress-anxiety-overpower-students/articleshow/52650157.cms,"Since 2010, 69 students enrolled with the 130-odd engineering or medical coaching institutes in the city have taken their own lives, says Kota SP Sawai Singh Godara.","Jun 8, 2016, 12:01 PM IST"
Big B to unveil Robomate learning management system,http://economictimes.indiatimes.com/industry/services/education/big-b-to-unveil-robomate-learning-management-system/articleshow/52705996.cms,"Bachchan will unveil the solution at a function here tomorrow, said MT Educare, a leading education company which is listed on BSE and NSE.","Jun 11, 2016, 09:32 PM IST"
Coursera and ISB launch series of investment management courses,http://economictimes.indiatimes.com/industry/services/education/coursera-and-isb-launch-series-of-investment-management-courses/articleshow/52668791.cms,The importance of sound financial planning and investment management in helping an individual achieve financial goals cannot be over emphasised.,"Jun 9, 2016, 12:25 PM IST"
HRD ministry exploring possibility of a teachers university,http://economictimes.indiatimes.com/industry/services/education/hrd-ministry-exploring-possibility-of-a-teachers-university/articleshow/52711926.cms,Officials said it was felt that having a university dealing holistically with aspects related to teachers' education could help improve teaching standards.,"Jun 12, 2016, 12:18 PM IST"
