Heading,Link,Summary,Date
Government approves upgradation of NIFT to implement OBC reservation,http://economictimes.indiatimes.com/industry/services/education/government-approves-upgradation-of-nift-to-implement-obc-reservation/articleshow/49353561.cms,Government approved the upgradation of the National Institute of Fashion Technology campuses for implementation of reservation for students belonging to OBC.,"Oct 14, 2015, 05:44 PM IST"
Yale University and Ashoka University expand collaboration,http://economictimes.indiatimes.com/industry/services/education/yale-university-and-ashoka-university-expand-collaboration/articleshow/49415116.cms,Yale University and Ashoka University have announced an expansion of their ongoing collaboration with a Memorandum of Understanding.,"Oct 16, 2015, 06:26 PM IST"
DB Schenker India's first CSR program for 2015 focuses on skill development,http://economictimes.indiatimes.com/industry/services/education/db-schenker-indias-first-csr-program-for-2015-focuses-on-skill-development/articleshow/49282939.cms,"A total of 40 students were enrolled in the first batch, with 120 more to be trained in three subsequent batches throughout the course of the year.","Oct 9, 2015, 10:11 AM IST"
"IIM-A conducts outreach activities overseas including Africa, Singapore",http://economictimes.indiatimes.com/industry/services/education/iim-a-conducts-outreach-activities-overseas-including-africa-singapore/articleshow/49280796.cms,"IIM-A also plans to conduct promotional activities in Indonesia, Malaysia and Vietnam this year, and hopes to get at least twenty students for next year’s programme.","Oct 9, 2015, 04:10 AM IST"
"XLRI, ICFL announce partnership to offer finance programmes to working professionals",http://economictimes.indiatimes.com/industry/services/education/xlri-icfl-announce-partnership-to-offer-finance-programmes-to-working-professionals/articleshow/49273084.cms,ICFL and XLRI have come together to offer these programmes over online mode with an aim of honing the financial skills of working professionals with atleast 2-3 years of experience.,"Oct 8, 2015, 04:36 PM IST"
Government holds talks with IIM directors over bill,http://economictimes.indiatimes.com/industry/services/education/government-holds-talks-with-iim-directors-over-bill/articleshow/49293299.cms,Government engaged in lengthy deliberations with the institute directors who have raised fears about the legislation undermining their autonomy.,"Oct 9, 2015, 10:42 PM IST"
HRD Ministry puts up fresh advt for appointment of CBSE head,http://economictimes.indiatimes.com/industry/services/education/hrd-ministry-puts-up-fresh-advt-for-appointment-of-cbse-head/articleshow/49278930.cms,The HRD Ministry has put up fresh advertisement for appointment of the CBSE chairman after it scrapped the search-cum-selection panel last month.,"Oct 8, 2015, 11:29 PM IST"
Andhra Pradesh will set up energy varsity: Chandrababu Naidu,http://economictimes.indiatimes.com/industry/services/education/andhra-pradesh-will-set-up-energy-varsity-chandrababu-naidu/articleshow/49278448.cms,He attended a function for the signing of MoUs between Andrha Pradesh and two international power producers from Japan and Spain.,"Oct 8, 2015, 10:50 PM IST"
MDI Gurgaon wraps up summer placements in record 2.5 days,http://economictimes.indiatimes.com/industry/services/education/mdi-gurgaon-wraps-up-summer-placements-in-record-2-5-days/articleshow/49274642.cms,The average stipend for the entire batch of 301 students was Rs 1.41 lakh and the highest stipend Rs  3 lakh for two months.,"Oct 8, 2015, 06:25 PM IST"
25% IIT seats grabbed by students from rural areas in 2015,http://economictimes.indiatimes.com/industry/services/education/25-iit-seats-grabbed-by-students-from-rural-areas-in-2015/articleshow/49276863.cms,"Twenty-five per cent of the seats of the prestigious Indian Institutes of Technology across the country were grabbed by students from rural areas this year, as compared to only 10 per cent seats last year.","Oct 8, 2015, 09:05 PM IST"
IITs at opposing ends over HRD Ministry’s fee hike proposal,http://economictimes.indiatimes.com/industry/services/education/iits-at-opposing-ends-over-hrd-ministrys-fee-hike-proposal/articleshow/49280836.cms,India’s top IITs are divided on the issue of a rise in fees being considered by a council set up by the HRD ministry to tide over paucity of funds.,"Oct 9, 2015, 04:24 AM IST"
CAT registrations at 2.18 lakh; highest in five years,http://economictimes.indiatimes.com/industry/services/education/cat-registrations-at-2-18-lakh-highest-in-five-years/articleshow/49295238.cms,It also marks a three-year high since CAT 2012 when the number of registrations were 2.14 lakh. The last highest was 2.42 lakh in CAT 2009.,"Oct 10, 2015, 04:00 AM IST"
Top 9 ineffectual graduate degrees in the US based on salary and unemployment data,http://economictimes.indiatimes.com/industry/services/education/top-9-ineffectual-graduate-degrees-in-the-us-based-on-salary-and-unemployment-data/articleshow/49208283.cms,"When it comes to social work, experienced graduate degree holders earn $58,000 a year, on average and 3.9% of graduates are unemployed.","Oct 4, 2015, 03:59 AM IST"
Institute of Management Technology announces 199 seats under Students Exchange Program,http://economictimes.indiatimes.com/industry/services/education/institute-of-management-technology-announces-199-seats-under-students-exchange-program/articleshow/49182965.cms,"With the exchange program, the college hopes to provide students with opportunities for students to explore cultures, interact with international faculty.","Oct 1, 2015, 05:12 PM IST"
"Few takers for Hindi in DU, teachers petition HRD to make it compulsory",http://economictimes.indiatimes.com/industry/services/education/few-takers-for-hindi-in-du-teachers-petition-hrd-to-make-it-compulsory/articleshow/49213651.cms,"Concerned about the dwindling number of students opting for Hindi in Delhi University, a section of teachers have petitioned the HRD ministry to make the language compulsory again.","Oct 4, 2015, 11:02 AM IST"
National institutes should have student-centric approach: Smriti Irani,http://economictimes.indiatimes.com/industry/services/education/national-institutes-should-have-student-centric-approach-smriti-irani/articleshow/49190210.cms,"Irani chaired a meeting of the Council of National Institute of Technology, Science Education and Research held at National Institute of Technology here today.","Oct 2, 2015, 06:16 AM IST"
"Pearson to ride on Digital India tide, plans big-ticket investments in R&D",http://economictimes.indiatimes.com/industry/services/education/pearson-to-ride-on-digital-india-tide-plans-big-ticket-investments-in-rd/articleshow/49220983.cms,"Pearson Plc plans big-ticket investments in India in research and development riding on the government’s Digital India initiative, said Chief Executive John Fallon.","Oct 5, 2015, 04:00 AM IST"
"IIT Kharagpur ties up with MIT, others for cultural research",http://economictimes.indiatimes.com/industry/services/education/iit-kharagpur-ties-up-with-mit-others-for-cultural-research/articleshow/49189243.cms,"Indian Institute of Technology, Kharagpur has entered into research tie-ups with Massachusetts Institute of Technology (MIT) and various other Indian and global universities.","Oct 2, 2015, 02:10 AM IST"
"IGNOU to offer certificate, diploma courses in RTI soon",http://economictimes.indiatimes.com/industry/services/education/ignou-to-offer-certificate-diploma-courses-in-rti-soon/articleshow/49213805.cms,"Keeping in mind the societal relevance of the Right to Information Act,IGNOU has decided to rollout certificate and diploma courses in RTI.","Oct 4, 2015, 11:22 AM IST"
Eastern Group starts programme to improve employability of engineering students,http://economictimes.indiatimes.com/industry/services/education/eastern-group-starts-programme-to-improve-employability-of-engineering-students/articleshow/49206742.cms,Engineering Colleges which join the initiative will be offered a free of cost technical skill training program called margadarshi for its students and a capacity development program namely gurudakshina for its faculties.,"Oct 3, 2015, 04:33 PM IST"
Core committee formed to look into NITs recommendations,http://economictimes.indiatimes.com/industry/services/education/core-committee-formed-to-look-into-nits-recommendations/articleshow/49187381.cms,NITs have strongly favoured scrapping the 40 per cent Board examination weightage criterion which is taken into account along with the JEE main scores.,"Oct 1, 2015, 10:40 PM IST"
"Japanese delegation calls on Haryana Agricultural University VC, propose collaboration",http://economictimes.indiatimes.com/industry/services/education/japanese-delegation-calls-on-haryana-agricultural-university-vc-propose-collaboration/articleshow/49194103.cms,A delegation from Japan here today called on HAU VC and expressed keen interest for collaboration with the varsity in academic and research pursuits.,"Oct 2, 2015, 02:46 PM IST"
Government to roll out domestic ranking system for educational institutions,http://economictimes.indiatimes.com/industry/services/education/government-to-roll-out-domestic-ranking-system-for-educational-institutions/articleshow/49141943.cms,"The ranking framework will be across disciplines which takes into account the perception of an institute, outreach, research activity and inclusivity through reservations.","Sep 28, 2015, 09:06 PM IST"
15 out of 20 top CBSE schools are in South,http://economictimes.indiatimes.com/industry/services/education/15-out-of-20-top-cbse-schools-are-in-south/articleshow/49148201.cms,The overall aggregate for a school was arrived at by taking out the average marks obtained by all the students who took the class XII CBSE exams.,"Sep 29, 2015, 10:39 AM IST"
"Kidzania to enter Delhi-NCR with Rs 100-crore investment, says chief executive Sanjeev Kumar",http://economictimes.indiatimes.com/industry/services/education/kidzania-to-enter-delhi-ncr-with-rs-100-crore-investment-says-chief-executive-sanjeev-kumar/articleshow/49139104.cms,"Kidzania, the global chain of role-play centres for children, will invest over Rs 100 crore for a facility in Delhi-NCR, its chief executive has said.","Sep 28, 2015, 05:42 PM IST"
Bank of Baroda contributes Rs 2 crore to IIM Ahmedabad to boost case research,http://economictimes.indiatimes.com/industry/services/education/bank-of-baroda-contributes-rs-2-crore-to-iim-ahmedabad-to-boost-case-research/articleshow/49137799.cms,"Bank of Baroda (BoB) is contributing Rs 2 crore to boost the case research at the Indian Institute of Management, Ahmedabad (IIMA).","Sep 28, 2015, 04:05 PM IST"
Five day extension in registration window takes CAT 2015 registrations to a three-year high,http://economictimes.indiatimes.com/industry/services/education/five-day-extension-in-registration-window-takes-cat-2015-registrations-to-a-three-year-high/articleshow/49120466.cms,"After registrations finally closed on midnight Friday, the IIMs received 2,18,664 applications for CAT 2015, marking a three-year high.","Sep 26, 2015, 11:19 PM IST"
"Online examination at IGNOU soon; talks on with HRD, UGC",http://economictimes.indiatimes.com/industry/services/education/online-examination-at-ignou-soon-talks-on-with-hrd-ugc/articleshow/49123284.cms,The Indira Gandhi National Open University (IGNOU) is considering giving them the option of taking examinations online.,"Sep 27, 2015, 10:30 AM IST"
Kerala government renews MoU with 14 self-financing medical colleges,http://economictimes.indiatimes.com/industry/services/education/kerala-government-renews-mou-with-14-self-financing-medical-colleges/articleshow/49142860.cms,Kerala government today renewed agreement with 14 private self-financing medical colleges on issues related to admission and fee fixation.,"Sep 28, 2015, 09:57 PM IST"
"Syllabus reduction: Deleted content to be ""reused"" in more constructive forms",http://economictimes.indiatimes.com/industry/services/education/syllabus-reduction-deleted-content-to-be-reused-in-more-constructive-forms/articleshow/49124098.cms,Manish Sisodia had earlier this month announced government's decision to reduce 25 per cent syllabus for classes VI to VIII.,"Sep 27, 2015, 11:48 AM IST"
New draft education policy by December: HRD Minister Smriti Irani,http://economictimes.indiatimes.com/industry/services/education/new-draft-education-policy-by-december-hrd-minister-smriti-irani/articleshow/49117241.cms,"Irani said that on how new education policy should take shape, she was holding meetings with education minister of every state and district magistrates.","Sep 26, 2015, 06:18 PM IST"
Career Power plans to raise Rs 65 crore to fund expansion,http://economictimes.indiatimes.com/industry/services/education/career-power-plans-to-raise-rs-65-crore-to-fund-expansion/articleshow/49138647.cms,Career Power plans to raise Rs 65 crore from VC and strategic partners as part of its series A funding and has signed up Ernst & Young for this mandate.,"Sep 28, 2015, 05:07 PM IST"
IDP education organises UK Education Fair,http://economictimes.indiatimes.com/industry/services/education/idp-education-organises-uk-education-fair/articleshow/49062041.cms,"IDP Education India, a leading student placement service provider, today organised a UK Education Fair here for students aspiring to pursue higher education abroad.","Sep 22, 2015, 06:35 PM IST"
"Google, Udacity announce the launch of Android Nanodegree in India",http://economictimes.indiatimes.com/industry/services/education/google-udacity-announce-the-launch-of-android-nanodegree-in-india/articleshow/49045693.cms,Google on Monday announced the launch of a program to offer Android Nanodegrees in India in partnership with Udacity.,"Sep 21, 2015, 04:11 PM IST"
"Bihar school enrolment up, hits 94 per cent at primary level",http://economictimes.indiatimes.com/industry/services/education/bihar-school-enrolment-up-hits-94-per-cent-at-primary-level/articleshow/49071479.cms,One of the highlights is Bihar’s performance in Net Enrolment Ratio that has reached 93.77% at the primary level.,"Sep 23, 2015, 12:08 PM IST"
IIMs extend CAT 2015 registration window by 5 days,http://economictimes.indiatimes.com/industry/services/education/iims-extend-cat-2015-registration-window-by-5-days/articleshow/49038040.cms,The Indian Institutes of Management (IIMs) have extended the CAT (Common Admission Test) 2015 registration window by five days.,"Sep 21, 2015, 12:59 AM IST"
"Chinese, Japanese and Korean Universities ahead of IISc in QS rankings",http://economictimes.indiatimes.com/industry/services/education/chinese-japanese-and-korean-universities-ahead-of-iisc-in-qs-rankings/articleshow/49041599.cms,"While the IISc is placed 147th in the world, it is ranked 34th in Asia in the latest rankings brought out by UK based Quacquarelli Symonds (QS).","Sep 21, 2015, 11:20 AM IST"
IGNOU to resume its operations in 9 foreign centres soon,http://economictimes.indiatimes.com/industry/services/education/ignou-to-resume-its-operations-in-9-foreign-centres-soon/articleshow/49032806.cms,The university had to abruptly stop enrollment of students at its OSCs due to legal issues after host nation's objected to its direct agreements with the foreign institutes.,"Sep 20, 2015, 01:21 PM IST"
Snapdeal partners with Credila to offer education loans,http://economictimes.indiatimes.com/industry/services/education/snapdeal-partners-with-credila-to-offer-education-loans/articleshow/49059317.cms,The partnership will offer students up to 100% finance for education with no upper cap on loan amount and easy EMI repayment options at attractive interest rates.,"Sep 23, 2015, 06:17 AM IST"
China to introduce best practices adopted in Indian colleges,http://economictimes.indiatimes.com/industry/services/education/china-to-introduce-best-practices-adopted-in-indian-colleges/articleshow/49027597.cms,China will be taking home the best practices followed in some of the city colleges here to improve the communication and employability skills of its students.,"Sep 19, 2015, 08:58 PM IST"
IIT Roorkee to implement SAP enterprise resource planning solution to connect campuses,http://economictimes.indiatimes.com/industry/services/education/iit-roorkee-to-implement-sap-enterprise-resource-planning-solution-to-connect-campuses/articleshow/49047405.cms,Indian Institute of Technology (IIT) Roorkee will implement SAP enterprise resource planning (ERP) solution to connect all its campuses.,"Sep 21, 2015, 06:16 PM IST"
US to help provide skills training to 400 million Indians,http://economictimes.indiatimes.com/industry/services/education/us-to-help-provide-skills-training-to-400-million-indians/articleshow/49070872.cms,"The new six-week Community College Administrator Program, sponsored by the Department of State's Bureau of Educational and Cultural Affairs.","Sep 23, 2015, 11:29 AM IST"
Gurgaon-based Vega Schools to pump in Rs 200 crore for local expansion,http://economictimes.indiatimes.com/industry/services/education/gurgaon-based-vega-schools-to-pump-in-rs-200-crore-for-local-expansion/articleshow/48964898.cms,Vega Schools is looking at investing about Rs 200 crore over the next five years to expand its footprint and is introducing a customised approach to education.,"Sep 15, 2015, 06:55 AM IST"
"India makes debut in World University Rankings ; IISc Bangalore, IIT Delhi in the list",http://economictimes.indiatimes.com/industry/services/education/india-makes-debut-in-world-university-rankings-iisc-bangalore-iit-delhi-in-the-list/articleshow/48967528.cms,"The Indian Institute of Science (IISc), Bangalore has taken the top spot among Indian institutes, bagging the 147th rank.","Sep 15, 2015, 11:50 AM IST"
Online courses gain traction among Koramangala techies,http://economictimes.indiatimes.com/industry/services/education/online-courses-gain-traction-among-koramangala-techies/articleshow/48982317.cms,"Ease of access, lower cost, flexible timings and better opportunities at workplace is why more and more professionals are keen to join such streams.","Sep 16, 2015, 11:18 AM IST"
"In a first, two Indian institutes make it to world’s top 200 universities",http://economictimes.indiatimes.com/industry/services/education/in-a-first-two-indian-institutes-make-it-to-worlds-top-200-universities/articleshow/48966237.cms,"The Indian Institute of Science, Bengaluru, has taken the top spot among its Indian counterparts, bagging the 147th rank.","Sep 15, 2015, 10:16 AM IST"
"Online learning platform Coursera bets big on India, to start new technology, business courses",http://economictimes.indiatimes.com/industry/services/education/online-learning-platform-coursera-bets-big-on-india-to-start-new-technology-business-courses/articleshow/48964316.cms,"Flush with a new round of funding, the company, like many other Valley-based startups, is setting up an office in India, focused on marketing and building partnerships.","Sep 15, 2015, 06:16 AM IST"
KSCADC to implement projects worth Rs 70 crore for coastal schools,http://economictimes.indiatimes.com/industry/services/education/kscadc-to-implement-projects-worth-rs-70-crore-for-coastal-schools/articleshow/48974300.cms,The 816.60 square meter academic block is one of the initiatives of KSCADC's renovation programmes of the Government Fisheries Technical High schools.,"Sep 15, 2015, 07:41 PM IST"
No Indian university among top 100 world varsities,http://economictimes.indiatimes.com/industry/services/education/no-indian-university-among-top-100-world-varsities/articleshow/48972916.cms,"According to the Quacquarelli Symonds' list, there are 14 Indian institutions in the World University Rankings and half of them are among the global 400.","Sep 15, 2015, 05:51 PM IST"
Rockstand teams up with Kalinga to promote e-learning via mobile library,http://economictimes.indiatimes.com/industry/services/education/rockstand-teams-up-with-kalinga-to-promote-e-learning-via-mobile-library/articleshow/48971088.cms,The marketplace will also be providing 5 tablets in the campus for students to read and learn in a digital learning setup.,"Sep 15, 2015, 03:43 PM IST"
"Pranab Mukherjee congratulates IISc, IIT-Delhi on global ranking",http://economictimes.indiatimes.com/industry/services/education/pranab-mukherjee-congratulates-iisc-iit-delhi-on-global-ranking/articleshow/48971833.cms,"According to the QS World University Rankings of 2015-16 released today, IISc and IIT-D have been placed at 147 and 179 respectively.","Sep 15, 2015, 04:33 PM IST"
Smriti Irani's HRD ministry has come to agreement with global scholars to teach in India,http://economictimes.indiatimes.com/industry/services/education/smriti-iranis-hrd-ministry-has-come-to-agreement-with-global-scholars-to-teach-in-india/articleshow/48978495.cms,"India may not yet have managed to get the Ivy League to set up campus in India but is close to drawing in over 200 academics from global varsities to  teach in India at $8,000- $12,000.","Sep 16, 2015, 06:09 AM IST"
"Harnessing Demographic Dividend: Industry has to skill youth, say experts",http://economictimes.indiatimes.com/industry/services/education/harnessing-demographic-dividend-industry-has-to-skill-youth-say-experts/articleshow/48865230.cms,"At a 2-day l conference on Harnessing Demographic Dividend, held as part of the KLE Society's centenary, academicians stressed on vocational education and training.","Sep 8, 2015, 10:02 AM IST"
HRD Ministry to unveil a framework to rank higher education institutions,http://economictimes.indiatimes.com/industry/services/education/hrd-ministry-to-unveil-a-framework-to-rank-higher-education-institutions/articleshow/48877536.cms,"The government-backed rankings will cover all institutes offering courses on engineering, law, management and humanities.","Sep 9, 2015, 04:00 AM IST"
Entrepreneurship to be made key part of B-Tech in Kerala: CM Oommen Chandy,http://economictimes.indiatimes.com/industry/services/education/entrepreneurship-to-be-made-key-part-of-b-tech-in-kerala-cm-oommen-chandy/articleshow/48936566.cms,Kerala Chief Minister Oommen Chandy today said the technology entrepreneurship would be made a key part of engineering education in the state.,"Sep 12, 2015, 07:07 PM IST"
University of Chicago Booth School of Business and Credila offer loan assistance program,http://economictimes.indiatimes.com/industry/services/education/university-of-chicago-booth-school-of-business-and-credila-offer-loan-assistance-program/articleshow/48884721.cms,"Chicago Booth's EMBA curriculum is a 21-month, part-time program that exposes executives to the intellectual intensity and world-changing ideas.","Sep 9, 2015, 03:53 PM IST"
Classes in IIM Sambalpur to start from September 24,http://economictimes.indiatimes.com/industry/services/education/classes-in-iim-sambalpur-to-start-from-september-24/articleshow/48912257.cms,7 professors from the mentor institute and guest faculties would take the classes of first year students. More faculty members would join later.,"Sep 11, 2015, 02:28 PM IST"
Indians exceed estimates most for foreign studies: HSBC,http://economictimes.indiatimes.com/industry/services/education/indians-exceed-estimates-most-for-foreign-studies-hsbc/articleshow/48887183.cms,HSBC survey has found that parents end up spending much higher amounts than the estimated cost for their children's undergraduate studies overseas.,"Sep 9, 2015, 06:43 PM IST"
How will IST shift hit schools? Government ponders,http://economictimes.indiatimes.com/industry/services/education/how-will-ist-shift-hit-schools-government-ponders/articleshow/48880918.cms,There is a growing consensus that advancing IST by half-hour will yield more benefits for the country rather than dividing the country into two time zones.,"Sep 9, 2015, 11:33 AM IST"
New India Educational Investment Fund makes first two investments in Report Bee and Guru-G,http://economictimes.indiatimes.com/industry/services/education/new-india-educational-investment-fund-makes-first-two-investments-in-report-bee-and-guru-g/articleshow/48868291.cms,Guru-G works with over 350 schools and plans to use the funds to expand its business in the school market as well as in the publishers market.,"Sep 8, 2015, 01:43 PM IST"
King's College London looks at newer methods of teaching through tieups in India,http://economictimes.indiatimes.com/industry/services/education/kings-college-london-looks-at-newer-methods-of-teaching-through-tieups-in-india/articleshow/48907180.cms,The college is concentrating on building partnerships with private universities like Ashoka University and OP Jindal Global University.,"Sep 11, 2015, 04:40 AM IST"
BSE Institute signs MOU with Amity University to offer post-graduate programme through distance learning,http://economictimes.indiatimes.com/industry/services/education/bse-institute-signs-mou-with-amity-university-to-offer-post-graduate-programme-through-distance-learning/articleshow/48912612.cms,"BSE Institute, a wholly-owned subsidiary of BSE, has signed an MOU with Amity, to launch a distance learning programme in financial markets.","Sep 11, 2015, 03:02 PM IST"
​Department of Biotechnology sets up DBT-Pan IIT Centre for Bioenergy,http://economictimes.indiatimes.com/industry/services/education/department-of-biotechnology-sets-up-dbt-pan-iit-centre-for-bioenergy/articleshow/48789750.cms,"The Department of Biotechnology (DBT), ministry of science and technology, has set up the DBT-Pan IIT Centre for Bioenergy, a virtual centre spread across five IITs.","Sep 3, 2015, 05:13 PM IST"
