Heading,Link,Summary,Date
IIT fee hike proposal for financial autonomy finds favour with India Inc,http://economictimes.indiatimes.com/industry/services/education/iit-fee-hike-proposal-for-financial-autonomy-finds-favour-with-india-inc/articleshow/50831931.cms,Stalwarts say that self-sufficiency is key to maintaining excellence and brand stature and fee hike are consequently the logical way forward.,"Feb 3, 2016, 12:00 PM IST"
Educational infra investor to buy school chain assets,http://economictimes.indiatimes.com/industry/services/education/educational-infra-investor-to-buy-school-chain-assets/articleshow/50803962.cms,"Cerestra, an investment fund focused on educational infrastructure, is acquiring the real estate portfolio of K-12 schools from Bengaluru-based JGI","Feb 1, 2016, 12:49 PM IST"
Sears India announces launch of National Digital Literacy Center in Pune,http://economictimes.indiatimes.com/industry/services/education/sears-india-announces-launch-of-national-digital-literacy-center-in-pune/articleshow/50741195.cms,Being digitally literate will help citizens access online services as Pune starts its journey towards becoming a smart and 100% digitally literate city.”,"Jan 27, 2016, 03:08 PM IST"
"Tata Trusts, MIT, and TISS in pact to bring connected learning experiences in India",http://economictimes.indiatimes.com/industry/services/education/tata-trusts-mit-and-tiss-in-pact-to-bring-connected-learning-experiences-in-india/articleshow/50743996.cms,"Over 1,000 schools across four Indian states have agreed to participate in CLIx, allowing it to reach an estimated 165,000 students by 2018-19","Jan 27, 2016, 06:24 PM IST"
"100 years on, Visvesvaraya College still fights for autonomy",http://economictimes.indiatimes.com/industry/services/education/100-years-on-visvesvaraya-college-still-fights-for-autonomy/articleshow/50752692.cms,"With the UGC asking this once-iconic institution to first secure an accreditation, the institute's pain points will be up for scrutiny.","Jan 28, 2016, 11:00 AM IST"
Central Institute of Buddhist Studies gets deemed university status,http://economictimes.indiatimes.com/industry/services/education/central-institute-of-buddhist-studies-gets-deemed-university-status/articleshow/50746281.cms,Centre declared the Leh based ‘Central Institute of Buddhist Studies as a deemed to be University in the de novo category on the advice of the UGC.,"Jan 27, 2016, 09:23 PM IST"
Jains to buy back 45% stake from Fairwinds PE  for Rs 225 crore,http://economictimes.indiatimes.com/industry/services/education/jains-to-buy-back-45-stake-from-fairwinds-pe-for-rs-225-crore/articleshow/50744114.cms,Fairwinds Private Equity invested Rs 123 crore in the NCR-based school chain in 2010 from its first fund of $210 m.,"Jan 27, 2016, 06:33 PM IST"
"McGraw Hill Education, IGNITOR partner to offer digital textbooks",http://economictimes.indiatimes.com/industry/services/education/mcgraw-hill-education-ignitor-partner-to-offer-digital-textbooks/articleshow/50743455.cms,"MHE India will work with universities and colleges, to offer powerful learning experiences to the students on their own personal laptops or tablets, through IGNITOR.","Jan 27, 2016, 05:47 PM IST"
US' Rice University to offer post-doctoral fellowship in Jain studies,http://economictimes.indiatimes.com/industry/services/education/us-rice-university-to-offer-post-doctoral-fellowship-in-jain-studies/articleshow/50721200.cms,Rice University is set to offer a post-doctoral fellowship in Jain Studies in a bid to enhance the global understanding of Jainism as a religion and culture.,"Jan 25, 2016, 08:23 PM IST"
Savitribai Phule Pune University and IIT-Guwahati among world's top 20 small universities,http://economictimes.indiatimes.com/industry/services/education/savitribai-phule-pune-university-and-iit-guwahati-among-worlds-top-20-small-universities/articleshow/50723458.cms,"Indian universities have secured two spots in the top 20 places in Times Higher Education's 'World's Best Small Universities Ranking 2016', which was published.","Jan 25, 2016, 11:13 PM IST"
UpGrad partners with IIIT Bangalore to offer online data analytics programme,http://economictimes.indiatimes.com/industry/services/education/upgrad-partners-with-iiit-bangalore-to-offer-online-data-analytics-programme/articleshow/50738705.cms,"UpGrad’s technology platform enables seamless content delivery across devices, along with facilitating a strong peer to peer learning environment.","Jan 27, 2016, 11:51 AM IST"
MIT of Boston may associate with India's flagship programmes,http://economictimes.indiatimes.com/industry/services/education/mit-of-boston-may-associate-with-indias-flagship-programmes/articleshow/50760098.cms,"Boston-based Massachusetts Institute of Technology may associate with the flagship programmes of Skill India, Digital India and Start-Up India.","Jan 28, 2016, 07:23 PM IST"
HRD ministry sets up Committee on Yoga Education in Universities,http://economictimes.indiatimes.com/industry/services/education/hrd-ministry-sets-up-committee-on-yoga-education-in-universities/articleshow/50642293.cms,The Committee will identify Yoga courses to offer and the syllabus for conducting NET in Yogic Art and Science.,"Jan 19, 2016, 07:43 PM IST"
No support for proposal for pursuing two degrees together: UGC,http://economictimes.indiatimes.com/industry/services/education/no-support-for-proposal-for-pursuing-two-degrees-together-ugc/articleshow/50645283.cms,The University Grants Commission said that its consultations related to allowing students to pursue two degrees simultaneously so far has not got a good response.,"Jan 19, 2016, 11:25 PM IST"
"Wipro to give grant, fellowship for doctoral programme research initiatives at IIMB",http://economictimes.indiatimes.com/industry/services/education/wipro-to-give-grant-fellowship-for-doctoral-programme-research-initiatives-at-iimb/articleshow/50639286.cms,"Wipro will partner and support the Wipro Sustainability Fellowship and the Wipro Sustainability Grant, for doctoral students of IIM Bangalore.","Jan 19, 2016, 04:01 PM IST"
Private varsities start journals to boost research in Bengaluru,http://economictimes.indiatimes.com/industry/services/education/private-varsities-start-journals-to-boost-research-in-bengaluru/articleshow/50649809.cms,"Alliance University, Karnataka's first private university, launched the annual International Journal of Law and Social Sciences last month.","Jan 20, 2016, 10:44 AM IST"
IIM Bangalore becomes first business school in India to become a university program partner of CFA Institute,http://economictimes.indiatimes.com/industry/services/education/iim-bangalore-becomes-first-business-school-in-india-to-become-a-university-program-partner-of-cfa-institute/articleshow/50654091.cms,Indian Institute of Management Bangalore (IIMB) has become the first business school in India to become a university program partner of the CFA Institute.,"Jan 20, 2016, 04:06 PM IST"
Number of JEE (Main) aspirants shrinks by over 1 lakh in a year,http://economictimes.indiatimes.com/industry/services/education/number-of-jee-main-aspirants-shrinks-by-over-1-lakh-in-a-year/articleshow/50636623.cms,"CBSE received applications from 12.07 lakh aspirants last week. In 2015, 13.04 lakh students had registered for the test.","Jan 19, 2016, 12:50 PM IST"
IIMB to hold Faculty Development Programme on blended MOOCs,http://economictimes.indiatimes.com/industry/services/education/iimb-to-hold-faculty-development-programme-on-blended-moocs/articleshow/50654910.cms,"The primary objective of this workshop is to equip faculty from management institutions with requisite skills and resources to use MOOCs in a blended format in their classroom, IIMB said in a release.","Jan 20, 2016, 04:48 PM IST"
NSE signs agreement with Banaras Hindu University,http://economictimes.indiatimes.com/industry/services/education/nse-signs-agreement-with-banaras-hindu-university/articleshow/50639819.cms,The NSE has signed an agreement with Banaras Hindu University to offer two new courses - B.Com Honours (Financial Market Management) and MBA (Financial Management).,"Jan 19, 2016, 04:37 PM IST"
MICA ties up with Talentedge for e-commerce business management course,http://economictimes.indiatimes.com/industry/services/education/mica-ties-up-with-talentedge-for-e-commerce-business-management-course/articleshow/50653690.cms,"With the programme content and structure developed by MICA, there will be an emphasis on business models and other dynamics of running a business in the online space.","Jan 20, 2016, 03:38 PM IST"
Provide access to answer sheets at Rs 2 per page: CIC to varsities,http://economictimes.indiatimes.com/industry/services/education/provide-access-to-answer-sheets-at-rs-2-per-page-cic-to-varsities/articleshow/50612612.cms,The Central Information Commission has struck down the Rs 750 per answer sheet fee imposed by Delhi University.,"Jan 17, 2016, 02:22 PM IST"
British Council launches virtual English courses in Bengaluru,http://economictimes.indiatimes.com/industry/services/education/british-council-launches-virtual-english-courses-in-bengaluru/articleshow/50580991.cms,"After a successful run in Pune, British Council launched its blended learning programme ‘myEnglish’ in Bengaluru . The nine-week training module incorporates student-centric technology and virtual classrooms in six levels.","Jan 14, 2016, 09:03 PM IST"
New IISER centres to be allowed to recruit five foreign faculties: Smriti Irani,http://economictimes.indiatimes.com/industry/services/education/new-iiser-centres-to-be-allowed-to-recruit-five-foreign-faculties-smriti-irani/articleshow/50580428.cms,Human Resource Development Minister Smriti Irani today said that new IISER centres would be allowed to recruit five foreign faculties.,"Jan 14, 2016, 08:20 PM IST"
JNU's academic value ignored over political activism: S K Sopory,http://economictimes.indiatimes.com/industry/services/education/jnus-academic-value-ignored-over-political-activism-s-k-sopory/articleshow/50612143.cms,Sopory said the outside world only looks at the political happenings on the campus but the fact that the varsity produces brightest of the minds gets ignored.,"Jan 17, 2016, 01:04 PM IST"
Jamia Milia Islamia not a minority institution: Attorney General Mukul Rohatgi,http://economictimes.indiatimes.com/industry/services/education/jamia-milia-islamia-not-a-minority-institution-attorney-general-mukul-rohatgi/articleshow/50590528.cms,The Attorney General is understood to have also quoted a 1967 Supreme Court judgement which said that AMU is technically not a minority institution.,"Jan 15, 2016, 03:24 PM IST"
Bennett University signs pact with edX to provide online courses,http://economictimes.indiatimes.com/industry/services/education/bennett-university-signs-pact-with-edx-to-provide-online-courses/articleshow/50597981.cms,"The tie-up was announced during the first meet of the recently formed International Advisory Council, comprising leading global educationists and industry leaders in Mumbai.","Jan 16, 2016, 01:44 AM IST"
"Coaching centres poach teachers, schools take a hit in Bengaluru",http://economictimes.indiatimes.com/industry/services/education/coaching-centres-poach-teachers-schools-take-a-hit-in-bengaluru/articleshow/50601643.cms,"Teachers handling core subjects, are offered a monthly pay of Rs 80,000-Rs 1.5 lakh by coaching centres, while schools shell out Rs 50,000.","Jan 16, 2016, 12:23 PM IST"
New chapter at IITs: HRD Ministry allows foreign aspirants to take entrance exams,http://economictimes.indiatimes.com/industry/services/education/new-chapter-at-iits-hrd-ministry-allows-foreign-aspirants-to-take-entrance-exams/articleshow/50583573.cms,"HRD Minister Smriti Irani, who is also chairperson of the IIT Council, has cleared the proposal and her ministry has issued a memorandum to all IITs.","Jan 15, 2016, 01:32 AM IST"
HRD Ministry to set up National Authority for Testing to assess abilities of IIT aspirants,http://economictimes.indiatimes.com/industry/services/education/hrd-ministry-to-set-up-national-authority-for-testing-to-assess-abilities-of-iit-aspirants/articleshow/50611924.cms,The scores obtained in NAT test would form the basis for shortlisting candidates for the Joint Entrance Examination (JEE-advanced) 2017.,"Jan 17, 2016, 12:40 PM IST"
"Kumar Mangalam Birla, other India Inc bosses may head IIT boards",http://economictimes.indiatimes.com/industry/services/education/kumar-mangalam-birla-other-india-inc-bosses-may-head-iit-boards/articleshow/50596216.cms,"Apart from Birla, the ministry is also understood to have zeroed in on some other leading figures from the industry to head these prestigious institutions.","Jan 16, 2016, 12:45 AM IST"
Bengal Chamber of Commerce and Industry launches its third certificate course on indirect taxes,http://economictimes.indiatimes.com/industry/services/education/bengal-chamber-of-commerce-and-industry-launches-its-third-certificate-course-on-indirect-taxes/articleshow/50453327.cms,"The course covers excise, customs, GST, service tax, CENVAT credit rules  value added tax, FTP etc. under the overall guidance of Timir Baran Chatterjee.","Jan 5, 2016, 04:18 PM IST"
President Pranab Mukherjee stresses need to arrest declining education standard,http://economictimes.indiatimes.com/industry/services/education/president-pranab-mukherjee-stresses-need-to-arrest-declining-education-standard/articleshow/50520510.cms,"The President said there was a time when India was a key global centre of higher learning with universities like Nalanda, Vikramsila and Taxila flourishing.","Jan 10, 2016, 04:47 PM IST"
Bar Council asks DU to shutdown evening law colleges,http://economictimes.indiatimes.com/industry/services/education/bar-council-asks-du-to-shutdown-evening-law-colleges/articleshow/50519750.cms,"Taking into account that proper quality of legal education cannot be ensured if classes are run during evening hours, the Council has decided to dispense with the evening colleges.","Jan 10, 2016, 03:25 PM IST"
How Agastya International Foundation is creating tomorrow's leaders in rural India,http://economictimes.indiatimes.com/industry/services/education/how-agastya-international-foundation-is-creating-tomorrows-leaders-in-rural-india/articleshow/50513945.cms,"The Foundation imparts science education to children in villages, but more importantly it is grooming tomorrow’s leaders of rural India.","Jan 10, 2016, 10:29 AM IST"
"CAT 2015 results declared today amidst rumours of website being hacked; IIMs, TCS say no leakage, no error",http://economictimes.indiatimes.com/industry/services/education/cat-2015-results-declared-today-amidst-rumours-of-website-being-hacked-iims-tcs-say-no-leakage-no-error/articleshow/50500316.cms,"The results of CAT 2015, gateway for entry into the prestigious IIMs as well as other B-schools, were declared today, a few days earlier than expected.","Jan 8, 2016, 07:25 PM IST"
IIT-Kharagpur offers course in Microbotics,http://economictimes.indiatimes.com/industry/services/education/iit-kharagpur-offers-course-in-microbotics/articleshow/50446113.cms,This is the first time that microbotics and nano-robotic manipulation is taught as a course by an Indian institute the coordinator of the course.,"Jan 5, 2016, 04:54 AM IST"
"Most class X students below par in English, maths: NCERT",http://economictimes.indiatimes.com/industry/services/education/most-class-x-students-below-par-in-english-maths-ncert/articleshow/50478960.cms,The survey also found there were significant differences in scores of students from government and government-aided schools and private schools.,"Jan 7, 2016, 11:44 AM IST"
"Qualcomm, Intel make top offers at IIT-M placement session",http://economictimes.indiatimes.com/industry/services/education/qualcomm-intel-make-top-offers-at-iit-m-placement-session/articleshow/50488243.cms,"Placement session for 2015-16 began on December 1, but was postponed to this month due to the torrential rains in the city.","Jan 7, 2016, 10:45 PM IST"
"More girls study medicine, but your doctor may still be a man",http://economictimes.indiatimes.com/industry/services/education/more-girls-study-medicine-but-your-doctor-may-still-be-a-man/articleshow/50517993.cms,"There is a serious shortage of female doctors in India. According to a research, only 17% of all allopathic doctors and 6% of those in rural areas are women.","Jan 10, 2016, 11:44 AM IST"
IIM Calcutta's annual international business summit 'Intaglio' in full swing,http://economictimes.indiatimes.com/industry/services/education/iim-calcuttas-annual-international-business-summit-intaglio-in-full-swing/articleshow/50499793.cms,Defining entrepreneurship not a start-up business but as a way of thinking. It is all about the consumer at the heart and entrepreneurship in action.,"Jan 8, 2016, 06:36 PM IST"
Government wants to take entrepreneurship lessons to schools,http://economictimes.indiatimes.com/industry/services/education/government-wants-to-take-entrepreneurship-lessons-to-schools/articleshow/50412354.cms,"The government wants to take entrepreneurship lessons to schools, teaching youngsters what it takes to start a business at an early age.","Jan 2, 2016, 05:11 AM IST"
Zydus Cadila CMD Pankaj Ramanbhai Patel appointed chairman of IIM Udaipur,http://economictimes.indiatimes.com/industry/services/education/zydus-cadila-cmd-pankaj-ramanbhai-patel-appointed-chairman-of-iim-udaipur/articleshow/50408536.cms,"Pankaj Ramanbhai Patel, chairman and managing director of the pharmaceutical giant Zydus Cadila, has been appointed chairman of IIM Udaipur.","Jan 1, 2016, 08:19 PM IST"
California-based University of the People planning collaboration with India for online education,http://economictimes.indiatimes.com/industry/services/education/california-based-university-of-the-people-planning-collaboration-with-india-for-online-education/articleshow/50360455.cms,"University of the People, the world’s first non-profit tuition-free varsity, is looking at India as a major destination for students.","Dec 29, 2015, 04:00 AM IST"
UGC requests all universities to implement online admission system by 2016,http://economictimes.indiatimes.com/industry/services/education/ugc-requests-all-universities-to-implement-online-admission-system-by-2016/articleshow/50364649.cms,UGC will review the progress achieved by universities in implementing online admission mode in a meeting during January 2016.,"Dec 29, 2015, 12:21 PM IST"
"Nod for renewal of MoU between India, Canada on education",http://economictimes.indiatimes.com/industry/services/education/nod-for-renewal-of-mou-between-india-canada-on-education/articleshow/50379572.cms,The Cabinet also gave its ex-post facto approval for signing of a Memorandum of Understanding (MoU) among BRICS countries on BRICS Network University.,"Dec 30, 2015, 02:07 PM IST"
IIM Kozhikode to host the 52nd annual conference of Indian Econometric Society,http://economictimes.indiatimes.com/industry/services/education/iim-kozhikode-to-host-the-52nd-annual-conference-of-indian-econometric-society/articleshow/50408144.cms,Indian Institute of Management Kozhikode (IIMK) will be hosting the 52nd Annual Conference of The Indian Econometric Society (TIES) from January 4-6.,"Jan 1, 2016, 07:44 PM IST"
CBSE approval must for students willing to change name: Delhi University,http://economictimes.indiatimes.com/industry/services/education/cbse-approval-must-for-students-willing-to-change-name-delhi-university/articleshow/50423591.cms,"""It is hereby clarified that it is mandatory for students seeking change of name to get his or her name changed from CBSE or state boards first,"" an official communication said.","Jan 3, 2016, 09:18 AM IST"
"UG, PG courses in yoga in varsities from next session?",http://economictimes.indiatimes.com/industry/services/education/ug-pg-courses-in-yoga-in-varsities-from-next-session/articleshow/50424423.cms,The University Grants Commission (UGC) is working on a plan for introduction of undergraduate and postgraduate courses in yoga in universities.,"Jan 3, 2016, 11:28 AM IST"
"IIT-Kanpur terminates failed students; Director says ""it's routine""",http://economictimes.indiatimes.com/industry/services/education/iit-kanpur-terminates-failed-students-director-says-its-routine/articleshow/50367568.cms,"""When terminated students appear before the Senate they will get the chance to continue their studies,"" Deputy Registrar AK Mishra said.","Dec 29, 2015, 04:12 PM IST"
Amity university likely to set up campus in Andhra Pradesh' capital Amravati,http://economictimes.indiatimes.com/industry/services/education/amity-university-likely-to-set-up-campus-in-andhra-pradesh-capital-amravati/articleshow/50371096.cms,"A delegation led by Atul Chauhan, Chancellor and President of Amity University, called on Andhra Pradesh Chief Minister N Chandrababu Naidu at his residence here.","Dec 29, 2015, 09:04 PM IST"
Super 30 founder Anand Kumar moots reality show on Mathematics,http://economictimes.indiatimes.com/industry/services/education/super-30-founder-anand-kumar-moots-reality-show-on-mathematics/articleshow/50279574.cms,"Kumar, who has named his academy in the name of Ramanujan, said there was a growing need to develop interest in mathematics among young students so that they enjoyed studying it.","Dec 22, 2015, 12:22 PM IST"
VIBHA to launch portal for inspiring youth to be innovative,http://economictimes.indiatimes.com/industry/services/education/vibha-to-launch-portal-for-inspiring-youth-to-be-innovative/articleshow/50284008.cms,Vijnana Bharati (VIBHA) will soon launch the nation's first portal that would motivate young students to dabble in innovations and take science as a career option.,"Dec 22, 2015, 05:37 PM IST"
UGC chairman urges varsities to organise workshops,http://economictimes.indiatimes.com/industry/services/education/ugc-chairman-urges-varsities-to-organise-workshops/articleshow/50316409.cms,University Grants Commission (UGC) chairman Ved Prakash today advised universities and institutions of higher education to hold annual workshops.,"Dec 24, 2015, 11:07 PM IST"
Tamil Nadu Open university gives 12-B status,http://economictimes.indiatimes.com/industry/services/education/tamil-nadu-open-university-gives-12-b-status/articleshow/50320390.cms,According to an official document available here the infrastructure of the university had been ugraded and new streams of courses had been introduced.,"Dec 25, 2015, 11:00 AM IST"
Rashtriya Sanskrit Sansthan gets UGC exemption on off-campus centres on HRD ministry's request,http://economictimes.indiatimes.com/industry/services/education/rashtriya-sanskrit-sansthan-gets-ugc-exemption-on-off-campus-centres-on-hrd-ministrys-request/articleshow/50289626.cms,It is not yet clear if government-funded institutions other than the Sanskrit Sansthan will benefit from the exemption or not.,"Dec 23, 2015, 01:30 AM IST"
Education policy: NCERT discusses theme of Indian ancient knowledge in national meet,http://economictimes.indiatimes.com/industry/services/education/education-policy-ncert-discusses-theme-of-indian-ancient-knowledge-in-national-meet/articleshow/50279936.cms,A senior NCERT official said theme on ancient knowledge system has also made its way to the apex national committee that will finalise the policy by early 2016.,"Dec 22, 2015, 12:44 PM IST"
Indian higher education centres must proactively highlight credentials: Pranab Mukherjee,http://economictimes.indiatimes.com/industry/services/education/indian-higher-education-centres-must-proactively-highlight-credentials-pranab-mukherjee/articleshow/50282828.cms,"He said that the newer universities, through a sustained effort at better academic management, can soon be in the reckoning in global rankings.","Dec 22, 2015, 04:09 PM IST"
Bengaluru University eyes income by growing mushroom on campus,http://economictimes.indiatimes.com/industry/services/education/bengaluru-university-eyes-income-by-growing-mushroom-on-campus/articleshow/50278272.cms,"Bangalore University has set its eyes on mushroom cultivation on its 1,100-acre campus in Jnana Bharathi to earn some additional income.","Dec 22, 2015, 10:48 AM IST"
'Indian Universities should improve quality of teaching',http://economictimes.indiatimes.com/industry/services/education/indian-universities-should-improve-quality-of-teaching/articleshow/50287032.cms,"Vice-Chancellor of University of Technology, Papua New Guinea, Dr Albert Schram suggested that Indian universities must improve the quality of teaching, research and extension on par with global standards.","Dec 22, 2015, 09:44 PM IST"
Indians flock to US 'educational warehouses',http://economictimes.indiatimes.com/industry/services/education/indians-flock-to-us-educational-warehouses/articleshow/50292988.cms,"The 19 students who were offloaded from an Air India flight in Hyderabad on Sunday, when they were on their way to US were clearly coming to an educational warehouse.","Dec 23, 2015, 11:23 AM IST"
American University announces APJ Abdul Kalam Fellowship for Indian students,http://economictimes.indiatimes.com/industry/services/education/american-university-announces-apj-abdul-kalam-fellowship-for-indian-students/articleshow/50230136.cms,"Fellowship worth $156,000 will be awarded to deserving candidates from India wishing to pursue PhD study at the University of South Florida.","Dec 18, 2015, 12:40 PM IST"
"Advised to pass my term quietly, not an option for me: Valson Thampu",http://economictimes.indiatimes.com/industry/services/education/advised-to-pass-my-term-quietly-not-an-option-for-me-valson-thampu/articleshow/50253652.cms,"Thampu has been quite vocal in his allegations about the college being subjected to a ""harassment"" by certain alumni and teachers.","Dec 20, 2015, 12:09 PM IST"
