Heading,Summary,Link,PostedBy,PostedOnDate
"Literacy rate at 71 pct in rural India, 86 pct in urban: NSSO survey","Among the age group of seven year and above, the male literacy rate was registered at 83 per cent vis-a-vis the female literacy rate of 67 per cent, an official statement said. ",http://www.financialexpress.com/jobs/literacy-rate-at-71-pct-in-rural-india-86-pct-in-urban-nsso-survey/94207/,PTI ," July 3, 2015 3:46 PM"
"DU second cut off 2015: Delhi University announces 2nd cut off list, marginal drop in few courses","DU second cut off 2015: Delhi University on Monday announced the second cut-off list for admission to its undergraduate programmes, with a marginal drop in its percentages…",http://www.financialexpress.com/jobs/du-cut-off-2015-delhi-university-announces-second-cut-off-list-marginal-drop-in-few-courses/92029/,PTI ," June 30, 2015 12:42 PM"
No arbitrariness in revised MBBS CET merit list: IP Univ to HC,"The Guru Gobind Singh Indraprastha University today defended its revised results and merit list of its medical common entrance test (CET) before Delhi High Court, after a student challenged the results as her rank dropped 77 positions despite her marks increasing”.",http://www.financialexpress.com/jobs/no-arbitrariness-in-revised-mbbs-cet-merit-list-ip-univ-to-hc/91809/,PTI ," June 30, 2015 5:15 AM"
Powering education with mobile technology,"In many ways, mobile technology is motivating the younger generation to use modern gadgets for learning purposes",http://www.financialexpress.com/jobs/powering-education-with-mobile-technology/91347/,Girish Dhanakshirur ," June 29, 2015 12:55 AM"
"Education can bring down hate crimes, say U.S. Congressmen","Expressing concern over the rising incidents of hate crimes in the country, U.S. Congressmen say that education can play a pivotal role in curbing this scourge.",http://www.financialexpress.com/jobs/education-can-bring-down-hate-crimes-say-u-s-congressmen/91811/,ANI ," June 30, 2015 2:05 AM"
JEE ranks announcement delay gives anxious moments to students,"The delay in the announcement of JEE (Main) ranks for paper-I and paper-II has led to the postponement of admission to IITs and NITs, raising anxiety among students”.",http://www.financialexpress.com/jobs/jee-ranks-announcement-delay-gives-anxious-moments-to-students/92507/,PTI ," July 1, 2015 9:14 AM"
Smriti Irani opens national conference for yoga teachers,"Union Minister of Human Resource Development Smriti Irani today dedicated to the nation syllabus and course material for class VIth to Xth prepared by NCERT and training modules for teacher education programmes at the level of Diploma, BEd or MEd degrees prepared by NCTE on yoga.",http://www.financialexpress.com/jobs/smriti-irani-opens-national-conference-for-yoga-teachers/88520/,ANI ," June 22, 2015 10:35 PM"
On the shelf,"The first Dalit autobiography to be published, Baluta caused a sensation when it first appeared, in Marathi, in 1978. ",http://www.financialexpress.com/jobs/on-the-shelf-25/87907/,NA,"June 21, 2015 12:07 AM"
Solar Charkha to generate jobs for women,"The solar charkha has revolutionised India’s Khadi sector in terms of improved technology, and now, according to the government, it has the potential to generate more jobs for women.",http://www.financialexpress.com/jobs/solar-charkha-to-generate-jobs-for-women/90470/,ANI ," June 27, 2015 7:00 AM"
Twiterrati troll DU’s ‘bizarre’ cut off list,"While scores of Delhi University aspirants were left disappointed with the first cut-off list soaring beyond a perfect 100 for a few courses, Twitter was abuzz with trolls on the “bizarre” ceiling.",http://www.financialexpress.com/jobs/twiterrati-troll-dus-bizarre-cut-off-list/90055/,PTI ," June 25, 2015 7:17 PM"
IIT Madras Mentors Two New IITs – IIT Palakkad and IIT Tirupati,Both the new IITs commence admissions for the academic year 2015-2016,http://www.financialexpress.com/jobs/iit-madras-mentors-two-new-iits-iit-palakkad-and-iit-tirupati/89758/,NA,"June 25, 2015 9:57 AM"
Top 10 Fiction and Non-fiction,Top 10 Fiction and Non-fiction,http://www.financialexpress.com/jobs/top-10-fiction-and-non-fiction-9/87908/,NA,"June 21, 2015 12:08 AM"
Top 10 Fiction and Non-fiction books,Top 10 Fiction and Non-fiction books,http://www.financialexpress.com/jobs/top-10-fiction-and-non-fiction-books-9/91059/,NA,"June 28, 2015 12:08 AM"
"Now, IIT Kharagpur all set to offer MBBS courses, produce doctors","Going beyond engineering, IIT Kharagpur would soon start offering MBBS courses as well.",http://www.financialexpress.com/jobs/now-iit-kharagpur-all-set-to-offer-mbbs-courses-produce-doctors/88359/,PTI ," June 22, 2015 11:14 AM"
"JEE Main 2015: CBSE issues notice; rank list to be released, check on jeemain.nic.in","JEE Main 2015: Joint Entrance Examination (JEE) (Main) ranks will be released tomorrow, i.e. June 25 by Central Board of Secondary Education (CBSE). The students will be able to check their ranks on the official website of JEE Main 2015 i.e. jeemain.nic.in.",http://www.financialexpress.com/jobs/jee-main-2015-cbse-issues-notice-rank-list-to-be-released-tomorrow/89557/,Anshul ," June 28, 2015 3:33 PM"
Gujarat’s Last Rajput King Karan Ghelo: A king’s life,A translation of the first novel of Gujarati literature tells the story of the Vaghela dynasty ,http://www.financialexpress.com/jobs/gujarats-last-rajput-king-karan-ghelo-a-kings-life/91058/,Anirudh Vohra ," June 28, 2015 12:06 AM"
JEE Advanced exam 2015: Seven students from MP get into IIT,"Besides securing top position in IIT-JEE Advanced-2015 in the country, Madhya Pradesh’s seven tribal students studying in various government schools have also secured a berth for themselves in the prestigious Indian Institute of Technology (IIT).",http://www.financialexpress.com/jobs/jee-advanced-exam-2015-seven-students-from-mp-get-into-iit/88787/,PTI ," June 23, 2015 9:52 AM"
Orphan boy in Kashmir unable to pay IIT counselling fee,"After cracking the prestigious Indian Institute of Technology (IIT) with active support from Army under ‘Sadhbhavana project’ this month, a militancy-victim from north Kashmir might be forced to forgo his seat as he is unable to pay the counselling fee of Rs 10,000.",http://www.financialexpress.com/jobs/orphan-boy-in-kashmir-unable-to-pay-iit-counselling-fee/90881/,PTI ," June 27, 2015 5:06 PM"
Honing our biggest human resource,Undertaking specific skill development measures for rural India would mean a far more efficient utilisation of India’s human resources,http://www.financialexpress.com/jobs/honing-our-biggest-human-resource/88215/,Ajay Chhangani ," June 22, 2015 12:02 AM"
"Cut offs ‘unrealistically’ high, but seats aplenty: DU",Delhi University today accepted that its first cut-off list is “unrealistically” high in order to avoid “over-admissions”…,http://www.financialexpress.com/jobs/cut-offs-unrealistically-high-but-seats-aplenty-du/90992/,PTI ," June 27, 2015 9:05 PM"
AIPMT 2015 re-test to be conducted on July 25: CBSE,"AIPMT 2015 re-test: The All India Pre-Medical and Pre-Dental Test (AIPMT), 2015 will be re-conducted on July 25, CBSE said today.",http://www.financialexpress.com/jobs/aipmt-2015-re-test-to-be-conducted-on-july-25-cbse/89140/,PTI ," June 23, 2015 6:57 PM"
DU cut off 2015: Delhi University 1st cut-off touches 100 per cent mark; check www.du.ac.in,Delhi University on Thursday published first cut off lists (DU cut off 2015) for admission to various undergraduate programmes of the University of Delhi for the academic year 2015-16 on its website www.du.ac.in.,http://www.financialexpress.com/jobs/du-cut-off-2015-delhi-university-1st-cut-off-touches-100-per-cent-mark/89817/,FE Online ," June 25, 2015 1:08 PM"
Govt okays setting up of 6 new IIMs,"In good news for MBA aspirants, the government today cleared the proposal for the setting up of six new IIMs in the country, which will start offering courses from the coming academic session itself.",http://www.financialexpress.com/jobs/govt-okays-setting-up-of-6-new-iims/89585/,PTI ," June 25, 2015 9:25 AM"
Creating a workplace which breeds innovation,"IT Industry in India is at $119 billion at present, following a growth rate of 12% in the year 2014-15.",http://www.financialexpress.com/jobs/creating-a-workplace-which-breeds-innovation/88952/,NA,"June 23, 2015 1:30 PM"
Need for including entrepreneurship in educational syllabi: APJ Abdul Kalam,Former President APJ Abdul Kalam today called for the inclusion of entrepreneurship in the educational curricula…,http://www.financialexpress.com/jobs/need-for-including-entrepreneurship-in-educational-syllabi-apj-abdul-kalam/87933/,PTI ," June 21, 2015 5:30 AM"
UK and India in education: Learning from each other,UK’s experience with education can come in handy for the Skill India initiative,http://www.financialexpress.com/jobs/uk-and-india-in-education-learning-from-each-other/88217/,Richard Heald ," June 22, 2015 12:03 AM"
The Emergency book review: All of Indira’s men & women,A chilling account of how they ganged up to take democracy away from India,http://www.financialexpress.com/jobs/the-emergency-book-review-all-of-indiras-men-women/91049/,Pratap Bhanu Mehta ," June 28, 2015 12:04 AM"
Kaleidoscope City book review: Broken city,"THIS SLIM book packs a punch, touching on all aspects of that fascinating old city, Varanasi or Banaras or Kashi, as we like to call her.",http://www.financialexpress.com/jobs/kaleidoscope-city-book-review-broken-city/91057/,Sudipta Datta ," June 28, 2015 12:05 AM"
"DU admission: Cut-offs soar beyond perfect 100, thousands disappointed","While the steep cut-offs for UG courses in DU has caused widespread dismay amongst students, the soaring of the eligibility bar for some of them…",http://www.financialexpress.com/jobs/du-admission-cut-offs-soar-beyond-perfect-100-thousands-disappointed/90025/,PTI ," June 25, 2015 10:11 PM"
Narendra Modi reviews progress of Sarva Shiksha Abhiyan at high-level meeting,"Prime Minister Narendra Modi on Monday reviewed the progress of the Sarva Shiksha Abhiyan at a high-level meeting in the national capital, calling for each school in the country to plan its own targets to achieve by 2022.",http://www.financialexpress.com/jobs/narendra-modi-reviews-progress-of-sarva-shiksha-abhiyan-at-high-level-meeting/88639/,ANI ," June 23, 2015 8:32 AM"
Why soft skills matter,"Critical thinking, interpersonal skills, empathy, active listening, dealing with conflicts—these are not just words, but the qualities needed to be successful in any organisation",http://www.financialexpress.com/jobs/why-soft-skills-matter/88220/,Puneet Rathi ," June 22, 2015 12:04 AM"
Indian Railways optic fibre network to be tapped to train youths: Rudy,"Union Minister for Skill Development and Entrepreneurship Rajiv Pratap Rudy today revealed that a “big agreement” with the Railways was in the offing to tap its 43,000 km-long optic fibre network to train the country’s youth in computer and internet-related skills.",http://www.financialexpress.com/jobs/indian-railways-optic-fibre-network-to-be-tapped-to-train-youths-rudy/90882/,PTI ," June 27, 2015 5:00 PM"
Reports of transfer of Joint Secretaries ‘baseless and misleading’: MEA,The External Affairs Ministry’s spokesman Vikas Swarup on Friday termed the reports of the transfer of the joint secretaries as baseless and misleading.,http://www.financialexpress.com/jobs/reports-of-transfer-of-joint-secretaries-baseless-and-misleading-mea/87398/,ANI ," June 20, 2015 6:30 AM"
Supreme Court directs CBSE to declare AIPMT exam results by August 17,The Supreme Court on Friday refused to accede to the Central Board of Secondary Examination (CBSE)’s demand to grant them four months time to conduct the AIPMT entrance exam and directed the latter to conduct the test and declare results by August 16.,http://www.financialexpress.com/jobs/supreme-court-directs-cbse-to-declare-aipmt-exam-results-by-august-16/87197/,ANI ," June 19, 2015 1:56 PM"
TS PGECET exam result 2015 declared; check results on tspgecet.org,TS PGECET exam result 2015: Osmania University on behalf of Telangana State Council of Higher Education (TSCHE) declared TS PGECET exam result 2015 on Thursday.,http://www.financialexpress.com/jobs/ts-pgecet-exam-result-2015-declared-check-tspgecet-org/86789/,Anshul ," June 18, 2015 4:41 PM"
AIIMS MBBS result 2015 declared; check cut off list on aiimsexams.org,AIIMS MBBS result 2015: AIIMS MBBS Entrance Exam 2015 Result is out. The result can be downloaded from its official website www.aiimsexams.org. ,http://www.financialexpress.com/jobs/aiims-mbbs-result-2015-declared-check-results-on-aiimsexams-org/86816/,Anshul ," June 20, 2015 11:17 AM"
"Tamil Nadu schoolgirls made to clean toilet; NHRC for action against Head Mistress; may offer Rs 25,000 relief","The National Human Rights Commission (NHRC) has asked the Tamil Nadu Government to explain why Rs.25 thousand should not be paid as relief to the two girl students of Panchayat Union Middle School in Tirunelveli, who were made to clean toilet by the Head Mistress.",http://www.financialexpress.com/jobs/tamil-nadu-schoolgirls-made-to-clean-toilet-nhrc-for-action-against-head-mistress-may-offer-rs-25000-relief/86379/,ANI ," June 17, 2015 4:11 PM"
"Outreach Programme for promoting PMKVY scheme launched, aims to skill 2.4 mn youth","In a bid to mobilise underpriviledged youth for skills training, COAI and Centum Learning announced the pilot launch of a massive Outreach Programme.",http://www.financialexpress.com/jobs/outreach-programme-for-promoting-pmkvy-scheme-launched-aims-to-skill-2-4-mn-youth/86943/,FE Online ," June 18, 2015 5:55 PM"
"Rupee, debt play to Janet Yellen tune","After US Fed keeps tone dovish, Rupee rises 39 p to over two-week high, bonds rally",http://www.financialexpress.com/jobs/rupee-debt-play-to-yellen-tune/87013/,Agencies ," June 19, 2015 5:21 AM"
Govt invests Rs 80 cr to upgrade FTII,"The FTII is in the midst of upgrading infrastructure, equipment and syllabus and the government is investing Rs 80 crore in upgrading the institute, D J Narain said.",http://www.financialexpress.com/jobs/govt-invests-rs-80-cr-to-upgrade-ftii/87470/,FE Bureau ," June 20, 2015 12:10 AM"
Delhi University admission: Sports quota fitness trials to begin Thursday,"The centralised fitness trials for admission to Delhi University’s undergraduate courses through sports quota will begin tomorrow, with the varsity taking strict measures to avoid any “bias” and “ensure transparency” in the selection procedure”.",http://www.financialexpress.com/jobs/delhi-university-admission-sports-quota-fitness-trials-to-begin-thursday/86528/,PTI ," June 18, 2015 9:48 PM"
Looking Away book review: Charity’s paradox,"Can love, empathy and public compassion be fashioned out into instruments of social and political resistance, justice and social transformation?",http://www.financialexpress.com/jobs/looking-away-book-review-charitys-paradox/87903/,NA,"June 21, 2015 12:05 AM"
Rail Board expresses regret over inconvenience to passengers in Itarsi rail accident,"Rail Board PRO Anil Saxena on Thursday expressed regret over the inconvenience caused to the passengers in the recent train accident at Itarsi railway station, saying that senior officials of Bhopal division and Jabalpur zone and all other teams are fighting round the clock to normalise the situation at the earliest by restoring the signalling system and point and switch system.",http://www.financialexpress.com/jobs/rail-board-expresses-regret-over-inconvenience-to-passengers-in-itarsi-rail-accident/86931/,ANI ," June 18, 2015 7:09 PM"
"Beno Zephine, first visually impaired IFS officer, wants more books for visually handicapped","Beno Zephine, first visually impaired IFS officer from Tamil Nadu, on Thursday said that efforts should be made for the availability of books, meant for competitive exams in accessible formats in terms of audio and Braille.",http://www.financialexpress.com/jobs/beno-zephine-first-visually-impaired-ifs-officer-wants-more-books-for-visually-handicapped/86956/,ANI ," June 18, 2015 7:05 PM"
St Stephen’s blames marking in boards for high cut-offs,"St Stephen’s has received a record 32,100 applications for 400 seats, highest in the college’s history.",http://www.financialexpress.com/jobs/st-stephens-blames-marking-in-boards-for-high-cut-offs/86527/,PTI ," June 18, 2015 6:53 PM"
Here’s why sudden boost in status at work isn’t all positive,"As per a new study, sudden boost in status at work, which changes you from a largely ignored worker to someone that others turn to for advice and help, may not be all good.",http://www.financialexpress.com/jobs/heres-why-sudden-boost-in-status-at-work-isnt-all-positive/86376/,ANI ," June 17, 2015 4:04 PM"
"AIPMT 2015 exam re-conduct: Supreme Court extends time, directs CBSE to declare results by August 17","AIPMT 2015 exam re-conduct: Supreme Court extends time for conducting exam, directs CBSE to declare results by August 17.",http://www.financialexpress.com/jobs/supreme-court-agrees-to-hear-cbse-plea-seeking-more-time-to-re-conduct-aipmt-2015-exam/86724/,FE Online ," June 19, 2015 1:58 PM"
"IIM-A bats for autonomy, wants govt to ‘oversee from a distance’","IIM-A director Ashish Nanda asked the government to oversee their functioning ‘from a distance, support them by rewarding and ask questions if something is not right’.",http://www.financialexpress.com/jobs/iim-a-bats-for-autonomy-wants-govt-to-oversee-from-a-distance/87029/,FE Bureau ," June 19, 2015 3:21 AM"
"At 23, Sarthak Ahuja possibly youngest Indian to get CA, CS, CMA degrees","Sarthak Ahuja of Delhi has possibly become the youngest in India to have passed the chartered accountancy, company secretary, cost and management accountancy courses, as well as a graduate degree in bachelors of finance and investment analysis from the Shaheed Sukhdev College of Business Studies, University of Delhi, all by the age of 23.",http://www.financialexpress.com/jobs/at-23-sarthak-ahuja-possibly-youngest-indian-to-get-ca-cs-cma-degrees/87273/,ANI ," June 19, 2015 4:02 PM"
"BSEB Bihar Board 10th result 2015 declared, check at biharboard.ac.in; find highlights here","Bihar Board 10th result 2015: Bihar Board class 10th result 2015 was declared yesterday i.e. on 20th June, 2015 at 4 pm on Bihar School Examination Board (BSEB) official website biharboard.ac.in.",http://www.financialexpress.com/jobs/bihar-board-class-10th-result-2015-to-be-declared-today-check-biharboard-ac-in/87555/,FE Online ," June 21, 2015 4:52 PM"
Brave New Bollywood book review: The hit list,In Brave New Bollywood—a fascinating ride—contemporary filmmakers give us a peek into why they make the films they do ,http://www.financialexpress.com/jobs/brave-new-bollywood-book-review-the-hit-list/87906/,Sudipta Datta ," June 21, 2015 12:06 AM"
AIPMT 2015: SC directs CBSE to declare AIPMT exam result by August 17,The Supreme Court had on June 15 scrapped the AIPMT-2015 and had ordered re-conduct of the examination within four weeks. ,http://www.financialexpress.com/jobs/aipmt-sc-directs-cbse-to-declare-aipmt-2015-result-by-august-17/87456/,PTI ," August 16, 2015 10:57 PM"
Here’s what fishes have to offer about ‘leadership’,"As per a new study, good leaders needing to strike a balance between striving to reach goals and keeping their followers with them has deep evolutionary roots.",http://www.financialexpress.com/jobs/heres-what-fishes-have-to-offer-about-leadership/86855/,ANI ," June 19, 2015 3:05 AM"
Expect a 10.8% salary hike in 2015: Report,"According to 2015-16 Asia Pacific Salary Budget Planning report, India is clearly the front-runner with a 10.8 per cent average salary increase",http://www.financialexpress.com/jobs/expect-a-10-8-salary-hike-in-2015-report/86900/,PTI ," June 18, 2015 4:55 PM"
Demand for yoga instructors likely to increase by 35 percent: ASSOCHAM,"The increased focus on yoga by Prime Minister Narendra Modi and his government, coupled with growing awareness about the traditional Indian ways of dealing with stress in the corporate sector has improved job opportunities in yoga training with commensurate demand for trainers set to grow by 30-35 percent in the couple of years, according to an ASSOCHAM paper.",http://www.financialexpress.com/jobs/demand-for-yoga-instructors-likely-to-increase-by-35-percent-assocham/87256/,ANI ," June 19, 2015 2:06 PM"
Here’s why male negotiators get better deal by ‘chit chatting’,A team of researchers has explained how small talk before a negotiation impacts perceptions and outcomes.,http://www.financialexpress.com/jobs/heres-why-male-negotiators-get-better-deal-by-chit-chatting/86882/,ANI ," June 19, 2015 4:30 AM"
DoPT felicitates visually impaired girl joining IFS,"Minister of State in the Prime Minister’s Office Dr. Jitendra Singh on Thursday felicitated Beno Zephine, the young girl from Tamil Nadu, who has made history as a fully visually challenged candidate joining the Indian Foreign Service (IFS) here on behalf of the Department of Personnel and Training (DoPT).",http://www.financialexpress.com/jobs/dopt-felicitates-visually-impaired-girl-joining-ifs/87002/,ANI ," June 19, 2015 8:36 AM"
IIT JEE Advanced 2015 results declared; check latest on jeeadv.iitb.ac.in; find results highlights here,JEE Advanced 2015 results: The Joint Entrance Examination (JEE) Advanced 2015 results have been announced on Monday and are now available on the official website jeeadv.iitb.ac.in. ,http://www.financialexpress.com/jobs/iit-jee-advanced-2015-results-declared-check-results-on-jeeadv-iitb-ac-in-for-rank-and-marks/86597/,FE Online ," June 19, 2015 9:00 AM"
"India does not need new education policy, ask experts",Some of India’s most renowned education experts have reportedly opined that there is very little evidence to back the government’s decision to revamp the nation’s education policy.,http://www.financialexpress.com/jobs/india-does-not-need-new-education-policy-ask-experts/87252/,ANI ," June 19, 2015 2:12 PM"
Ahmedabad’s albatross,"Ahmedabad could be any other city in the country, or the world, but its shortcomings become all the more stark in context of the violence it has faced",http://www.financialexpress.com/jobs/ahmedabads-albatross/84441/,NA,"June 14, 2015 12:06 AM"
AIPMT 2015: SC directs CBSE to conduct AIPMT exam in four weeks,AIPMT 2015: Supreme Court on Monday set aside the All India Pre Medical Test (AIPMT) entrance exam and directed the Central Board of Secondary Education (CBSE) to re-conduct the exam in four weeks.,http://www.financialexpress.com/jobs/aipmt-2015-sc-directs-cbse-to-conduct-aipmt-exam-in-four-weeks/84901/,ANI ," June 15, 2015 3:33 PM"
"AIPMT 2015: SC judgement on AIPMT is a blow to all ‘Munnabhais’ of India, says lawyer","AIPMT 2015: Hailing the decision by the Supreme Court to set aside the All India Pre Medical Test (AIPMT) entrance exam, advocate for the petitioner Pushp Gupta on Monday said this ruling will ensure that deserving candidates do not miss out due to the ‘Munnabhais’ of India, in reference to the Sanjay Dutt-starrer.",http://www.financialexpress.com/jobs/aipmt-2015-sc-judgement-on-aipmt-is-a-blow-to-all-munnabhais-of-india-says-lawyer/84889/,ANI ," June 15, 2015 1:21 PM"
L.N Mithila University cancels exam after video of mass cheating,The L.N Mithila University has cancelled the B.Sc third year examinations after a video went viral of mass cheating in a women’s college in Bihar’s Samastipur.,http://www.financialexpress.com/jobs/l-n-mithila-university-cancels-exam-after-video-of-mass-cheating/84373/,ANI ," June 14, 2015 6:55 AM"
CBSE notification soon for fresh AIPMT test,"CBSE will soon issue a notification for a fresh conduct of All India Pre-Medical Test 2015-16 and preparations have started for the test despite shortage of time, said a CBSE official”.",http://www.financialexpress.com/jobs/cbse-notification-soon-for-fresh-aipmt-test/85919/,ANI ," June 16, 2015 11:30 PM"
"AIPMT 2015: SC cancels AIPMT exam, orders fresh examination in 4 weeks",AIPMT 2015: Supreme Court directs CBSE to re-conduct All India Pre-Medical Test 2015 within four weeks. ,http://www.financialexpress.com/jobs/aipmt-supreme-court-directs-re-conduct-of-aipmt-exam-gives-cbse-4-week-deadline/84871/,PTI ," June 16, 2015 8:18 AM"
"Delhi University admissions: Record 3.2-L applications pour in for 54,000 DU UG seats","Delhi University has received a record 3.2 lakh applications for admission to its undergraduate courses, an increase of around 50,000 over last year.",http://www.financialexpress.com/jobs/delhi-university-admissions-record-3-2-l-applications-pour-in-for-54000-du-ug-seats/85978/,PTI ," June 17, 2015 8:15 AM"
Indian Statistical Institute chief Bimal Roy removed on graft charges,"Bimal Roy, Director of the prestigious Indian Statistical Institute (ISI) has been removed from the post…",http://www.financialexpress.com/jobs/indian-statistical-institute-chief-bimal-roy-removed-on-graft-charges/84302/,PTI ," June 13, 2015 7:59 PM"
"Jammu and Kashmir: After AIIMS, Valley demands IIT, IIM","Days after the state government announced setting up of proposed AIIMS in both divisions of Jammu and Kashmir, various social, political and religious bodies demanded setting up an IIT, IIM and IIMC for the Valley to end the “regional imbalance” and ensure equitable progress in the state.",http://www.financialexpress.com/jobs/jammu-and-kashmir-after-aiims-valley-demands-iit-iim/84399/,PTI ," June 14, 2015 5:15 AM"
