Heading,Summary,Link,PostedBy,PostedOnDate
"Online educator Udacity partners Google, launches Android Basics courses for beginners",Online education company Udacity has partnered with Google to introduce new Android Basics Nanodegree program for beginners. It will enable a complete beginner to be able to turn his idea into an actual app.,http://www.financialexpress.com/jobs/online-educator-udacity-partners-google-launches-android-basics-courses-for-beginners/295361/,FE Online ," June 24, 2016 9:24 AM"
The impact of Brexit on students planning to study in the UK,Brexit might have some implications for the education sector in India.,http://www.financialexpress.com/jobs/the-impact-of-brexit-on-students-planning-to-study-in-the-uk/297551/,Radhakrishna Aithal ," June 27, 2016 8:25 AM"
34 percent Muslim children have no access to pre-school: UNICEF,The UNICEF report stressed that poverty was a huge obstacle in ensuring literacy among women as marriage often cuts short their pursuit for education.,http://www.financialexpress.com/jobs/34-percent-muslim-children-have-no-access-to-pre-school-unicef/300076/,PTI ," June 28, 2016 8:32 PM"
"RRB NTPC results 2016 declaration to take time, still being processed: Check details at indianrailways.gov.in","RRB NTPC result 2016: Railway Recruitment Board (RRB) Allahabad in a notification released on indianrailways.gov.in clarified that the RRB NTPC results 2016 are under process. In this notification dated June 21, the board also said the latest position in this regard will be issued in next 15 days.",http://www.financialexpress.com/jobs/rrb-ntpc-results-2016-declaration-to-take-time-still-being-processed-check-details-at-indianrailways-gov-in/298356/,Anshul ," June 27, 2016 4:12 PM"
Coal terminal plan pits jobs against environmental concerns,An Oakland city council hearing to determine whether rail shipments of coal would pose a public health hazard started Monday night with an audience packed with supporters…,http://www.financialexpress.com/jobs/coal-terminal-plan-pits-jobs-against-environmental-concerns-2/299370/,Associated Press ," June 28, 2016 1:00 PM"
"Book Review – Nawabs, Nudes, Noodles: India Through 50 Years of Advertising",Ambi Parameswaran’s book provides a window to changing consumer landscape through iconic ad campaigns released over the past 50 years,http://www.financialexpress.com/jobs/book-review-nawabs-nudes-noodles-india-through-50-years-of-advertising/297067/,Ankita Rai ," June 26, 2016 8:56 AM"
Afghan Resource Centre in JNU to enhance Indo-Afghan relations,"With an aim to boost studies on India-Afghanistan relations, an Afghan Resource Centre was recently established at Delhi’s Jawaharlal Nehru University.",http://www.financialexpress.com/jobs/afghan-resource-centre-in-jnu-to-enhance-indo-afghan-relations/300560/,ANI ," June 29, 2016 12:53 PM"
Jamia Millia Islamia’s journalism school rated ‘best’ in India,The journalism school of Jamia Milia Islamia has been rated as the best in India by a weekly after a countrywide survey.,http://www.financialexpress.com/jobs/jamia-millia-islamias-journalism-school-rated-best-in-india/298219/,IANS ," June 27, 2016 2:37 PM"
"Book Review – Dark Territory: The Secret History of Cyber War; peek into the past, present & future",Chronicles of cyber warfare over the years,http://www.financialexpress.com/jobs/book-review-dark-territory-the-secret-history-of-cyber-war-peek-into-the-past-present-future/297068/,Nitin Sreedhar ," June 26, 2016 6:07 AM"
US bank JPMorgan says UK jobs could move abroad,US investment bank JPMorgan Chase today warned that it could relocate UK jobs abroad following Britain’s vote to leave the European Union.,http://www.financialexpress.com/jobs/us-bank-jpmorgan-says-uk-jobs-could-move-abroad/296219/,AFP ," June 24, 2016 7:17 PM"
ON THE SHELF,"The Sellout: A biting satire about a young man’s isolated upbringing and the race trial that sends him to the Supreme Court, the book challenges the sacred tenets of the US Constitution, urban life, the civil rights movement, the father-son relationship, and the holy grail of racial equality—the black Chinese restaurant.",http://www.financialexpress.com/jobs/on-the-shelf-75/297069/,FE Bureau ," June 26, 2016 6:08 AM"
Green neighbourhood Another reason to love green space: It cuts teen violence,"Teenagers living in neighbourhoods with more greenery may have less aggressive behaviours, suggests a new study. ",http://www.financialexpress.com/jobs/green-neighbourhood-another-reason-to-love-green-space-it-cuts-teen-violence/300379/,ANI ," June 29, 2016 10:34 AM"
"Rajasthan Public Service Commission receives record 4,09,516 applications","Over four lakh candidates have applied for Rajasthan State and Subordinate Service Combined Exam 2016 (RAS), the highest in its history, an official claimed today.",http://www.financialexpress.com/jobs/rajasthan-public-service-commission-receives-record-409516-applications/298495/,PTI ," June 27, 2016 5:15 PM"
Indian institutions allowed to tie up with foreign centres in UG: Smriti Irani,Union HRD Minister Smriti Irani today said for the first time Indian educational institutions were allowed to tie up with foreign institutions for under-graduate courses.,http://www.financialexpress.com/jobs/indian-institutions-allowed-to-tie-up-with-foreign-centres-in-ug-smriti-irani/300123/,PTI ," June 28, 2016 9:46 PM"
Women in low-cut tops more likely to land job interview: Study,Women who wear a low-cut dress in a job application photograph may have a dramatically higher chance of being called for an interview…,http://www.financialexpress.com/jobs/women-in-low-cut-tops-more-likely-to-land-job-interview-study/299515/,PTI ," June 28, 2016 2:29 PM"
"Crisil, Teri, PwC vying for consultant’s job in New and Renewable Energy Ministry","Eight entities, including Crisil, Teri and PwC are in race to become consultant for New and Renewable Energy Ministry for vetting proposals for small hydro projects of up to 25 MW.",http://www.financialexpress.com/jobs/crisil-teri-pwc-vying-for-consultants-job-in-new-and-renewable-energy-ministry/298382/,PTI ," June 27, 2016 4:30 PM"
Online education firm Coursera keen to partner with Indian companies,Online education firm Coursera is focussing on partnering Indian enterprises for corporate learning solutions as part of its efforts to expand its presence in the country.,http://www.financialexpress.com/jobs/online-education-firm-coursera-keen-to-partner-with-indian-companies/297138/,PTI ," June 26, 2016 10:45 AM"
AIADMK wants central team to look into pvt medical colleges,"Expressing shock over the seizure of Rs 80 crore during an IT raid on a prominent institution, AIADMK today urged the Centre to depute a high-powered….",http://www.financialexpress.com/jobs/aiadmk-wants-central-team-to-look-into-pvt-medical-colleges/296905/,PTI ," June 25, 2016 3:51 PM"
"President Pranab Mukherjee tells IIT, IISc-Bangalore and IISER scholars to make India great","President Pranab Mukherjee met thirteen Scholars of IITs, IISc-Bangalore and IISERs attending ‘In-Residence’ Programme at Rashtrapati Bhavan today.",http://www.financialexpress.com/jobs/president-pranab-mukherjee-tells-iit-iisc-bangalore-and-iiser-scholars-to-make-india-great/295024/,ANI ," June 23, 2016 7:31 PM"
Rahul Gandhi congratulates visually-impaired girl for exam results,"Rahul Gandhi has congratulated the Bengaluru college girl, whose initiative along with another differently-abled girl resulted in the removal of import duty on Braille paper, on passing B Com with distinction.",http://www.financialexpress.com/jobs/rahul-gandhi-congratulates-visually-impaired-girl-for-exam-results/293897/,PTI ," June 22, 2016 11:55 PM"
High levels of education may up brain tumour risk: Study,"A university degree may be linked to an increased risk of developing a brain tumour, according to a new study which found that gliomas were more common among people who had studied at college for at least three years.",http://www.financialexpress.com/jobs/high-levels-of-education-may-up-brain-tumour-risk-study/293026/,PTI ," June 22, 2016 1:04 PM"
Arvind Kejriwal launches portal to facilitate education loan to students,Delhi Chief Minister Arvind Kejriwal today launched an online portal to facilitate loans to financially weak students who wish to pursue higher studies in the national capital after passing their Class XII examination. ,http://www.financialexpress.com/jobs/arvind-kejriwal-launches-portal-to-facilitate-education-loan-to-students/291244/,PTI ," June 20, 2016 9:52 PM"
India offers fully funded courses to Commonwealth citizens,"India has started fully-funded training courses for Commonwealth citizens across a range of areas, including rural development, renewable energy and IT, under a programme…",http://www.financialexpress.com/jobs/india-offers-fully-funded-courses-to-commonwealth-citizens/294297/,PTI ," June 23, 2016 11:36 AM"
"Aadhaar to be linked with caste, domicile certificates","All state governments have been asked to link Aadhaar with caste and domicile certificates to be issued to school students, as part of a first-of-its-kind initiative by the Centre.",http://www.financialexpress.com/jobs/aadhaar-to-be-linked-with-caste-domicile-certificates/292267/,PTI ," June 21, 2016 5:06 PM"
"Data analysts earn more than IT engineers, says report","Difficult screening and a higher cut-off benchmark explain why data analysts earn more than software engineers at a fresher level, according to a report.",http://www.financialexpress.com/jobs/data-analysts-earn-more-than-it-engineers-says-report/294907/,PTI ," June 23, 2016 6:32 PM"
High Court nod to Khalsa College for admission under minority status,Delhi High Court today gave the go-ahead to Delhi University’s Khalsa college to commence its admission process for this academic year under the minority status. ,http://www.financialexpress.com/jobs/high-court-nod-to-khalsa-college-for-admission-under-minority-status/291177/,PTI ," June 21, 2016 12:18 AM"
Govt mulls amending norms for setting up private veterinary colleges,"Concerned over shortage of veterinary doctors, Minister of State for Agriculture Sanjeev Balyan today said it is considering amendments to the 32-year old Indian Veterinary Council Act in order to ease norms for setting up of private vet colleges in the country. ",http://www.financialexpress.com/jobs/govt-mulls-amending-norms-for-setting-up-private-veterinary-colleges/291084/,PTI ," June 20, 2016 6:10 PM"
Arunachal Pradesh’s first medical college to be functional by 2017,Arunachal Pradesh Chief Minister Kalikho Pul today said the government was trying to make the state’s first medical college functional by next year.,http://www.financialexpress.com/jobs/arunachal-pradeshs-first-medical-college-to-be-functional-by-2017/291117/,PTI ," June 20, 2016 7:09 PM"
"JEE Main rank 2016 list finally revealed, Deepanshu Jindal emerges topper; check josaa.nic.in",JEE Main rank 2016 list has been released on June 23 in the evening on the official website josaa.nic.in and jeemain.nic.in. Candidates and for various other updates also see Central Board of Secondary Education (CBSE) cbse.nic.in or cbseresults.nic.in and Joint Entrance Examination (JEE) jeemain.nic.in. Candidates can log on and find out where they stand on the list – here is the direct link: cbseresults.nic.in/jee_main/Jee_cbse_2016.htm.,http://www.financialexpress.com/jobs/jee-main-rank-2016-list-released-today-check-josaa-nic-in/294460/,FE Online ," June 24, 2016 12:39 AM"
"UPSC Civil services 2016 toppers Tina Dabi, Athar Aamir Ul Shafi Khan get IAS","Tina Dabi, the topper of civil services examination, and Jammu and Kashmir’s Athar Aamir Ul Shafi Khan have been given the prestigious Indian Administrative Service (IAS).",http://www.financialexpress.com/jobs/upsc-civil-services-2016-toppers-tina-dabi-athar-aamir-ul-shafi-khan-get-ias/293892/,PTI ," June 22, 2016 11:30 PM"
Wall Street banks remain top choice for new MBAs: Survey,"Wall Street banks remain the employers of choice for new business school graduates, despite competition for talent from Silicon Valley, hedge funds and private equity firms, according to a study released on Tuesday.",http://www.financialexpress.com/jobs/wall-street-banks-remain-top-choice-for-new-mbas-survey/292890/,Reuters ," June 22, 2016 11:43 AM"
Punjab govt to launch education channel ‘Vidya TV’: Minister,Punjab Education Minister Daljit Singh Cheema has said the government will soon launch a dedicated TV channel showing educational content for the benefit of school students.,http://www.financialexpress.com/jobs/punjab-govt-to-launch-education-channel-vidya-tv-minister/291825/,PTI ," June 21, 2016 12:35 PM"
Early exams led to extended summer holidays this year: Survey,"School board exams began as early as mid-March leading to extended summer holidays for Indian travellers in 2016 which went on till July, according to a survey by Thomas Cook India.",http://www.financialexpress.com/jobs/early-exams-led-to-extended-summer-holidays-this-year-survey/293894/,PTI ," June 22, 2016 11:51 PM"
CBSE UGC NET July 2016: Admit cards available on cbsenet.nic.in for July 10 exam,CBSE UGC NET July 2016: Central Board of Secondary Education (CBSE) has released the admit cards for University Grants Commission (UGC) National Eligibility Test (NET) on cbsenet.nic.in…,http://www.financialexpress.com/jobs/cbse-ugc-net-july-2016-admit-cards-available-on-cbsenet-nic-in-for-july-10-exam/292868/,FE Online ," June 22, 2016 12:04 PM"
"SBI PO admit card 2016 available for download at sbi.co.in, exam starts July 2",SBI PO Admit Card 2016: The State Bank of India’s (SBI) Probationary Officer (PO) examinations 2016 admit released today on the official website sbi.co.in. ,http://www.financialexpress.com/jobs/sbi-po-admit-card-2016-available-for-download-at-sbi-co-in-from-today-exam-starts-from-july-2/293659/,Anshul ," June 22, 2016 7:48 PM"
US launch offers free online university courses to refugees,The State Department will promote the courses through embassies and consulates.,http://www.financialexpress.com/jobs/us-launch-offers-free-online-university-courses-to-refugees/291606/,Reuters ," June 21, 2016 10:16 AM"
Reforming education: Ball now in government’s court, It backs the setting up of a standing Education Commission to continually assess the changing circumstances of the education sector and advise the HRD ministry on the need to upgrade or change policy.,http://www.financialexpress.com/jobs/reforming-education-ball-now-in-governments-court/291231/,Sarthak Ray ," June 20, 2016 10:20 PM"
"Labour Ministry to organise a job fair every month, first in Noida","Aimed at bridging the gap between employers and job seekers, the Labour Ministry has decided to organise at least one job fair every month in different states.",http://www.financialexpress.com/jobs/labour-ministry-to-organise-a-job-fair-every-month-first-in-noida/291301/,PTI ," June 20, 2016 11:38 PM"
Islamic school in Britian gives students anti-IS classes,An Islamic school in Britain is holding classes for students as young as 11 years old in order to help them recognise violent propaganda to prevent jihadis from grooming them online.,http://www.financialexpress.com/jobs/islamic-school-in-britian-gives-students-anti-is-classes/290716/,IANS ," June 20, 2016 2:26 PM"
"US, India gear up for 21st century knowledge initiative awards","In a continuation of the educational partnership between Washington and New Delhi, the U.S. Department of State and the University Grants Commission…",http://www.financialexpress.com/jobs/us-india-gear-up-for-21st-century-knowledge-initiative-awards/290977/,ANI ," June 20, 2016 4:48 PM"
Preserve video of counselling for post-graduate courses: High Court to AIIMS,"Delhi High Court today directed the AIIMS to preserve the video records of a counselling session for post-graduate medical courses held recently, which has come under challenge before it.",http://www.financialexpress.com/jobs/preserve-video-of-counselling-for-post-graduate-courses-high-court-to-aiims/293806/,PTI ," June 22, 2016 10:06 PM"
Indian professionals prefer flexible work hours over high pay,"Nearly 50 per cent professionals in the country are ready to forgo a top position with high salary for flexible working arrangements, says a LinkedIn survey.",http://www.financialexpress.com/jobs/indian-professionals-prefer-flexible-work-hours-over-high-pay/291226/,PTI ," June 20, 2016 9:10 PM"
"To boost hiring, competitive exam scores to be put online:Government","In order to boost hiring, scores of all candidates taking various competitive examinations will be made available online for both public and private sector.",http://www.financialexpress.com/jobs/to-boost-hiring-competitive-exam-scores-to-be-put-onlinegovernment/292432/,PTI ," June 21, 2016 9:08 PM"
"984 graduates, 5 MPhil candidates apply for porters’ posts!","As many as 984 graduates and five MPhil degree holders have applied for the five ‘hamal’ (porter) posts in Maharashtra, a senior official today said.",http://www.financialexpress.com/jobs/984-graduates-5-mphil-candidates-apply-for-porters-posts/290946/,PTI ," June 20, 2016 4:57 PM"
Education system should be Indianised: M Venkaiah Naidu,The education system in India is still “a continuation of Lord Macaulay’s legacy” and it should be “Indianised”…,http://www.financialexpress.com/jobs/education-system-should-be-indianised-m-venkaiah-naidu/291358/,PTI ," June 21, 2016 1:36 AM"
US jobless claims fall to near 43-year low,"The number of Americans filing for unemployment benefits fell last week to near a 43-year low, suggesting labor market resilience even though hiring slowed sharply in May.",http://www.financialexpress.com/jobs/us-jobless-claims-fall-to-near-43-year-low/294976/,Reuters ," June 23, 2016 7:06 PM"
On the shelf,On the shelf,http://www.financialexpress.com/jobs/on-the-shelf-74/289773/,NA,"June 19, 2016 7:56 AM"
JNTUH results 2016 declared; students’ BTech 4-2 Semester Regular/Supply results now available,"JNTUH results 2016: The Jawaharlal Nehru Technological University has declared the B.Tech 4-2 Semester (R09, R07, R05) Regular/Supply Results and candidates can log onto official website jntuhresults.in to find out how they fared – the examination itself was held in May on its official website.",http://www.financialexpress.com/jobs/jntuh-results-2016-declared-candidates-can-check-jntuhresults-in-for-b-tech-4-2-semester-regularsupply-report/290100/,FE Online ," June 20, 2016 12:48 AM"
GeNext leaders beat present-day CEOs on optimism index,"Next generation leaders are more optimistic than present day CEOs on economic growth as 60 per cent of them believe it will improve in the next 12 months as against only 27 per cent of chief executives, says a PwC report.",http://www.financialexpress.com/jobs/genext-leaders-beat-present-day-ceos-on-optimism-index/288775/,PTI ," June 17, 2016 5:51 PM"
"SBI Clerk Pre exam results 2016 to be declared soon, check latest updates at sbi.co.in","SBI Clerk Pre exam results 2016 is likely to be announced soon on its official website sbi.co.in. SBI Clerk Pre Exam 2016 was held between May 22 and June 5 for recruitment of 18,000 junior associates and junior agricultural associates. Lakhs of students applied for the SBI Clerk Pre Exam 2016 from across the country.",http://www.financialexpress.com/jobs/sbi-clerk-pre-exam-results-2016-declared-check-latest-updates-at-sbi-co-in/286989/,Anshul ," June 16, 2016 2:02 PM"
Most parents open to loans for children’s higher studies,"Nearly three-fourths of parents surveyed in India are willing to take education loan to fund their children’s university studies, says a study.",http://www.financialexpress.com/jobs/most-parents-open-to-loans-for-childrens-higher-studies/289934/,PTI ," June 19, 2016 2:05 PM"
Macmillan Education enters English language training market in India,"Macmillan Education, one of the world’s leading publishers of English Language teaching and school curriculum materials is launching its Language Learning Resources for the Indian market.",http://www.financialexpress.com/jobs/macmillan-education-enters-english-language-training-market-in-india/287695/,ANI ," June 16, 2016 8:24 PM"
RBSE 10th result 2016: Boys outshine girls in Rajasthan Board exam,"RBSE 10th result 2016: Boys outperformed girls in the Secondary examination in Rajasthan, the results of which were declared here today.",http://www.financialexpress.com/jobs/rajresults-nic-in-rbse-10th-result-2016-boys-outshine-girls-in-rajasthan-board-exam/290221/,PTI ," June 19, 2016 11:43 PM"
Schools to turn ‘smart’ under ‘EkShiksha’ campaign,"‘EkShiksha’ was launched by Education Department of Maharashtra in collaboration with ConnectEd Technologies, an education-technology start-up that creates rural-focused solutions.",http://www.financialexpress.com/jobs/schools-to-turn-smart-under-ekshiksha-campaign/287770/,PTI ," June 16, 2016 9:41 PM"
Arun Jaitley lays foundation stone for IIM-Amritsar campus,"Education and agriculture will have to go hand in hand for India’s development as has been the case in countries like Japan and South Korea, Finance Minister Arun Jaitley said today as he laid the foundation stone for a new campus of IIM-Amritsar.",http://www.financialexpress.com/jobs/arun-jaitley-lays-foundation-stone-for-iim-amritsar-campus/290188/,PTI ," June 19, 2016 8:46 PM"
Here’s what made Renault-Nissan hike workers pay,Renault Nissan Automotive India Private Limited (RNAIPL) on Wednesday said that it has formally signed a three-year long term of settlement…,http://www.financialexpress.com/jobs/heres-what-made-renault-nissan-hike-workers-pay/287984/,FE Bureau ," June 17, 2016 7:36 AM"
Super 30 founder Anand Kumar gets strange requests,"Anand Kumar, the founder of Super 30 which has been helping underprivileged students prepare for IIT JEE, often gets strange requests like action against a wife-beating man or saving someone wrongfully convicted of a crime.",http://www.financialexpress.com/jobs/super-30-founder-anand-kumar-gets-strange-requests/290080/,PTI ," June 19, 2016 4:57 PM"
Jipmer results 2016: Mumbai student Kushagra Pandey is topper in entrance examination,"Jipmer results 2016: Kushagra Pandey, a student from Mumbai, is the top scorer in the all India online entrance examination conducted on June 5 by JIPMER for admission to first MBBS course in the institute during the 2016-2017 academic year.",http://www.financialexpress.com/jobs/jipmer-results-2016-mumbai-student-kushagra-pandey-is-topper-in-entrance-examination/288950/,PTI ," June 17, 2016 7:54 PM"
Delhi University admission: Application deadline extended till June 22,"Delhi University’s application process for undergraduate admission, which was to conclude today, has been extended till June 22.",http://www.financialexpress.com/jobs/delhi-university-admission-application-deadline-extended-till-june-22/290220/,PTI ," June 19, 2016 11:33 PM"
University Grants Commission approves new guidelines for Deemed universities,The University Grants Commission (UGC) has approved new regulations for Deemed Universities as per which there will be no bar on the number of off-campus centres…,http://www.financialexpress.com/jobs/university-grants-commission-approves-new-guidelines-for-deemed-universities/287959/,PTI ," June 16, 2016 11:41 PM"
QS Asian Universities ranking: Manipal University makes it top 200,"For the first time in it’s history, Manipal University, has made it to the top 200 positions in the QS (Quacquarelli Symonds) University Asia Ranking list. QS is an annual publication and this year 350 universities from 17 countries were considered for ranking.",http://www.financialexpress.com/jobs/qs-asian-universities-ranking-manipal-university-makes-it-top-200/288757/,FE Online ," June 17, 2016 5:47 PM"
"Siblings overcome disability, poverty to make it to IIT",The journey of polio-stricken Krishan and his younger sibling Basant from a poor family in Bihar to cracking the IIT entrance has been arduous and inspirational.,http://www.financialexpress.com/jobs/siblings-overcome-disability-poverty-to-make-it-to-iit/289414/,PTI ," June 18, 2016 1:22 PM"
"Top 10 fiction, non-fiction books","Top 10 fiction, non-fiction books",http://www.financialexpress.com/jobs/top-10-fiction-non-fiction-books-9/289772/,NA,"June 19, 2016 7:56 AM"
rajresults.nic.in RBSE 10th result 2016 declared,"RBSE 10th result 2016 was declared today on June 19, at 5 pm on Board of Secondary Education Rajasthan’s (BSER) official websites rajresults.nic.in and rajeduboard.rajasthan.gov.in…",http://www.financialexpress.com/jobs/rbse-bser-rajasthan-class-10-result-2016-declared-today-visit-rajresults-nic-in-for-latest-updates/290120/,FE Online ," June 20, 2016 12:49 AM"
Book review: The Great Acceleration; solutions to a fast-paced life,Technology over the years has been able to generate both dystopian and utopian views. ,http://www.financialexpress.com/jobs/book-review-the-great-acceleration-solutions-to-a-fast-paced-life/289770/,Ishaan Gera ," June 19, 2016 7:56 AM"
Veerappa Moily hints at ‘RSS-lobby’ behind Raghuram Rajan’s decision,"Blaming the adverse environment created by the BJP-led regime at the Centre for Reserve Bank of India (RBI) Governor Raghuram Rajan’s decision to not continue with his current post after the end of his tenure in September, former union minister Veerappa Moily on Saturday hinted at the RSS being involved in the entire matter. ",http://www.financialexpress.com/jobs/veerappa-moily-hints-at-rss-lobby-behind-raghuram-rajans-decision/289755/,ANI ," June 18, 2016 11:20 PM"
