Heading,Summary,Link,PostedBy,PostedOnDate
ICAI’s IPCC course examination: All you wanted to know,"Intermediate (Integrated Professional Competence) Course: This is the first stage of the chartered accountancy curriculum wherein only working knowledge of core and allied subjects to accountancy profession is covered, while at the Final course, advanced application knowledge of core and allied subjects to accountancy profession has been intended to be inculcated.",http://www.financialexpress.com/jobs/icais-ipcc-course-examination-all-you-wanted-to-know/205229/,Agencies ," February 1, 2016 4:00 PM"
"JNTUK 3-1 (R13, R10, R07) regular/ supply Nov 2015 results 2015 released: Check jntukresults.edu.in","JNTUK 3-1 Results 2015: Jawaharlal Nehru Technological University, Kakinada (JNTU) has released the results for the B Tech 3-1 semester examination today i.e. on 3rd February. ",http://www.financialexpress.com/jobs/jntuk-3-1-r13-r10-r07-regular-supply-nov-2015-results-2015-released-check-jntukresults-edu-in/206534/,FE Online ," February 3, 2016 4:19 PM"
Social entrepreneurship: Creating an ecosystem to build a new India,"With a population of over 1.2 billion, every third Indian still bereft of even basic necessities like nutrition, education and healthcare, and millions who are still unemployed and illiterate, the situation is indeed alarming.",http://www.financialexpress.com/jobs/social-entrepreneurship-creating-an-ecosystem-to-build-a-new-india/204943/,Sanjay Kadaveru ," February 1, 2016 12:02 AM"
App-roaching government jobs,"One thing is increasingly getting common among the youth, that most today carry a smartphone loaded with a number of apps.",http://www.financialexpress.com/jobs/app-roaching-government-jobs/208555/,Akash Sinha ," February 8, 2016 12:22 AM"
UPSC 2016: 110 aspirants qualify for IFS exam; UPSC declares results,"UPSC 2016: As many a 110 candidates have qualified for Indian Forest Service (IFS) examination, results of which were declared today by Union Public Service Commission.",http://www.financialexpress.com/jobs/upsc-2016-110-aspirants-qualify-for-ifs-exam-upsc-declares-results/210225/,PTI ," February 11, 2016 9:43 PM"
Indian origin US man wins $3.1 million in discrimination suit,"An Indian-origin man who was among 47 immigrants denied recruitment as police officers for being foreign-born has won a $3.1 million discrimination suit filed against the Chicago Police Department in the US, the media reported.",http://www.financialexpress.com/jobs/indian-origin-us-man-wins-3-1-million-in-discrimination-suit/210869/,IANS ," February 12, 2016 6:40 PM"
ICAI result 2015: IPCC results declared today; check icai.nic.in for more,The Institute of Chartered Accountants of India (ICAI) has declared the result for Intermediate Integrated Professional Competence Course (IPCC) Exam today.,http://www.financialexpress.com/jobs/icai-result-2015-ipcc-results-to-be-announced-today-check-icai-nic-in/205159/,FE Online ," February 1, 2016 3:48 PM"
"IT companies’ net hiring to be flat next fiscal, says Nasscom","Export revenues are expected to see a modest increase of 10-12% to $119-121 billion, according to projections released by industry body Nasscom.",http://www.financialexpress.com/jobs/it-companies-net-hiring-to-be-flat-next-fiscal/207512/,FE Bureau ," February 5, 2016 12:53 PM"
Sweet pea,"An artist’s imagination knows no bounds, as embodied by ‘Princess Pea’, an artist who celebrates her alter ego instead of herself",http://www.financialexpress.com/jobs/sweet-pea/211363/,fe Features ," February 14, 2016 12:04 AM"
CBSE allows AIPMT aspirants to make correction in their data,The CBSE has decided to allow candidates appearing for All India Pre-Medical Test (AIPMT) to make corrections in their data from February 15 to 20 after it received a number of requests in this regard.,http://www.financialexpress.com/jobs/cbse-allows-aipmt-aspirants-to-make-correction-in-their-data/210972/,PTI ," February 12, 2016 9:54 PM"
IT sector to create 2.5 lakh new job openings in 2016: Report,IT sector hiring is expected to see significant uptrend this year as more and more companies focus on digitisation and the sector is likely to create 2.5 lakh new job openings this year. ,http://www.financialexpress.com/jobs/it-sector-to-create-2-5-lakh-new-job-openings-in-2016-report/205690/,PTI ," February 2, 2016 11:43 AM"
On the shelf,Bad News: Last Journalists in a Dictatorship,http://www.financialexpress.com/jobs/on-the-shelf-53/201090/,FE Bureau ," January 24, 2016 12:08 AM"
Top 10 Fiction and Non-fiction,Top 10 Fiction and Non-fiction,http://www.financialexpress.com/jobs/top-10-fiction-and-non-fiction-26/204712/,FE Bureau ," January 31, 2016 12:16 AM"
Services of ex-servicemen may be utilised in schools,The HRD ministry is mulling an initiative under which services of ex-servicemen would be utilised in schools for providing physical training and also creating awareness about sacrifices made by security forces for the nation. ,http://www.financialexpress.com/jobs/services-of-ex-servicemen-may-be-utilised-in-schools/201795/,PTI ," January 25, 2016 7:37 PM"
"JK BOSE 12th class results: Girls outperform boys; check jkbose.co.in, results.indiaresults.com",JK BOSE 12th class results 2015: Girls have done better than boys in the Jammu and Kashmir Board of School Education examination whose results were declared on Thursday – they have by bagged top slots in all streams – results can be checked at jkbose.co.in and results.indiaresults.com/jk/jkbose.,http://www.financialexpress.com/jobs/jk-bose-12th-class-results-2015-girls-outshine-boys-bag-53-of-67-top-positions-check-jkbose-co-in-and-results-indiaresults-comjkjkbose/200210/,Agencies ," January 22, 2016 9:54 PM"
1962 – The War That Wasn’t book review: A Himalayan debacle,"An immaculately-researched study of how warriors paid, while netas and babus got away clean in the 1962 war against China",http://www.financialexpress.com/jobs/1962-the-war-that-wasnt-book-review-a-himalayan-debacle/204708/,NA,"January 31, 2016 12:12 AM"
Kalkatta book review: Oh! Kalkatta,Kunal Basu’s new book based in the city of joy turns its eye on its poorest of the poor,http://www.financialexpress.com/jobs/kalkatta-book-review-oh-kalkatta/204709/,Sudipta Datta ," January 31, 2016 12:14 AM"
As much as 82% of our workforce comprises of permanent employees,"Uflex, India’s largest flexible packaging company, takes pride in the fact that as much as 82% of its workforce comprises of permanent employees.",http://www.financialexpress.com/jobs/as-much-as-82-of-our-workforce-comprises-of-permanent-employees/201345/,NA,"January 25, 2016 12:02 AM"
"WEF 2016: Millions of new jobs being created in India, says ICICI Bank’s Chanda Kochhar","The renewed focus on manufacturing sector, innovation and skill development will create millions of new jobs in India, top banker Chanda Kochhar said today as leaders from neighbouring countries Pakistan and Sri Lanka also vowed to take steps to boost employment generation.",http://www.financialexpress.com/jobs/wef-2016-millions-of-new-jobs-being-created-in-india-says-icici-banks-chanda-kochhar/199753/,PTI ," January 21, 2016 8:23 PM"
Government eases norms for bureaucrats going abroad for training,"Officers up to joint secretary level going abroad for training will not need approval of the Screening Committee of Secretaries (SCoS), finance ministry has said.",http://www.financialexpress.com/jobs/government-eases-norms-for-bureaucrats-going-abroad-for-training/204796/,PTI ," January 31, 2016 1:31 PM"
Infosys co-founder Narayana Murthy bats for Indo-US tie-up in higher education,"India and the US should collaborate in higher education, research and hi-tech areas to benefit mutually and foster a stronger bond of friendship between the two countries, Infosys co-founder N.R. Narayana Murthy said on Friday.",http://www.financialexpress.com/jobs/infosys-co-founder-narayana-murthy-bats-for-indo-us-tie-up-in-higher-education/204143/,IANS ," January 29, 2016 7:30 PM"
Over 80% engineering graduates in India unemployable: Study,Educational institutions train millions of youngsters but corporates often complain that they do not get the necessary skill and talent required for a job.,http://www.financialexpress.com/jobs/over-80-engineering-graduates-in-india-unemployable-study/201150/,PTI ," January 24, 2016 10:55 AM"
"Goa produced 6,000 entrepreneurs thanks to state scheme: CM","Goa Chief Minister Laxmikant Parsekar today said the state’s flagship Chief Minister’s Rojgar Yojna (CMRY), which was launched in 2002, has so far produced 6,000 entrepreneurs. ",http://www.financialexpress.com/jobs/goa-produced-6000-entrepreneurs-thanks-to-state-scheme-cm/197647/,PTI ," January 18, 2016 11:54 PM"
"CDS 2016 examination: Combined Defence Services Examination (I), 2016 to be held on Feb 14","The Union Public Service Commission will be conducting the Combined Defence Services Examination (I), 2016 at different venues located at 41 Centres throughout the country on 14.02.2016 (Sunday). ",http://www.financialexpress.com/jobs/cds-2016-examination-combined-defence-services-examination-i-2016-to-be-held-on-feb-14/203449/,FE Online ," January 28, 2016 5:56 PM"
Fast typing is killing your writing skills: Study,You may want to slow down your typing in order to improve your writing as a new study suggests so.,http://www.financialexpress.com/jobs/fast-typing-is-killing-your-writing-skills-study/200289/,ANI ," January 22, 2016 6:29 PM"
MNCs beat Indian companies as preferred place to work: Survey,"Multinational companies (MNCs) beat Indian firms as preferred place to work, as nearly 88 per cent employees working with domestic firms, if offered a choice, would like to switch to international organisations, says a survey. ",http://www.financialexpress.com/jobs/mncs-beat-indian-companies-as-preferred-place-to-work-survey/199770/,PTI ," January 21, 2016 9:17 PM"
Many young people fear losing their jobs to robots: Survey,"Four out of ten young people believe machines will be able to do their jobs within a decade, an international survey published on Monday has found.",http://www.financialexpress.com/jobs/many-young-people-fear-losing-their-jobs-to-robots-survey/197272/,Reuters ," January 18, 2016 3:53 PM"
‘Crime fiction in India not an easy genre to break into’,"HAVING MASTERED the art of thrillers, author Ravi Subramanian is pushing new boundaries with his latest book, a romantic suspense. ",http://www.financialexpress.com/jobs/crime-fiction-in-india-not-an-easy-genre-to-break-into/201083/,Nitin Sreedhar ," January 24, 2016 12:06 AM"
Top 10 fiction and non-fiction,Top 10 fiction and non-fiction,http://www.financialexpress.com/jobs/top-10-fiction-and-non-fiction-25/201087/,FE Bureau ," January 24, 2016 12:10 AM"
"Why content on Vivekananda, Bose reduced in NCERT books: CIC","In a terse order, the Commission asked NCERT to disclose why content on Swami Vivekananda was reduced from 1250 to 37 words in Class XII history books and completely removed from Class VIII books.",http://www.financialexpress.com/jobs/why-content-on-vivekananda-bose-reduced-in-ncert-books-cic/201199/,PTI ," January 24, 2016 3:22 PM"
"Firms hiring non EU workers may face 1,000 pound surcharge in UK","Companies in the UK hiring non- European Union workers like Indians are expected to face a new 1,000 pound annual surcharge per employee.",http://www.financialexpress.com/jobs/firms-hiring-non-eu-workers-may-face-1000-pound-surcharge-in-uk/198349/,PTI ," January 19, 2016 9:42 PM"
Why it is easier to start a business at a business school,"B-schools still provide the best ecosystem, know-how, advice and support to start-ups",http://www.financialexpress.com/jobs/why-it-is-easier-to-start-a-business-at-a-business-school/201347/,NA,"January 25, 2016 12:03 AM"
UGC seeks details of activities of EOCs in varsities,"In the backdrop of outrage over the suicide by a Dalit scholar in Hyderabad University, the UGC has sought details of activities undertaken by Equal Opportunities Centres (EOCs) set up by the institutions for the welfare of “disadvantaged” sections.",http://www.financialexpress.com/jobs/ugc-seeks-details-of-activities-of-eocs-in-varsities/204406/,PTI ," January 30, 2016 10:55 AM"
Rajasthan Board annual examination from March 3,"Annual examination for the Rajasthan Board of secondary education would commence on March 3 and end on March 29, 2016.",http://www.financialexpress.com/jobs/rajasthan-board-annual-examination-from-march-3/197485/,PTI ," January 18, 2016 7:18 PM"
Classroom with green landscape view boosts student performance,"According to a new study, if you have a green view outside your window, you’ll do better on tests.",http://www.financialexpress.com/jobs/classroom-with-green-landscape-view-boosts-student-performance/201214/,ANI ," January 24, 2016 4:53 PM"
Flash Winners book review: The e-way ahead,Flash Winners takes readers through the trials and tribulations of e-commerce ventures in a conversational style,http://www.financialexpress.com/jobs/flash-winners-book-review-the-e-way-ahead/201086/,Madan Sabnavis ," January 24, 2016 12:07 AM"
B-schools see strong placements; 12% rise in avg offer size,"Reflecting the optimistic business sentiment, corporates across industry verticals showed keen interest in this year’s placement season. ",http://www.financialexpress.com/jobs/b-schools-see-strong-placements-12-rise-in-avg-offer-size/204737/,PTI ," January 31, 2016 11:28 AM"
‘We’re exploring mutually-beneficial partnerships in India’,"Today, the University of California, Los Angeles (UCLA) and Tata Trusts are holding the “UCLA-Tata Global Forum: Innovating for a Sustainable Energy Future” in New Delhi. ",http://www.financialexpress.com/jobs/were-exploring-mutually-beneficial-partnerships-in-india/191698/,Vikram Chaudhary ," January 11, 2016 12:02 AM"
The show must go on,"Here’s how ‘print-on-demand’ technology is enabling publishers to keep books alive, long after they have gone out of print",http://www.financialexpress.com/jobs/the-show-must-go-on/196235/,Kunal Doley ," January 17, 2016 12:09 AM"
Indian Railways jobs 2016: Railway Recruitment Board FAQs,Indian Railways jobs 2016: New recruitment at Indian Railways has been announced and every time while applying online applicants face a number of problems,http://www.financialexpress.com/jobs/indian-railways-jobs-2016-railway-recruitment-board-faqs-check-rrbonlinereg-in/195999/,NA,"January 17, 2016 3:17 PM"
Himalayan divide,"A rare comparison between India and China in the same breath, this anthology of essays on media is a welcome one",http://www.financialexpress.com/jobs/himalayan-divide/196253/,Anurag Viswanath ," January 17, 2016 12:10 AM"
HRD ministry to set up NAT to assess abilities of IIT aspirants,The NAT is proposed to be established in the coming months and its first major task would be to conduct tests in the latter half of the year.,http://www.financialexpress.com/jobs/hrd-ministry-to-set-up-nat-to-assess-abilities-of-iit-aspirants/196351/,PTI ," January 17, 2016 1:11 PM"
"Designing, creating and innovating in India","Prime Minister’s ‘Start-up India, Stand up India’ initiative can succeed only when the focus in our colleges shifts towards creating and owning intellectual property",http://www.financialexpress.com/jobs/designing-creating-and-innovating-in-india/191699/,NA,"January 11, 2016 12:03 AM"
Mumbai University launches certificate course in RTI,"The University of Mumbai today launched a six-month PG certificate course in Right to Information, a move hailed as “historic” by RTI activists. ",http://www.financialexpress.com/jobs/mumbai-university-launches-certificate-course-in-rti/194262/,PTI ," January 15, 2016 2:02 AM"
Stay connected to your roots: Super 30 founder to Indian youths,"Lauding talented Indian youths who are contributing in progress of many countries with their knowledge and skills, mathematician and Super 30 founder Anand Kumar today asked them to stay connected to their roots. ",http://www.financialexpress.com/jobs/stay-connected-to-your-roots-super-30-founder-to-indian-youths/195843/,PTI ," January 16, 2016 3:03 PM"
Qatar tops most international universities ranking,"Qatar University has topped the list of world’s 200 most international institutions, a rare entry into the group dominated by Western education powerhouses in the US and the UK, according to a list published today. ",http://www.financialexpress.com/jobs/qatar-tops-most-international-universities-ranking/194190/,PTI ," January 14, 2016 10:48 PM"
"Kumar Manglam Birla, other India Inc bosses may head IIT boards","As it aims to “strengthen the partnership between industry and academia”, the Human Resource Development Ministry is understood to have contemplating appointment of leading business captains as chairpersons of Board of Governors of prestigious IITs.",http://www.financialexpress.com/jobs/kumar-manglam-birla-other-india-inc-bosses-may-head-iit-boards/195684/,PTI ," January 15, 2016 10:12 PM"
CBSE schools in Nepal get 3 months for registration,"The half-a-decade-old row over schools operating in Nepal under India’s CBSE system is about to get resolved,",http://www.financialexpress.com/jobs/cbse-schools-in-nepal-get-3-months-for-registration/191268/,PTI ," January 9, 2016 9:31 PM"
"JK Bose Class 10th regular results declared, check jkbose.co.in",JK Bose Class 10th regular results: Jammu & Kashmir State Board of School Education (JKBOSE) has declared the results for class 10 regular students for Kashmir division. The candidates can check the results on the official website jkbose.co.in.,http://www.financialexpress.com/jobs/jk-bose-class-10th-regular-result-declared-check-jkbose-co-in/191875/,FE Online ," January 11, 2016 1:29 PM"
Men in typically female jobs not motivated by money,"Men in characteristically female-dominated occupations tend to value the social aspects of their career over financial rewards, says a study.",http://www.financialexpress.com/jobs/men-in-typically-female-jobs-not-motivated-by-money/189750/,IANS ," January 7, 2016 4:19 PM"
Book to the future,"From e-books a few years ago to mobile-first platforms and now pay-by-chapter downloads, the publishing industry is trying to move ahead with the times and explore new formats and opportunities",http://www.financialexpress.com/jobs/book-to-the-future/196234/,Kunal Doley ," January 17, 2016 8:52 AM"
"Startup India, Stand up India: Educate India, the start-up way","With about 4,500 start-ups at various stages of growth, our country is already the third largest in the global start-up ecosystem. ",http://www.financialexpress.com/jobs/startup-india-stand-up-india-educate-india-the-start-up-way/196568/,Rohin Kapoor ," January 18, 2016 12:07 AM"
"IIT-M placements: Qualcomm, Intel, Google make top offers","Qualcomm, Intel, Google and US-based research firm MSCI made the maximum number of offers at the placement session of Indian Institute of Technology, Madras (IIT-M) here.",http://www.financialexpress.com/jobs/iit-m-placements-qualcomm-intel-google-make-top-offers/189949/,PTI ," January 7, 2016 9:53 PM"
The changing role of human capital managers,"The HR profession has evolved from a welfare, administration role to that of a business partner.",http://www.financialexpress.com/jobs/the-changing-role-of-human-capital-managers/196569/,NA,"January 18, 2016 12:13 AM"
"IIT-Madras placements season: Coal India, Mahindra Group, Benz make top offers","State-run Coal India, auto-major Mahindra and Mahindra and German luxury car maker Mercedes Benz today made top offers at the ongoing placement session of Indian Institute of Technology, Madras (IIT-M) here.",http://www.financialexpress.com/jobs/iit-madras-placements-season-coal-india-mahindra-group-benz-make-top-offers/190846/,PTI ," January 8, 2016 11:04 PM"
CAT 2015 result: Common Admission Test exam result for IIMs declared; check iimcat.ac.in,CAT 2015 result: The results of the Common Admission Test (CAT) for entry into prestigious IIMs and other managements institutes were declared today at iimcat.ac.in. ,http://www.financialexpress.com/jobs/cat-2015-result-common-admission-test-exam-result-for-iims-declared-today-check-iimcat-ac-in/190793/,PTI ," January 10, 2016 2:59 PM"
Becoming a digital nation,"‘Start-up India’, when searched on Google, brings up over 73 million results within 0.54 seconds. ",http://www.financialexpress.com/jobs/becoming-a-digital-nation/196574/,Aftab Malhotra ," January 18, 2016 12:17 AM"
Rhythm ride,"Vikram Seth’s new collection of poems is by no means his best, but it’s familiar Seth territory, and that can’t be a bad thing",http://www.financialexpress.com/jobs/rhythm-ride/191429/,Sudipta Datta ," January 10, 2016 12:10 AM"
Rare books on sale,"For those with a passion for rare books, an online auction could be a literal treasure hunt",http://www.financialexpress.com/jobs/rare-books-on-sale/191430/,fe Features ," January 10, 2016 12:11 AM"
JNU’s academic value ignored over political activism: S K Sopory.,"Jawaharlal Nehru University is often perceived as a theatre of political activism and its contribution in the academic sphere is ignored, says its outgoing Vice Chancellor S K Sopory. ",http://www.financialexpress.com/jobs/jnus-academic-value-ignored-over-political-activism-s-k-sopory/196382/,PTI ," January 17, 2016 2:05 PM"
ON THE SHELF,"US President JF Kennedy faced two great crises: the Cuban missile crisis and the Sino-Indian War. While his part in the missile crisis has been thoroughly studied, his critical role in the Sino-Indian War has been largely ignored. Bruce Riedel fills that gap with JFK’s Forgotten Crisis.",http://www.financialexpress.com/jobs/on-the-shelf-51/191433/,FE Bureau ," January 10, 2016 12:11 AM"
Salary rise expected across industries in 2016: Survey,"Salaries are likely to increase by 10.5 per cent across levels and industries this year mainly due to optimistic economic outlook, a survey has said. ",http://www.financialexpress.com/jobs/salary-rise-expected-across-industries-in-2016-survey/194161/,PTI ," January 14, 2016 9:35 PM"
Beyond the headlines,"The book offers no prescription for addressing India’s ills. That’s, in some ways, a relief; journalists who want to solve problems rather than report them are in the wrong profession. But it does mean there is a hand-wringing aspect to the book; it’s a series of chapters rather than an argument",http://www.financialexpress.com/jobs/beyond-the-headlines/191428/,Andrew Whitehead ," January 10, 2016 12:09 AM"
On the shelf,"Whether it was campaigning at the age of 13 years in the 1964 presidential election, receiving a standing ovation and being featured in LIFE magazine as the first student commencement speaker at Wellesley, or graduating from Yale Law School, Hillary Clinton was always one to stand out from the pack.",http://www.financialexpress.com/jobs/on-the-shelf-50/187102/,FE Bureau ," January 3, 2016 12:18 AM"
"UG, PG courses in yoga in varsities from next session?",The University Grants Commission (UGC) is working on a plan for introduction of undergraduate and postgraduate courses in yoga in universities.,http://www.financialexpress.com/jobs/ug-pg-courses-in-yoga-in-varsities-from-next-session/187174/,PTI ," January 3, 2016 12:27 PM"
"Wage gap could drive women’s depression, anxiety: study","The U.S. wage gap could be making women ill, says a new study showing women with lower incomes than their male counterparts are more likely to suffer from depression and anxiety.",http://www.financialexpress.com/jobs/wage-gap-could-drive-womens-depression-anxiety-study/189541/,Reuters ," January 7, 2016 1:35 PM"
Govt to increase maternity leave in private sector from 12 to 26 weeks,Women and Child Development Minister Maneka Gandhi Monday said the Ministry of Labour has agreed to increase maternity leave to six-and-a-half months.,http://www.financialexpress.com/jobs/govt-to-increase-maternity-leave-in-private-sector-from-12-to-26-weeks/185065/,Shalini Nair ," December 29, 2015 3:22 PM"
Best places to work in 2016,"Company review website Glassdoor has published its annual list of best places to work in 2016 and, undoubtedly,
tech companies form a major chunk of the coveted compilation.",http://www.financialexpress.com/jobs/best-places-to-work-in-2016-google-facebook-airbnb-linkedin-more/187092/,FE Bureau ," January 3, 2016 12:12 AM"
"CBSE class X, XII exams to begin from March 1","The Central Board for Secondary Education (CBSE) has announced the dates for class X and XII board examinations, both beginning on March 1.",http://www.financialexpress.com/jobs/cbse-class-x-xii-exams-to-begin-from-march-1/187230/,PTI ," January 3, 2016 4:07 PM"
Blueprint for the New Year,"In 2016, we should focus on outcome-based learning models in elementary education and engagement with industry to link education with employability",http://www.financialexpress.com/jobs/towards-world-class-indian-education-blueprint-for-the-new-year/184327/,NA,"December 28, 2015 12:03 AM"
The golden rules,Strategy rules: Yet another book capitalising on the big business of providing strategy tips,http://www.financialexpress.com/jobs/strategy-rules-five-timeless-lessons-book-review/184225/,Madan Sabnavis ," December 27, 2015 1:35 AM"
No interviews: PSBs to strengthen exam for clerical posts,Finance Ministry has asked Public Sector Banks (PSBs) to strengthen written examination for recruitment of clerical and sub-staff posts as there will be no interviews for such appointments.,http://www.financialexpress.com/jobs/no-interviews-psbs-to-strengthen-exam-for-clerical-posts/187217/,PTI ," January 3, 2016 3:31 PM"
