Heading,Link,Summary
Novel method can scale up stem cell production,http://timesofindia.indiatimes.com/home/science/Novel-method-can-scale-up-stem-cell-production/articleshow/53227004.cms,"LONDON: Scientists have found a new method of creating human stem cells which could solve the big problem of the large-scale production needed to fully realise the potential of these remarkable cells for understanding and treating disease.The discovery has been made by a team of scientists at the University of Nottingham in Britain, Uppsala University and GE Healthcare in Sweden.""By using a protein derived from human blood called Inter-alpha inhibitor, we have grown human pluripotent stem cells in a minimal medium without the need for costly and time-consuming biological substrates,"" said first author Sara Pijuan-Galito from Uppsala University.Inter-alpha inhibitor is found in human blood at high concentrations, and is currently a by-product of standard drug purification schemes.""The protein can make stem cells attach on unmodified tissue culture plastic, and improve survival of the stem cells in harsh conditions,"" Pijuan-Galito said.""It is the first stem cell culture method that does not require a pre-treated biological substrate for attachment, and therefore, is more cost and time-efficient and paves the way for easier and cheaper large-scale production,"" Pijuan-Galito explained.Human pluripotent stem cells are undifferentiated cells which have the unique potential to develop into all the different types of cells in the body.With applications in disease modelling, drug screening, regenerative medicine and tissue engineering, there is already an enormous demand for these cells, which will only grow as their use in the clinic and by the pharmaceutical industry increases.However, production of stem cells at the scale required for optimal application in modern healthcare is currently not feasible because available culture methods are either too expensive, or reliant on substances that would not be safe for clinical use in humans.The new research, published in the journal Nature Communications, could lead to quicker and cheaper large scale industrial production.The work was started at Uppsala University in Sweden, and the first author, Dr Sara Pijuan-Galita, is now continuing her work as a Swedish Research Council Research Fellow at Nottingham. Sara said:""This new method has the potential to save time and money in large-scale and high-throughput cultures, and be highly valuable for both basic research and commercial applications,"" Cecilia Anneren, who has a joint position at Uppsala University and at GE Healthcare in Uppsala, said."
Einstein will continue to be relevant...,http://timesofindia.indiatimes.com/home/science/Einstein-will-continue-to-be-relevant-/articleshow/53434554.cms,"On Friday, he will be singing Herman Hupfeld's 'As time goes by', which gained popularity after it was used in Casablanca, a decade later in 1942. He'll be singing it for the for students in St Joseph's College and he says he isn't singing it because it was in Casablanca, but because the prelude to the song is about (Albert) Einstein. Dr Clifford Will, an expert on the General Theory of Relativity and someone who's been on multiple advisory committees in the US, including some of Nasa's is in Bengaluru to conduct a 2-week course for graduate students aimed at helping them be part of the LIGO-India project, one of India's biggest science endeavours—what with the International project having successfully detected two Gravitational Waves in quick succession, after 100 years, with considerable Indian contribution.In an exclusive chat with TOI, Will spoke on Einstein being to Physics what Shakespeare is to English, and on the need for outreach in countries like India, among other things. Excerpts: Q: Your are here to give a two-week course on General Theory of Relativity, in which Einstein mentions Gravitational Waves, can you elaborate?A: The LIGO project has detected and India has been on board. When the India project comes up, there will be a battery of scientists, by 2020. A scientific expertise in the theory of relativity. I am here to give lectures on the fundamentals of Gravitational Waves, they've been happening at the International Centre for Theoretical Sciences. The lecture at St Joseph's is a public lecture, and I will be singing 'As time goes by'. The nature of that lecture is different.Q: Your book, 'Was Einstein Right?"" first published in 1986 is considered one of the good works. Your thoughts of the scientific community actually finding the waves & what it may mean in the future...A: It is difficult to predict how this will impact future astrophysics. But what we can see is that it has already caused a huge spark of interest by astrophysicists. I must say that when they found the waves, proving Einstein right, I thought it came from an unexpected source (the black holes). I thought it would be neutron stars.Q: For the first decade and more, the LIGO project had nothing to show but curiosity. But what it found was game-changing. How important are such projects?A: It is important for all nations to encourage science based on curiosity, especially for countries like India, which has a lot of needs and concerns. Basic science is key. Not only does it help have disruptive science that will deal with a lot of these problems for the future, but it will also have other incentives. Look at the LIGO-India, there was a huge convergence of scientists. Also, there was convergence of a lot of technology and a lot of engineers were on board too.Q: The NSF, which backed LIGO, or Nasa have huge outreach programmes, something that is lacking in India and a few other countries...A: It was not that way even in the US. Even Carl Sagan (an American cosmologist) was criticised for spending so much time engaging with the public. He was asked to do science. But today any proposal to the NSF needs to have details about what our plans for public outreach are. It is important to take science to the people, not only to show what we are doing and help them understand science but to also encourage rational thinking and to kill superstition and bias.Q: Finally, will Einstein continue to survive?A: He is extremely relevant and he will continue to be. All cutting edge technology still has relations with what Einstein had said. He is to physics what Shakespeare is to English, although it may not be the right comparison, really."
Zika virus antibodies identified in mice,http://timesofindia.indiatimes.com/home/science/Zika-virus-antibodies-identified-in-mice/articleshow/53429174.cms,"WASHINGTON: Scientists have identified six Zika virus antibodies in mice, an advancement that may pave the way for a vaccine, better diagnostic tests and possibly new therapies for the mosquito-borne virus.The researchers conducted experiments in mice and identified the antibodies, including four that neutralise African, Asian and American strains of Zika virus.The research could inform prophylactic treatment approaches for pregnant women at risk of Zika virus infection.The team headed by Michael S Diamond and Daved H Fremont, of Washington University School of Medicine also developed atomic-level X-ray crystal structure images showing four of the antibodies in complex with three distinct regions (epitopes) of a key Zika protein.Structural information about antibody-epitope interactions is useful to vaccine developers because it provides a pathway for designing vaccines that can induce antibodies directed towards the critical epitopes.The researchers also found that two of the newly identified Zika antibodies could protect mice from Zika infection.Currently there are no specific treatments for Zika virus infection, and women who become infected while pregnant are at risk of having babies with severe congenital abnormalities.In their study, the scientists first infected mice with Zika virus and allowed the animals' immune systems to produce anti-Zika antibodies.They identified six different antibodies that recognised a particular Zika protein, the envelope or E protein. Of those, four were shown in test-tube experiments to inhibit an Asian strain of Zika virus from infecting cells.In addition to inhibiting the Asian strain, two of the four antibodies also neutralised Zika virus strains derived from Africa and South America (Brazil).In additional experiments, the scientists first prophylactically treated mice with either the most potent Zika neutralising antibodies or with antibodies directed towards an unrelated Chikungunya virus, and a day later exposed the mice to Zika virus.Mice given Chikungunya antibodies developed high levels of Zika virus in their blood and lost weight, and most died.In contrast, mice given Zika antibodies as a preventive treatment developed lower levels of Zika virus and did not develop any clinical signs of infection.The researchers note that the key question of whether Zika neutralising antibodies could protect pregnant women and their developing foetuses remains to be answered.Due to significant differences in gestational features between mice and humans, antibody protection studies may require experiments in other mammals, such as non-human primates, that allow for optimal transfer of antibodies from the mother to the foetus, as occurs in humans, they noted."
Solar plane lands in Egypt in penultimate stop of world tour,http://timesofindia.indiatimes.com/home/science/Solar-plane-lands-in-Egypt-in-penultimate-stop-of-world-tour/articleshow/53194089.cms,"CAIRO: The Solar Impulse 2 landed in Cairo on Wednesday for its penultimate stop as the solar-powered plane nears the end of its marathon tour around the world.After the two-day flight from Spain, just one final leg lies between it and its final destination, Abu Dhabi, where it started its odyssey in March last year.The aircraft landed in Spain last month, after completing the first solo transatlantic flight powered only by sunlight.After setting off from Seville on Monday morning, the plane passed through Algerian, Tunisian, Italian and Greek airspace, and flew over the Giza Pyramids before touching down at Cairo airport at around 7:10 am (0510 GMT).Its support crew cheered as the plane, no heavier than a car but with the wingspan of a Boeing 747, landed, and trailed after it on bicycles.It had finished the 3,745 kilometre (2,327 mile) journey with an average speed of 76.7 kilometres (47.7 miles) an hour, the flight organiser said.""It was fantastic, everything worked well,"" pilot Andre Borschberg told the control tower, as a live stream from the cockpit was broadcast on Solar Impulse 2's Facebook page.He emerged from the cockpit and hugged Bertrand Piccard, with whom he has taken turns flying the plane around the world.Solar Impulse is being flown on its 35,400-kilometre (22,000 mile) trip in stages, with Piccard and his Swiss compatriot Borschberg alternating at the controls of the single-seat plane.Picard, who had arrived early to greet the aircraft, told reporters that flying Solar Impulse 2 showed what new technologies can do.The 58-year-old had flown the plane across the Atlantic in a 6,765 kilometre (4,200 mile) journey.It had completed its flight from New York to Seville in 71 hours, flying through the night with the energy stored in its 17,000 photovoltaic cells.""It's a new era for energy,"" he said.""I love to fly this plane because when you are in the air for several days you have the impression to be in a film of science fiction,"" he said.""You look at the sun, you look at your motors, they turn for days and for days, no fuel. And you think that's a miracle. That's magic. It is actually the reality of today. This is what we can do with these new technologies.""He said the pilot takes 20 minute naps during the long flights, as the plane inches across the sky.Borschberg had piloted the plane in its 8,924 kilometre (5,545 mile) flight from Japan to Hawaii in 118 hours, breaking the previous record for the longest uninterrupted journey in aviation history.""It is comfortable. But of course you need to train for that,"" Piccard said.Borschberg and Piccard have said they want to raise awareness of renewable energy sources and technologies with their project.Picard said the plane could fly continuously. ""The pilot is the limit,"" he told AFP.""You capture the energy during the day, you use it in the engines and store it, and during the night you use the storage from the batteries, and you continue cycle after cycle,"" he said.Borschberg said a 20-day long flight could be on the cards.""Will we be able to fly longer? I believe we will fly 20 days. But you have to be sustainable. You have to produce water. You have to produce oxygen,"" he said.Piccard does not expect solar powered commercial planes any time soon.""But there will be passengers very soon in electric airplanes that we will charge on the ground.""On the ground you can charge batteries and you can have short haul flights maybe 500 kilometres (310 miles) with 50 people flying in these planes"" in a decade, he predicted."
'Why do docs shy away from diagnosing occupational diseases?',http://timesofindia.indiatimes.com/home/science/Why-do-docs-shy-away-from-diagnosing-occupational-diseases/articleshow/53193241.cms,"JAIPUR: Earlier this month, the All India Institute of Medical Sciences at Jodhpur hosted a conference on occupational health. Given that there are over 5,300 patients of silicosis in the state, occupational health is a big concern in Rajasthan. One of the speakers at the seminar insisted that no amount of NGO action or government compensation can reverse the trend of the large numbers of people falling prey to occupational disease. Only when a proper diagnosis is made, and when people are informed of the prognosis once the condition is detected, can the battle against occupational disease be won, said Dr Murlidhar Venkateshwaran, who in the 1990s was actively involved in making the diagnosis of byssinosis among textile workers in Maharashtra.Byssinosis is a lung disease that afflicts people who work with cotton and yarn and are exposed to the dust of these for long periods, working as they do in poorly ventilated spaces.Venkateshwaran told TOI that the trend was for doctors to conduct research and write for medical journals about occupational diseases. ""However, often these are conditions that are incurable, and doctors sometimes think there is no purpose served in informing the patient. I think that is unethical. The worker must know the prognosis. He must know why he is falling sick.""Dr MK Devarajan of the Rajasthan State Human Rights Commission, who also participated in the Jodhpur conference, said, ""Occupational diseases like silicosis and asbestosis are notified diseases, under the Mines Act, the Factories Act and the Building and Other Construction Workers Act. However, until the human rights commission stepped in, diagnoses of these diseases was not notified. Even despite all our circulars, the number of cases notified is not substantial. Doctors seem reluctant to make the diagnosis.""Venkateshwaran explained that proper diagnosis is key to fighting occupational disease. ""If you look at WHO data, you will find that the percentage of occupational diseases registered in India is much less than, say, Norway. This is because there is also a data gap, because of poor diagnosis.""There are 34 diseases that are 'notified' diseases in India - once a medical practitioner diagnoses the condition, he or she is bound by law to inform authorities. Many of these are also diseases for which workers can claim compensation, under the Workmen's Compensation Act. However, many silicosis patients work in illegal mines, and cannot avail compensation.In 2013, the government of Rajasthan began to offer patients of silicosis Rs1 lakh in compensation, once the diagnosis was certified by the Pneumoconiosis Board. Those who lost a member of the family to silicosis could claim Rs3 lakh.Venkateshwaran said it was unfortunate that doctors are sometimes engaged by the very firms where the workers are falling ill, and are encouraged to not diagnose the condition. Diagnosis would place the burden of compensation on the employer. He said this was the condition not just in India, but even abroad. ""If the doctor is paid by the private employer, he might risk losing his job. However, even doctors who are not on the private firm's pay roll are often reluctant to make the diagnosis,"" Venkateshwaran said.Dr DR Meena, director, public health of the state government refused to offer any comments on whether doctors were justified in fearing to make a proper diagnosis of occupational illnesses."
Isro and Nasa join hands to develop data satellite by 2021,http://timesofindia.indiatimes.com/home/science/Isro-and-Nasa-join-hands-to-develop-data-satellite-by-2021/articleshow/53322006.cms,New Delhi: India's space agency ISRO and USA's Jet Propulsion Laboratory (JPL) of the NASA are jointly working on the development of a 'Dual Frequency (L&S; band) Synthetic Aperture Radar Imaging Satellite' which will be useful for variety of applications including natural resources mapping and monitoring. The joint mission is expected to bring result by 2021.
"In a first, IVF with frozen embryo used for breeding indigenous cows",http://timesofindia.indiatimes.com/home/science/In-a-first-IVF-with-frozen-embryo-used-for-breeding-indigenous-cows/articleshow/53305468.cms,"Gopalpur (Chhattisgarh) in-virto fertilization technique (IVF) and frozen embryo has been successfully used to establish pregnancy in livestock for the first time India—a major breakthrough for genetically improving, conserving and propagating indigenous cow breeds. Chhattisgarh chief minister Raman Singh on Wednesday launched ""JK BovaGenix"" that will focus on producing IVF embryos on a large scale from indigenous cattle breeds at Dr Vijayapat Singhania Centre for Excellence for Assisted Reproductive Techniques here in Janjgir Champa district. The project is of J K Trust—an NGO which has been working towards livestock breed improvement using artificial insemination technology for the last four decades.Establishment of pregnancies using frozen embryo is for the first time in India at present the centre has 28 cows with 14 pregnancies through IVF and 14 through frozen IVF embryos in the last three months since its inception. The first batch of IVF calves are expected to be born by the year. In 2012, a calf was born with this technique but the attempt was unsuccessful.In IVF technique, the ova is aspirated manually from the donor mother's ovary and is then combined with male semen to develop an ova into an embryo, which can be frozen and preserved for many years. These embryos are then transplanted into recipient mothers to produce live calves.Speaking at the function, chief minister Raman Singh said this is an initiative that his government will support. ""I think this can be developed further with the assistance from other states as it would help protect and propagate indigenous cow breeds and boost milk output"", he added.Dr V P Singhania, JK trust chairman, expressed the hope that success of the programme would create several thousand high milk yielding cattle and good quality of bulls in the near future.Union agriculture ministry's animal husbandry commissioner Suresh S Honnappagol described the research and the breakthrough as a major step towards preserving indigenous cattle breed and improving its milk yield. He said the centre has already earmarked Rs 850 crores for various technological and programmes that will ultimately benefit the farmers. Dr Shyam Zavar, CEO and a pioneer in embryo transfer research, said the project aims to rapidly multiply and upgrade indigenous breeds of cattle such as Gir from Gujarat, Sahiwal from Punjab and Haryana, Tarparkar from Rajasthan and Ongole from Andhra Pradesh and others. There are 40 indigenous breeds of cattle and 13 breeds of buffalos in the country.He said indigenous cattle breed in India have a lower milk yield as compared to the same breed in other parts of the world. For instance, he said, indigenous breed like Gir produce 2.5 times more milk in Brazil as compared to our country because of the genetic improvement and not necessarily by eating twice the quantity of fodder.Chief minister Raman Singh also launched a mobile cattle IVF and embryo transfer lab, the first in the country, which will facilitate this advanced assisted re-productive technology to the door steps of the farmers in villages across many states."
Playing Pokemon Go may have health benefits: experts,http://timesofindia.indiatimes.com/home/science/Playing-Pokemon-Go-may-have-health-benefits-experts/articleshow/53270745.cms,"WASHINGTON: Playing Pokemon Go, a new location-based augmented reality game, has real-life positive health consequences, according to scientists."
Fish can get arthritis too: Study,http://timesofindia.indiatimes.com/home/science/Fish-can-get-arthritis-too-Study/articleshow/53252822.cms,"LOS ANGELES: Even the very first bony fish on Earth were susceptible to arthritis, a new study has found a discovery that may fast-track therapeutic research in preventing and treating the painful joint disorder."
