Heading,Link,Summary
Hello Jupiter! NASA spacecraft arrives at giant planet,http://timesofindia.indiatimes.com/home/science/Hello-Jupiter-NASA-spacecraft-arrives-at-giant-planet/articleshow/53055622.cms,"PASADENA, Calif: Braving intense radiation, a NASA+ spacecraft reached Jupiter on Monday after a five-year voyage to begin exploring the king of the planets.Ground controllers at the NASA Jet Propulsion Laboratory erupted in applause when the solar-powered Juno spacecraft beamed home news that it was circling Jupiter's poles.The arrival at Jupiter was dramatic. As Juno approached its target, it fired its rocket engine to slow itself down and gently slipped into orbit. Because of the communication time lag between Jupiter and Earth, Juno was on autopilot when it executed the daring move.The spacecraft's camera and other instruments were switched off for arrival, so there won't be any pictures at the moment it reaches its destination. Hours before the encounter, NASA released a series of images taken last week during the approach, showing Jupiter glowing yellow in the distance, circled by its four inner moons.Scientists have promised close-up views of the planet when Juno skims the cloud tops during the 20-month, $1.1 billion mission.  The fifth rock from the sun and the heftiest planet in the solar system, Jupiter is what's known as a gas giant — a ball of hydrogen and helium — unlike rocky Earth and Mars.With its billowy clouds and colorful stripes, Jupiter is an extreme world that likely formed first, shortly after the sun. Unlocking its history may hold clues to understanding how Earth and the rest of the solar system developed.Named after Jupiter's cloud-piercing wife in Roman mythology, Juno is only the second mission designed to spend time at Jupiter.Galileo, launched in 1989, circled Jupiter for nearly a decade, beaming back splendid views of the planet and its numerous moons. It uncovered signs of an ocean beneath the icy surface of the moon Europa, considered a top target in the search for life outside Earth.Juno's mission: To peer through Jupiter's cloud-socked atmosphere and map the interior from a unique vantage point above the poles. Among the lingering questions: How much water exists? Is there a solid core? Why are Jupiter's southern and northern lights the brightest in the solar system?""What Juno's about is looking beneath that surface,"" Juno chief scientist Scott Bolton said before the arrival. ""We've got to go down and look at what's inside, see how it's built, how deep these features go, learn about its real secrets.""There's also the mystery of its Great Red Spot. Recent observations by the Hubble Space Telescope revealed the centuries-old monster storm in Jupiter's atmosphere is shrinking.The trek to Jupiter, spanning nearly five years and 1.8 billion miles (2.8 billion kilometers), took Juno on a tour of the inner solar system followed by a swing past Earth that catapulted it beyond the asteroid belt between Mars and Jupiter.Along the way, Juno became the first spacecraft to cruise that far out powered by the sun, beating Europe's comet-chasing Rosetta spacecraft. A trio of massive solar wings sticks out from Juno like blades from a windmill, generating 500 watts of power to run its nine instruments.In the coming days, Juno will turn its instruments back on, but the real work won't begin until late August when the spacecraft swings in closer. Plans called for Juno to swoop within 3,000 miles (5,000 kilometers) of Jupiter's clouds — closer than previous missions — to map the planet's gravity and magnetic fields in order to learn about the interior makeup.Juno, built by Lockheed Martin, is an armored spacecraft — its computer and electronics are locked in a titanium vault to shield them from harmful radiation. Even so, Juno is expected to get blasted with radiation equal to more than 100 million dental X-rays during the mission.Like Galileo before it, Juno meets its demise in 2018 when it deliberately dives into Jupiter's atmosphere and disintegrates — a necessary sacrifice to prevent any chance of accidentally crashing into the planet's potentially habitable moons."
Zika virus may not cause microcephaly: Study,http://timesofindia.indiatimes.com/home/science/Zika-virus-may-not-cause-microcephaly-Study/articleshow/52928651.cms,"NEW YORK: The number of missing cases of microcephaly epidemic in several countries raises serious questions about the assumed connection between Zika and microcephaly, finds a new study.The epidemic of microcephaly — a birth defect where a baby's head is smaller — in Brazil has raised serious questions about its assumed connection with Zika virus, a new study explains.Prenatal Zika virus infection has been linked to adverse pregnancy and birth outcomes, most notably microcephaly and other serious brain anomalies.In Brazil, the microcephaly rate soared with more than 1,500 confirmed cases.A new study in Colombia found that the total number of pregnancies with Zika infections is much larger, with 11,944 cases with Zika symptoms being observed in clinical settings. But, no cases of microcephaly occurred in all of these pregnancies.However, the report cites four cases of microcephaly with Zika in the general population that did not report any Zika symptoms.This implies that there are many more cases of Zika infection that are not reported, said Yaneer Bar-Yam from the New England Complex Systems Institute in the US.The Zika and microcephaly cases that are not part of the study show that there are many more pregnancies affected by Zika without symptoms.""If Zika is to blame for microcephaly, where are the missing cases?"" researchers asked.Until April 28, there has been a total of about 50 microcephaly cases in Colombia, of which only four have been connected with Zika, the researchers said.In light of this evidence, the cause of microcephaly in Brazil should be reconsidered, said the paper published in the New England Journal of Medicine.An alternative cause of microcephaly in Brazil could be the pesticide pyriproxyfen, which is cross-reactive with retinoic acid and is being used in drinking water, the researchers concluded."
Three astronauts blast off for International Space Station in upgraded Soyuz spacecraft,http://timesofindia.indiatimes.com/home/science/Three-astronauts-blast-off-for-International-Space-Station-in-upgraded-Soyuz-spacecraft/articleshow/53091180.cms,"BAIKONUR, KAZAKHSTAN: Three astronauts blasted off into the early morning sky in an upgraded Soyuz spacecraft from Russia's Baikonur cosmodrome on Thursday, heading towards the International Space Station."
"Rice farming dates back to China, 9000 years ago",http://timesofindia.indiatimes.com/home/science/Rice-farming-dates-back-to-China-9000-years-ago/articleshow/52880806.cms,"NEW DELHI: Rice farming originated in China over 9000 years ago, according to new evidence unearthed by archaeologists. This pushes back the period of origin from the present estimate of about 8200 years ago, made in 2011. This discovery, made by a team of archaeologists from the University of Toronto Mississauga in Canada and the Zhejiang Provincial Institute of Cultural Relics and Archaeology in China. The study sheds new light on the origins of rice domestication and on the history of human agricultural practices.""Today, rice is one of most important grains in the world's economy, yet at one time, it was a wild plant...how did people bring rice into their world? This gives us another clue about how humans became farmers,"" says Gary Crawford, an anthropological archaeologist who studies the relationships between people and plants in prehistory.Working with three researchers from the Provincial Institute of Cultural Relics and Archaeology in Zhejiang Province, China, Crawford found the ancient domesticated rice fragments in a probable ditch in the lower Yangtze valley. They observed that about 30 per cent of the rice plant material - primarily bases, husks and leaf epidermis - were not wild, but showed signs of being purposely cultivated to produce rice plants that were durable and suitable for human consumption. Crawford says this finding indicates that the domestication of rice has been going on for much longer than originally thought. The rice plant remains also had characteristics of japonica rice, the short grain rice used in sushi that today is cultivated in Japan and Korea. Crawford says this finding clarifies the lineage of this specific rice crop, and confirms for the first time that it grew in this region of China.Crawford and his colleagues spent about three years exploring the five-hectare archaeological dig site, called Huxi, which is situated in a flat basin about 100 metres above sea level. Their investigations were supported by other U of T Mississauga participants - anthropology professor David Smith and graduate students Danial Kwan and Nattha Cheunwattana. They worked primarily in early spring, fall and winter in order to avoid the late-spring wet season and excruciatingly hot summer months. Digging 1.5 metres below the ground, the team also unearthed artefacts such as sophisticated pottery and stone tools, as well as animal bones, charcoal and other plant seeds.This study builds on Crawford's previous research into early agriculture in China, in which he has examined the ancient settlements, tools, and plant and animal management efforts that occurred in different regions of the country. He is interested in better understanding the forces that compelled our human ancestors to transition from hunters and gatherers to farmers.""The question I ultimately want to answer is, what pushed them to move wholeheartedly into the farming regime? Why did they reduce their emphasis on hunting and expand into crop production?"" Crawford says. ""People did what they needed to do to make their lives more manageable and sustainable, and the unintended consequence was farming. With this rice discovery, we're seeing the first stages of that shift."" he added.The study is published in Scientific Reports, an online open-access journal from the publishers of Nature."
Gravitational waves can tell how black holes are born,http://timesofindia.indiatimes.com/home/science/Gravitational-waves-can-tell-how-black-holes-are-born/articleshow/52935414.cms,"LONDON: Gravitational waves or ripples in space-time captured by space detectors could soon be used to discover when and how some of the universe's largest black holes were born, scientists say."
Volcanoes go quiet before they erupt: Study,http://timesofindia.indiatimes.com/home/science/Volcanoes-go-quiet-before-they-erupt-Study/articleshow/52903120.cms,"WASHINGTON: Periods of seismic quiet occur immediately before volcanic eruptions and can thus be used to forecast an impending eruption for restless volcanoes, scientists say. When dormant volcanoes are about to erupt, they show some predictive characteristics - seismic activity beneath the volcano starts to increase, gas escapes through the vent, or the surrounding ground starts to deform. However, until now, there has not been a way to forecast eruptions of more restless volcanoes because of the constant seismic activity and gas and steam emissions.Diana Roman, a volcanologist at Carnegie Institution for Science (CIS) in the US, working with a team of scientists from Pennsylvania State University, Oxford University, the University of Iceland found that periods of seismic quiet occur immediately before eruptions and can thus be used to forecast an impending eruption for restless volcanoes.The duration of the silence can indicate the level of energy that will be released when eruption occurs. Longer quiet periods mean a bigger bang. The team monitored a sequence of eruptions at the Telica Volcano in Nicaragua in 2011. It is a so-called stratovolcano, with a classic-looking cone built up by many layers of lava and ash.They started monitoring Telica in 2009 with various instruments and by 2011 they had a comprehensive network within four kilometres of the volcano's summit. The 2011 eruptive event was a month-long series of small to moderate ash explosions. Prior to the eruption, there was a lack of deep seismicity or deformation, and small changes in sulphur dioxide gas emissions, indicating that the eruption was not driven by fresh magma.Instead, the eruption likely resulted from the vents being sealed off so that gas could not escape. This resulted in an increase in the pressure that eventually caused the explosions.Of the 50 explosions that occurred, 35 had preceding quiet periods lasting 30 minutes or longer. Thirteen explosions were preceded by quiet intervals of at least five minutes. Only two of the 50 did not have any quiet period preceding the explosion.""It is the proverbial calm before the storm. The icing on the cake is that we could also use these quiet periods to forecast the amount of energy released,"" said Roman.The researchers did a ""hindsight"" analysis of the energy released and found that the longer the quiet phase preceding an explosion, the more energy was released in the ensuing explosion. The quiet periods ranged from six minutes before an explosion to over 10 hours for the largest explosion.The researchers were also able to forecast a minimum energy for impending explosions based on the data from the previous quiet/explosion pairs and the duration of the particular quiet period being analysed. The research was published in the journal Earth and Planetary Science Letters."
Nasa's New Horizons mission to travel deeper into space,http://timesofindia.indiatimes.com/home/science/Nasas-New-Horizons-mission-to-travel-deeper-into-space/articleshow/53019319.cms,"WASHINGTON: Following its historic first-ever flyby of Pluto, Nasa's New Horizons mission will fly deeper into space towards an ancient object considered to be one of the early building blocks of the solar system."
Why some galaxies stop creating stars,http://timesofindia.indiatimes.com/home/science/Why-some-galaxies-stop-creating-stars/articleshow/53129977.cms,"NEW YORK: Scientists may finally have an explanation for why some galaxies stop creating stars after a team of astrophysicists painstakingly analysed around 70,000 galaxies to understand the forces influencing star formation activity in them."
Solar Impulse 2 lands in Spain after three-day Atlantic crossing,http://timesofindia.indiatimes.com/home/science/Solar-Impulse-2-lands-in-Spain-after-three-day-Atlantic-crossing/articleshow/52880716.cms,"SEVILLE: An airplane powered solely by the sun landed safely in Seville in Spain early on Thursday after an almost three-day flight across the Atlantic from New York in one of the longest legs of the first ever fuel-less flight around the world.The single-seat Solar Impulse 2 touched down shortly after 7.30 a.m. local time in Seville after leaving John F. Kennedy International Airport at about 2.30 a.m. EDT on June 20.The flight of just over 71 hours was the 15th leg of the round-the-world journey by the plane piloted in turns by Swiss aviators Bertrand Piccard and Andre Borschberg.""Oh-la-la, absolutely perfect,"" Piccard said after landing, thanking his engineering crew for their efforts.With a cruising speed of around 70 kilometres an hour (43 miles per hour), similar to an average car, the plane has more than 17,0000 solar cells built in to wings with a span bigger than that of a Boeing 747."
Juno successfully enters Jupiter orbit: NASA,http://timesofindia.indiatimes.com/home/science/Juno-successfully-enters-Jupiter-orbit-NASA/articleshow/53055035.cms,"MIAMI: NASA's unmanned Juno spacecraft on Monday began orbiting Jupiter, a key triumph for a $1.1 billion mission that aims to uncover the origins of the biggest planet in the solar system.""Welcome to Jupiter,"" said a commentator at mission control at NASA's Jet Propulsion Laboratory in Pasadena, California.The room erupted in cheers as the solar observatory, which has traveled 1.7 billion miles (2.7 billion kilometers) since it launched five years ago from Cape Canaveral, Florida, successfully entered its aimed-for orbit around Jupiter at 11:53pm (03:53 GMT on Tuesday).  The mission cost $1.1 billion dollars and launched five years ago from Cape Canaveral, Florida. The NASA mission aims to orbit Jupiter from pole to pole, sampling its charged particles and magnetic fields for the first time and revealing more about the auroras in ultraviolet light that can be seen around the planet's polar regions.Juno should circle the planet 37 times before finally making a death plunge in 2018, to prevent the spacecraft from causing damage to any of Jupiter's icy moons, which NASA hopes to explore one day for signs of life.Although Juno will not be the first spacecraft to circle Jupiter, NASA says its orbit will bring it closer than its predecessor, Galileo, which launched in 1989.That spacecraft found evidence of subsurface saltwater on Jupiter's moons Europa, Ganymede and Callisto before making a final plunge into Jupiter in 2003.NASA says Juno should be able to get closer than Galileo -- this time within 3,100 miles (5,000 kilometers) above the cloud tops.""We have done everything humanly possible to make this mission a success,"" said NASA's director of planetary science, Jim Green.However, ""it is still a cliffhanger for me, too."""
ISRO's century emboldens it to embrace private sector,http://timesofindia.indiatimes.com/home/science/ISROs-century-emboldens-it-to-embrace-private-sector/articleshow/53029129.cms,"NEW DELHI: Almost unsung, the Indian Space Research Organisation (ISRO) completed a century of launching satellites in space. This was in true Test cricket fashion a slow plod taking almost 36 years, since the first satellite to be launched from India was Rohini in 1980."
Nail-biting kids have less allergies,http://timesofindia.indiatimes.com/home/science/Nail-biting-kids-have-less-allergies/articleshow/53152036.cms,"NEW DELHI: Children who suck thumbs or keep biting their nails get scolded a lot for these bad habits. But a new research has found that there is a positive side to these habits. Such children are less likely to develop common allergies to house dust mites, grass, cats, dogs, horses or airborne fungi. Children who have both habits are even less likely to have these allergies.The research, published in the journal Pediatrics on Monday, was completed by researchers of New Zealand's Dunedin School of Medicine, assisted by professor Malcolm Sears of McMaster University, Ontario, Canada, who was formerly at Dunedin.""Our findings are consistent with the hygiene theory that early exposure to dirt or germs reduces the risk of developing allergies,"" said Sears. ""While we don't recommend that these habits should be encouraged, there does appear to be a positive side to these habits.""The researchers were testing the idea that the common childhood habits of thumb-sucking and nail-biting would increase microbial exposures, affecting the immune system and reducing the development of allergic reactions also known as atopic sensitization.The habits of thumb-sucking and nail-biting were measured in a longitudinal birth cohort of more than 1,000 New Zealand children at ages 5, 7, 9 and 11; and atopic sensitization was measured by skin-prick testing at 13 and 32 years old.The researchers found 31 per cent of children were frequent thumb suckers or nail biters.Among all children at 13 years old, 45% showed atopic sensitization, but among those with one oral habit, only 40% had allergies. Among those with both habits, only 31% had allergies. This trend was sustained into adulthood, and showed no difference depending on smoking in the household, ownership of cats or dogs; or exposure to house dust mites.However, the study did not find associations between the oral habits and development of asthma or hay fever."
Your parents may be to blame for job problems: Study,http://timesofindia.indiatimes.com/home/science/Your-parents-may-be-to-blame-for-job-problems-Study/articleshow/53140367.cms,"WASHINGTON: Parents, take note! If your kids have problems at work, you may be responsible to some extent for the trouble, according to a new study which found a link between parenting styles and workplace behaviour.""It really is about both parents, but because mothers are typically the primary caregivers of the children, they usually have more influence on their children,"" said Peter Harms from University of Alabama in the US.Researchers studied manager-employee relationships in the workplace and found a link between parenting styles and workplace behaviour.Their research was based on the work of John Bowlby, an early psychoanalyst, who argued that the way parents treat their offspring could have long-term implications for how their children approach relationships.In particular, the work focused on how parents acted when their infants cried out for help.""You will see this in almost any parenting book you buy. Should you let the baby cry, or should you rush to comfort them,"" said Harms.Babies learn over time that when they feel abandoned or threatened they can either count on their parent to come to their rescue right away or they need to escalate to high levels of distress in order to get attention.Or, if babies learn that parents are not a reliable source of comfort, they stop making overt appeals for help.Individuals with reliable parents view others as potential sources of support. Those individuals with unreliable parents tend not to see parents as sources of support, researchers said.These people are often categorised as having anxious or avoidant attachment depending on the style they adopted to cope with distress, they said.""Anxiously attached people genuinely want to be loved, but they are nervous that the important people in their lives will not return their affection,"" said Harms.""They overreact anytime they think their relationships are threatened. They use guilt and extreme emotional displays so that others will stay near and reassure them. They get really upset and cannot turn it off,"" Harms said.""On the other hand, avoidant people feel, 'I do not want to love you, and you do not need to love me. So just leave me alone.' You will not find these people weeping over broken relationships,"" he added.Researchers speculated that individuals may transfer this pattern of thinking into the workplace and, in particular, that it may influence one's relationship with one's boss.""Your boss is sort of like your parent. They are the ones who can take care of you, they are supposed to train you and support you. This is especially true for individuals new to the workforce,"" said Harms.The findings showed that when anxious followers were paired with supportive leaders, they were perfectly fine.But when they were paired with distant, unsupportive leaders, the anxiously attached employees reported higher levels of stress and lower levels of performance.The study was published in the journal Human Relations."
GM field trials in agri university farms?,http://timesofindia.indiatimes.com/home/science/GM-field-trials-in-agri-university-farms/articleshow/52921322.cms,NEW DELHI: The central regulator on transgenic organisms has proposed to utilize farms of select agricultural universities for field trials of genetically modified (GM) crops as a nationally-coordinated project under strict expert supervision.
'Selfie elbow' becoming new medical condition,http://timesofindia.indiatimes.com/home/science/Selfie-elbow-becoming-new-medical-condition/articleshow/53053672.cms,"NEW YORK: Doctors have warned that capturing that perfect selfie can put avid selfietakers at risk of developing ""selfie elbow"", which is becoming a medical condition.Like tennis elbow or golfer's elbow, an addiction to taking selfies can cause a pain in the primary elbow and there has been a spurt in patients landing in the doctor's office with the contion.According to Jordan Metzl, a sports medicine physician at Hospital for Special Surgery in the US, the problem is overuse. Like carpal tunnel and tendinitis, it is the repetitive nature of the task that causes the aches. If you do something enough times - typing, texting, or taking selfies - it is going to have consequences.""Basically, the interface between technology and the human body sometimes causes injuries of over-exuberance,"" Metzl said, adding, ""We used to see it with Blackberry phones -it was a real thing. People would get tendinitis in their thumb because they were on their Blackberries all the time.""Explaining the problem, Metzl said, ""You put too much stress on the muscle and it irritates the area where the muscle comes off the bone and you get this inflammatory response."" The condition can be treated by taking pain relievers like Advil or Motrin for the inflammation and putting on some ice as well as stretching the muscles.The condition is an addition to the long list of concerns about the increase in technology injuries in teens. Gaming, using Snapchat, selfie-taking, texting and tweeting teens are more prone to overuse injuries than ever before.In a recent case, award winning journalist Hoda Kotb went to a doctor complaining of pain in her elbow. ""I went to the orthopaedist and he said, `are you playing tennis or ping-pong?' I told him I was taking selfies,"" Kotb was quoted as saying.""In recent years we've been seeing an increase in carpal tunnel syndrome and tendinitis from overuse in teens, where 10 to 15 years ago it was mostly scraped knees and falling off a bike,"" said Charles Kim, a musculoskeletal rehab specialist at Rusk Rehabilitation at New York University Langone Medical Centre.Kim suggests a selfie stick for the dedicated documenters, which works like an arm extender and takes the pressure off the elbow."
