Heading,Link,Summary
"Rise in breast cancer gene testing after Angelina Jolie's NYT writeup, but…",http://timesofindia.indiatimes.com/home/science/rise-in-breast-cancer-gene-testing-after-angelina-jolies-nyt-writeup-but/articleshow/56007867.cms,"Do celebrity endorsements for health-related matters work? They create an awareness don't always get the desired results, said a study published in the Christmas edition of The BMJ."
This weird planet has clouds made of rubies and sapphires,http://timesofindia.indiatimes.com/home/science/This-weird-planet-has-clouds-made-of-rubies-and-sapphires/articleshow/55957858.cms,"NEW DELHI: A giant planet over 1,000 light years away has one of the weirdest weather systems. Clouds of corundum, the material that makes rubies and sapphires, are formed in daytime temperatures of over 3000 degrees Celsius. These gigantic clouds are swept away by high speed winds that likely cause catastrophic storms."
Santa doesn't care about nice or naughty kids: Harvard study,http://timesofindia.indiatimes.com/home/science/santa-doesnt-care-about-nice-or-naughty-kids-harvard-study/articleshow/56003167.cms,"NEW DELHI: A quirky - but scientific -- study published in the Christmas edition of The BMJ medical journal states that contrary to the popular notion that Santa gives presents to children who are ""nice"" and not ""naughty"", it may be that visits from Santa have more to do with socio-economic factors. The study has been done by researchers from the Harvard T H Chan School of Public Health after calling up 186 hospital pediatric departments."
Buzz Aldrin gets visit from NASA after polar evacuation,http://timesofindia.indiatimes.com/home/science/Buzz-Aldrin-gets-visit-from-NASA-after-polar-evacuation/articleshow/55771570.cms,"CHRISTCHURCH, New Zealand: Buzz Aldrin had an unexpected bedside visit from NASA deputy administrator Dava Newman on Saturday as he continued to recover in a New Zealand hospital from his medical evacuation from the South Pole."
"Play a game, learn to code: Computer science week kicks off across the globe",http://timesofindia.indiatimes.com/home/science/Play-a-game-learn-to-code-Computer-science-week-kicks-off-across-the-globe/articleshow/55885587.cms,"CHENNAI: Can toddlers code? Well there are games that can teach them coding basics. For example, a 5-year-old playing with ""Pixel the Puppy"" learns to code as he helps the puppy find his way back home. For children in standards VI-VIII, there are games based on the movie Frozen that help Anna and Elsa explore their ice land, create snowflakes and skate on ice. Older children also have the choice of programming a basketball game or capturing monstors in an enchanted forest."
"Now, Nuclear-waste batteries that will last for 5,000 years",http://timesofindia.indiatimes.com/home/science/Now-Nuclear-waste-batteries-that-will-last-for-5000-years/articleshow/55679224.cms,LONDON: Scientists have developed a new technology that uses nuclear waste to generate clean electricity in a nuclear-powered battery.
Earth's 'technosphere' weighs 30 trillion tons,http://timesofindia.indiatimes.com/home/science/Earths-technosphere-weighs-30-trillion-tons/articleshow/55722385.cms,"NEW DELHI: All the things humans have made - from houses and roads to mines and farms, and all the small products that we use - together weigh about 30 trillion tons according to an estimate made by an international team led by University of Leicester geologists. This staggering creation, called the technosphere, is enough to put 50 kgs on every square meter of the Earth's surface."
"NASA's hunt for ""Trojan"" asteroids in Earth's orbit",http://timesofindia.indiatimes.com/home/science/nasas-hunt-for-trojan-asteroids-in-earths-orbit/articleshow/55956101.cms,"WASHINGTON: NASA's OSIRIS-REx spacecraft is set to search for elusive ""Trojan"" asteroids which are constant companions to Earth as it orbits the Sun."
Record production of ethanol may cut fuel bill,http://timesofindia.indiatimes.com/home/science/Record-production-of-ethanol-may-cut-fuel-bill/articleshow/55931251.cms,"NEW DELHI: Sugar mills recorded the highest ever production of ethanol of more than 110 crore litres during 2015-16 crop year, over 50% more than what was produced during the previous year."
New polymer patch can repair heart damage,http://timesofindia.indiatimes.com/home/science/New-polymer-patch-can-repair-heart-damage/articleshow/55791290.cms,"MELBOURNE: A new flexible polymer patch can improve the conduction of electrical impulses across damaged heart tissue without the need for stitches, scientists say."
Unmanned ISS cargo ship burns up on way to ISS: Russia,http://timesofindia.indiatimes.com/home/science/Unmanned-ISS-cargo-ship-burns-up-on-way-to-ISS-Russia/articleshow/55741534.cms,"MOSCOW: An unmanned cargo ship travelling to the International Space Station burned up in the atmosphere shortly after launching on Friday, the Russian space agency said, raising concerns over space travel safety."
Honeycomb-like structure to trap dangerous gases,http://timesofindia.indiatimes.com/home/science/Honeycomb-like-structure-to-trap-dangerous-gases/articleshow/55976957.cms,"HOUSTON: Researchers have developed a novel method that can trap potentially harmful gases emitted by coal factories, cars and trucks within honeycomb-like microscopic organo-metallic structures."
ISRO launches Remote-sensing satellite to aid farm sector,http://timesofindia.indiatimes.com/home/science/ISRO-launches-Remote-sensing-satellite-to-aid-farm-sector/articleshow/55864537.cms,"NEW DELHI: India successfully launched on Wednesday its latest remote-sensing satellite, RESOURCESAT-2A, which would send data useful for various agricultural applications in the country. The satellite, launched by ISRO's Polar Satellite Launch Vehicle (PSLV) from Sriharikota, will relay specific data on crop area and crop production estimation, drought monitoring, soil mapping and cropping system analysis to generate farm advisories."
Defective 'protein factory' behind aggressive form of leukemia,http://timesofindia.indiatimes.com/home/science/Defective-protein-factory-behind-aggressive-form-of-leukemia/articleshow/55910606.cms,"LONDON: Scientists have identified a defect in the ribosome, the protein factory of the cell in 20 to 40 per cent of the patients with multiple myeloma - a type of leukemia."
Proof of alien existence on Mars?,http://timesofindia.indiatimes.com/home/science/Proof-of-alien-existence-on-Mars/articleshow/55973611.cms,"WASHINGTON: Three tall ""towers"" standing in a perfect straight line on our neighbouring planet Mars in a recent image are claimed by some UFO and alien enthusiasts as clear evidence that highly intelligent beings exist there."
China launches new generation weather satellite,http://timesofindia.indiatimes.com/home/science/China-launches-new-generation-weather-satellite/articleshow/55920721.cms,BEIJING: China has launched a new weather satellite marking an upgrade of its meteorological satellites in geostationary orbit.
"Cancer treatment starts in India at least after 4 months' delay, finds study",http://timesofindia.indiatimes.com/home/science/Cancer-treatment-starts-in-India-at-least-after-4-months-delay-finds-study/articleshow/55857759.cms,"NEW DELHI: A study carried out at the cancer department of a premier referral hospital in Chandigarh, India has shown that patients wait an average of four months before seeking a cancer diagnosis. Results of the study were reported at the European Society for Medical Oncology (ESMO) ASIA 2016 Congress in Singapore."
"Plants can learn from surroundings, study finds",http://timesofindia.indiatimes.com/home/science/Plants-can-learn-from-surroundings-study-finds/articleshow/55838695.cms,"NEW DELHI: Scientists have shown that plants can take lessons from their surroundings and change their behaviour even though it may be something going against their innate 'habit'. In the new study led by University of Western Australia (UWA) researchers found for the first time that plants can learn about their environment by making links between events, an ability thought to be exclusive to animals."
Chemotherapy may cause women to grow new eggs: Study,http://timesofindia.indiatimes.com/home/science/Chemotherapy-may-cause-women-to-grow-new-eggs-Study/articleshow/55834011.cms,"LONDON: Women treated with a common chemotherapy drug combination may have more young eggs in their ovaries afterwards, a new study has found."
Scientists discover new material for gen-next data storage devices,http://timesofindia.indiatimes.com/home/science/New-material-may-lead-to-gen-next-data-storage-devices/articleshow/55649721.cms,"GENEVA: Scientists have developed a new material - the first ever magnetic photoconductor - that may lead to next generation of memory-storage systems, featuring higher capacities with low energy demands."
"John Glenn, first American to orbit Earth, dies at 95",http://timesofindia.indiatimes.com/home/science/John-Glenn-first-American-to-orbit-Earth-dies-at-95/articleshow/55885961.cms,"John Glenn, who became one of the 20th century's greatest explorers as the first American to orbit Earth and later as the world's oldest astronaut, and also had a long career as a US senator, died in Ohio on Thursday at age 95."
Liquid water carved deep canyons on Mars,http://timesofindia.indiatimes.com/home/science/Liquid-water-carved-deep-canyons-on-Mars/articleshow/55745353.cms,"WASHINGTON: Dramatic climate cycles on early Mars, triggered by buildup of greenhouse gases, may have caused liquid water to carve out deep canyons and extensive valley networks on the red planet's surface, scientists including one of Indian origin have found."
Cobra venom can help surgeons spot cancer tumours,http://timesofindia.indiatimes.com/home/science/Cobra-venom-can-help-surgeons-spot-cancer-tumours/articleshow/55971030.cms,"NEW DELHI: What do lethal cobra venom, quantum dots and cancer diagnosis have in common? Nothing - till a team of Russian and Indian scientists put their heads to it and developed an innovative technique to take sharp images of cancer growths."
"Researchers from inStem study sterile inflammation, come up with drug delivery system using bio materials",http://timesofindia.indiatimes.com/home/science/Researchers-from-inStem-study-sterile-inflammation-come-up-with-drug-delivery-system-using-bio-materials/articleshow/55988024.cms,"BENGALURU: In order to prevent long lasting immune reaction of damaged cells in body, known as sterile inflammation leading to osteoarthritis, rheumatoid arthritis and fibrosis, a team of researchers from Institute for Stem Cell Biology and Regenerative Medicine (inStem), Bangalore has gained new insights into development of sterile inflammation and come up with a new drug delivery system to combat chronic inflammation."
Japanese robot flunks top university entry exam,http://timesofindia.indiatimes.com/home/science/Japanese-robot-flunks-top-university-entry-exam/articleshow/55665048.cms,TOKYO: The dream of a Japanese robot with artificial intelligence to secure a place at the prestigious University of Tokyo is over after the bot failed miserably in a standard entrance exam.
"Santa, global warming shrank your reindeer",http://timesofindia.indiatimes.com/home/science/Santa-global-warming-shrank-your-reindeer/articleshow/55951257.cms,"PARIS: If Santa is recruiting helpers to haul Christmas presents around the world this year he had better take a few extra, said researchers who warned on Monday that reindeer are shrinking."
NASA troubleshooting problem with Mars rover drill,http://timesofindia.indiatimes.com/home/science/NASA-troubleshooting-problem-with-Mars-rover-drill/articleshow/55973098.cms,"SAN FRANCISCO: NASA's Mars rover Curiosity has halted its trek up a mountain filled with potentially habitable niches for life while engineers troubleshoot a problem with one of its key instruments, scientists said on Tuesday."
New AI system can predict how scenes will play out,http://timesofindia.indiatimes.com/home/science/New-AI-system-can-predict-how-scenes-will-play-out/articleshow/55923988.cms,"BOSTON: MIT scientists have developed a new artificial intelligence system that can take still images and generate short videos to simulate what happens next, similar to how humans can visually imagine how a scene will evolve."
NASA launches 8 mini-satellites for hurricane forecasting,http://timesofindia.indiatimes.com/home/science/nasa-launches-8-mini-satellites-for-hurricane-forecasting/articleshow/56004282.cms,"CAPE CANAVERAL, Florida: NASA launched eight mini-satellites Thursday morning to measure surface wind deep in the heart of hurricanes."
Europe's new Mars orbiter starts sending data from NASA rovers,http://timesofindia.indiatimes.com/home/science/Europes-new-Mars-orbiter-starts-sending-data-from-NASA-rovers/articleshow/55703172.cms,"WASHINGTON: In the successful first relay test of a NASA radio aboard Europe's new Trace Gas Orbiter (TGO), data from NASA rovers Opportunity and Curiosity reached Earth last week, the US space agency said on Wednesday."
Is feminism killing off romance?,http://timesofindia.indiatimes.com/home/science/Is-feminism-killing-off-romance/articleshow/55858954.cms,"Dating in a completely gender-equal world may sound a rather dry prsopect, but"
Neutron stars may be emitting gravitational waves continuously,http://timesofindia.indiatimes.com/home/science/neutron-stars-may-be-emitting-gravitational-waves-continuously/articleshow/55998160.cms,"WASHINGTON/MUMBAI: Many fast spinning dense neutron stars generate gravitational waves continuously, according to Indian scientists who suggest that careful observations should be made to detect such waves."
Hot hydrogen atoms in Earth's upper atmosphere found,http://timesofindia.indiatimes.com/home/science/Hot-hydrogen-atoms-in-Earths-upper-atmosphere-found/articleshow/55873188.cms,NEW YORK: A team of University of Illinois researchers has discovered the existence of hot atomic hydrogen (H) atoms in an upper layer of Earth's atmosphere known as thermosphere.
Jet lag may up liver cancer risk: Study,http://timesofindia.indiatimes.com/home/science/Jet-lag-may-up-liver-cancer-risk-study/articleshow/55651116.cms,"WASHINGTON: Repeated jet lags may increase obesity-related liver disease as well as risk of liver cancer, a new study has warned."
Insulin cells under skin could save diabetics from jabs,http://timesofindia.indiatimes.com/home/science/Insulin-cells-under-skin-could-save-diabetics-from-jabs/articleshow/55951543.cms,"GENEVA: Scientists have created artificial cells that act as sugar sensors and insulin producers, an advance that may spell an end to painful needle jabs to monitor blood glucose levels, making the everyday life of diabetics easier."
Japan to test 'fishing mesh' to catch space junk,http://timesofindia.indiatimes.com/home/science/Japan-to-test-fishing-mesh-to-catch-space-junk/articleshow/55723299.cms,"Space isn't so empty these days. Earth's orbit is cluttered with more than half a million bits of debris, mostly rocket and satellite remnants that can wreck anything in their flight path."
Predatory bacteria may wipe out 'superbugs': Study,http://timesofindia.indiatimes.com/home/science/Predatory-bacteria-may-wipe-out-superbugs-Study/articleshow/55673294.cms,"LONDON: Predatory bacteria - that eat others of their kind - could be a new weapon in the fight against drug-resistant bacteria or 'superbugs', a new study suggests."
Signs of two infant planets around young star detected,http://timesofindia.indiatimes.com/home/science/signs-of-two-infant-planets-around-young-star-detected/articleshow/55958898.cms,"NEW YORK: Astronomers believe they have found compelling evidence of two newborn planets, each about the size of Saturn, orbiting around a young star known as HD 163296."
Robot flying ambulance makes first solo flight,http://timesofindia.indiatimes.com/home/science/Robot-flying-ambulance-makes-first-solo-flight/articleshow/55791432.cms,"JERUSALEM: An autonomous flying ambulance has successfully completed its first solo test flight, offering a potential solution for challenging search and rescue missions."
"WHO proposes HIV self-test with kit, India to study move",http://timesofindia.indiatimes.com/home/science/India-to-study-WHO-proposal-for-HIV-self-test/articleshow/55715504.cms,"NEW DELHI: The World Health Organisation (WHO) for the first time has recommended HIV self-testing in the privacy of one's home using HIV kit, a move that may result in a major breakthrough in HIV treatment by improving access to diagnosis."
Indian astrophysicist wins challenge on dark energy,http://timesofindia.indiatimes.com/home/science/Indian-astrophysicist-wins-challenge-on-dark-energy/articleshow/55739841.cms,"PUNE: Ten years ago at an international conference in Melbourne, renowned Indian theoretical physicist Thanu Padmanabhan from the Inter-University Centre for Astronomy and Astrophysics, threw a challenge to the international community of astrophysicists to prove his ideas on dark energy wrong by 2016."
"'Homelessness makes people vulnerable to mental,health issues'",http://timesofindia.indiatimes.com/home/science/Homelessness-makes-people-vulnerable-to-mentalhealth-issues/articleshow/55765734.cms,"LONDON: Homelessness makes people vulnerable to mental and health problems, according to a study by British researchers that sheds light on the plight of society's most marginalised people."
Love bigger cause of unhappiness than cash,http://timesofindia.indiatimes.com/home/science/Love-bigger-cause-of-unhappiness-than-cash/articleshow/55951250.cms,"Economic factors are not the biggest cause of un happiness -failed relationships and mental illness play a far greater role, a major new study into the ""origins of happiness"" has found."
Magnetic brain stimulation can bring back 'lost' memories,http://timesofindia.indiatimes.com/home/science/Magnetic-brain-stimulation-can-bring-back-lost-memories/articleshow/55760320.cms,"WASHINGTON: Scientists have found that stimulating the brain with magnets can bring back forgotten memories, an advance that may help people suffering from schizophrenia or depression."
Japan launches 'space junk' collector,http://timesofindia.indiatimes.com/home/science/Japan-launches-space-junk-collector/articleshow/55904909.cms,"TOKYO: Japan launched a cargo ship on Friday bound for the International Space Station (ISS), carrying a 'space junk' collector that was made with the help of a fishnet company."
Spider named after Harry Potter character,http://timesofindia.indiatimes.com/home/science/Spider-named-after-Harry-Potter-character/articleshow/55930913.cms,"MUMBAI: A new spider species discovered by Mumbai researchers in the central western ghats in Karnataka has been named after a popular wizard in the Harry Potter books, mainly because it resembles the magical hat worn by the wizard."
Why getting old makes you happy,http://timesofindia.indiatimes.com/home/science/Why-getting-old-makes-you-happy/articleshow/55858887.cms,"With age comes wisdom... as well as contentment and serenity, which is why,"
Lonely cave dwelling bacteria resistant to 18 antibiotics,http://timesofindia.indiatimes.com/home/science/Lonely-cave-dwelling-bacteria-resistant-to-18-antibiotics/articleshow/55876850.cms,"NEW DELHI: Deep inside a cave where entry is restricted, scientists have found a bacterium that is resistant to 18 different antibiotics. These bugs have been living in isolation 1000 feet underground for over four million years, which raises the question - how did they become resistant to antibiotics discovered only in the 20th century?"
Australian doctors reverse diabetes-linked nerve pain in mice,http://timesofindia.indiatimes.com/home/science/Australian-doctors-reverse-diabetes-linked-nerve-pain-in-mice/articleshow/55964600.cms,"MUMBAI: Here is a development that could bring cheer to at a quarter of the nearly 70 million diabetic patients in India. A new study from Australia claims to have found a mechanism to reverse the pain caused by diabetic neuropathy, which is peripheral nerve damage caused by fluctuating blood sugars."
Eating half-cooked chicken can lead to paralysis: Study,http://timesofindia.indiatimes.com/home/science/Eating-half-cooked-chicken-can-lead-to-paralysis-Study/articleshow/55934197.cms,"WASHINGTON: A common bacterium found in improperly cooked chicken can cause Guillain-Barre Syndrome - the leading cause of acute neuromuscular paralysis in humans, researchers have found for the first time."
"Processed foods, alcohol may trigger migraine attacks: Study",http://timesofindia.indiatimes.com/home/science/Processed-foods-alcohol-may-trigger-migraine-attacks-Study/articleshow/55183955.cms,"WASHINGTON: Skipping the morning cup of coffee, consuming processed foods or drinking too much alcohol may trigger headaches for people battling migraines, according to scientists including one of Indian origin who also found that low-fat diets can help better manage the condition."
100-year-old Antarctic logbooks show no change in sea ice cover,http://timesofindia.indiatimes.com/home/science/100-year-old-Antarctic-logbooks-show-no-change-in-sea-ice-cover/articleshow/55600971.cms,"LONDON: Ice observations recorded by Antarctic explorers about 100 years ago show that the sea ice at the South Pole has barely changed in size over the last century, scientists say."
Ooty telescope detects massive cosmic ray attack that cracked Earth's magnetic shield,http://timesofindia.indiatimes.com/home/science/Ooty-telescope-detects-massive-cosmic-ray-attack-that-cracked-Earths-magnetic-shield/articleshow/55221962.cms,"NEW DELHI: A team of Indian and Japanese scientists using the GRAPES-3 telescope at Ooty, Tamil Nadu, found how a giant cloud of superhot gases and radiation ejected from the Sun battered Earth's magnetic shield and even cracked it for some time allowing deadly cosmic rays to get in. This event compressed the Earth's magnetic shield from 11 to 4 times the radius of Earth. It triggered a severe geomagnetic storm that generated aurora borealis, and radio signal blackouts in many high latitude countries."
Novel tool to may lead to Zika vaccines,http://timesofindia.indiatimes.com/home/science/Novel-tool-to-may-lead-to-Zika-vaccines/articleshow/55511289.cms,"HOUSTON: Scientists have developed a way to replicate the Zika virus, stripping it of the genes that make the virus infectious, an advance that may lower the safety risk involved in working with it and pave the way for vaccine development."
"Mars surface too dry to be habitable, say scientists",http://timesofindia.indiatimes.com/home/science/Mars-surface-too-dry-to-be-habitable-say-scientists/articleshow/55384688.cms,"LONDON: Mars is a primary target in the search for life outside Earth, and liquid water is the most important pre-requisite for life. But a team of international researchers has found that Mars is incredibly dry, and has been that way for millions of years."
Best weather satellite ever built rockets into space,http://timesofindia.indiatimes.com/home/science/Best-weather-satellite-ever-built-rockets-into-space/articleshow/55522891.cms,"CAPE CANAVERAL, FLORIDA: The most advanced weather satellite ever built rocketed into space on Saturday night, part of an $11 billion effort to revolutionize forecasting and save lives."
Arctic Sea ice losing its bulwark against warming atmosphere,http://timesofindia.indiatimes.com/home/science/Arctic-Sea-ice-losing-its-bulwark-against-warming-atmosphere/articleshow/55129546.cms,"WASHINGTON: As the extent of Arctic Sea ice, the vast sheath of frozen seawater floating on the Arctic Ocean and its neighboring seas, shrinks, its oldest and thickest ice has either thinned or melted away, leaving the sea ice cap more vulnerable to the warming ocean and atmosphere, a Nasa study says."
Scientists turn pollution back into green fuel,http://timesofindia.indiatimes.com/home/science/Scientists-turn-pollution-back-into-green-fuel/articleshow/55146719.cms,"Scientists have accidentally discovered a way to reverse the combustion process, turning carbon dioxide (CO2) back into a fuel."
Two US astronauts cast vote from space,http://timesofindia.indiatimes.com/home/science/Two-US-astronauts-cast-vote-from-space/articleshow/55306067.cms,"WASHINGTON: As US gets ready for a nail-biting election on Tuesday, two American astronauts orbiting the Earth at 17,000 miles per hour have already cast their votes from space."
Nasa space telescopes reveal a brown dwarf,http://timesofindia.indiatimes.com/home/science/Nasa-space-telescopes-reveal-a-brown-dwarf/articleshow/55366689.cms,"WASHINGTON: In a first-of-its-kind collaboration, Nasa's Spitzer and Swift space telescopes joined forces to reveal a brown dwarf - thought to be the missing link between planets and stars, with masses up to 80 times that of our solar system's most massive planet, Jupiter."
MRI can detect bone marrow cancer: Study,http://timesofindia.indiatimes.com/home/science/MRI-can-detect-bone-marrow-cancer-Study/articleshow/55438581.cms,"BOSTON: Bone marrow cancer can be identified effectively using Magnetic Resonance Imaging (MRI), according to a new study which may change the way the disease is diagnosed."
NASA's Cassini set to fly closest ever to Saturn's rings,http://timesofindia.indiatimes.com/home/science/NASAs-Cassini-set-to-fly-closest-ever-to-Saturns-rings/articleshow/55577254.cms,"WASHINGTON: NASA's Cassini spacecraft is set to begin a thrilling ride around Saturn, grazing past its outer rings to provide the closest-ever insight into the planet's features."
