Flipkart Diwali Sale Offers: The Best Deals and Discounts You Can Expect,NDTV,2016-10-24 20:13:27.703952
Samsung Galaxy S7 Edge Reportedly Explodes While on Charge,NDTV,2016-10-24 20:13:27.704704
"Google Pixel, Pixel XL do better than expected in water: Watch video",The Indian Express,2016-10-24 20:13:27.705355
Facebook Messenger App for Windows 10 Gets Voice and Video Calling Features,NDTV,2016-10-24 20:13:27.705982
Xiaomi Mi Note 2 Price Tipped Again Ahead of Tuesday's Launch,NDTV,2016-10-24 20:13:27.706601
Linux Exploit in the Wild; Gives Any User Root Access in Less Than Five Seconds,NDTV,2016-10-24 20:13:27.707215
Apple Watch Nike+ arrives in India on October 28,Hindustan Times,2016-10-24 20:13:27.707805
iBall CompBook Flip-X5 Convertible Laptop With Windows 10 Launched Rs. 14999,NDTV,2016-10-24 20:13:27.708419
Wallop of Jio: Vodafone to offer free national roaming from Diwali,The TeCake,2016-10-24 20:13:27.709033
Facebook launches revamped safety centre to tackle bullying,Hindustan Times,2016-10-24 20:13:27.709708
Apple iPhone 7 32GB with slow storage speeds: Should you get one?,Firstpost,2016-10-24 20:13:27.710323
The internet apocalypse map hides the major vulnerability that created it,The Verge,2016-10-24 20:13:27.710913
Microsoft focussing on cybersecurity investments in India; launches engagement centre in Delhi,Firstpost,2016-10-24 20:13:27.711536
"BMW India, Ola redefine future of on-demand luxury mobility in India",Livemint,2016-10-24 20:13:27.712151
"OnePlus Diwali Dash Sale Begins, OnePlus 3 Up for Grabs for Re. 1",NDTV,2016-10-24 20:13:27.712765
Instagram Reportedly Testing Live Video Feature Called 'Go Insta',NDTV,2016-10-24 20:13:27.713406
Mercedes Benz to launch C300 and S500 Cabriolet on November 9,News18,2016-10-24 20:13:27.714027
Swipe Elite 2 Plus With 4G VoLTE Support Launched at Rs. 4444,Intabloid.com,2016-10-24 20:13:27.714622
"Tata Motors Hexa: Review; Toyota Innova Crysta, Mahindra XUV 500 set to get serious competition?",Financial Express,2016-10-24 20:13:27.715235
Mahindra launches new electric car 'e2oPlus',Times of India,2016-10-24 20:13:27.715847
"Xiaomi Mi Note 2 Launched: Price, Release Date, Specifications, and More",Firstpost,2016-10-25 13:59:52.319029
"Pixel, Pixel XL Aren't More Water Resitant Because Google Supposedly 'Ran Out of Time'",The Indian Express,2016-10-25 13:59:52.319896
Apple Watch Nike+ edition to go on sale from October 28,India Today,2016-10-25 13:59:52.320556
Samsung and Hyundai Troubles Weigh on South Korea's GDP,Vanguard,2016-10-25 13:59:52.321203
"Moto X, Moto Z Force, Z Play, Moto E, and others to start receiving Android 7.0 Nougat update",The Indian Express,2016-10-25 13:59:52.321870
Honda Accord Hybrid Launched In India: Prices Start At Rs. 37 Lakh,NDTVAuto.com,2016-10-25 13:59:52.322515
Google's Standalone Mixed Reality Headset Will Integrate Eye-Tracking: Report,NDTV,2016-10-25 13:59:52.323158
Ola teams up with BMW for luxury cabs segment,Firstpost,2016-10-25 13:59:52.323779
'7 Reasons why InFocus EPIC 1 is the only camera phone you need',FitnHit.com,2016-10-25 13:59:52.324404
Reliance Jio services to remain free till March 2017?,Gizbot,2016-10-25 13:59:52.325024
Twitter plans to cut about 300 jobs: Bloomberg | Reuters,ZDNet,2016-10-25 13:59:52.325633
This is how the new Maruti Swift Dzire looks,Indian Autos Blog,2016-10-25 13:59:52.326275
"Mercedes Benz To Launch C300 and S500 Cabriolet On 9 November, 2016",Financial Express,2016-10-25 13:59:52.326903
iBall launches CompBookFlip-X5 with 360-degree foldable design at Rs 14999,India Today,2016-10-25 13:59:52.327521
Skoda Rapid facelift launch on November 3rd,DriveSpark.com,2016-10-25 13:59:52.328150
10000 Primary Schools In Kerala To Have Internet Facilities,NDTV,2016-10-25 13:59:52.328773
"Facebook Safety Center redesigned, supports more languages",The Tech Portal,2016-10-25 13:59:52.329369
Techie traumatised as guard turns sexual predator,Times of India,2016-10-25 13:59:52.330012
Tata Hexa vs Mahindra XUV500: Specifications Comparison,NDTV,2016-10-25 13:59:52.330661
"Xiaomi Mi Note 2 Launched: Price, Release Date, Specifications, and More",Firstpost,2016-10-25 14:00:32.531631
"Pixel, Pixel XL Aren't More Water Resitant Because Google Supposedly 'Ran Out of Time'",The Indian Express,2016-10-25 14:00:32.532487
"Meizu m3s Launched in India: Price, Release Date, Specifications, and More",Rayarena,2016-10-25 14:00:32.533109
Apple Watch Nike+ edition to go on sale from October 28,India Today,2016-10-25 14:00:32.533761
Samsung and Hyundai Troubles Weigh on South Korea's GDP,Vanguard,2016-10-25 14:00:32.534385
The Android Nougat update: The chosen few,The Indian Express,2016-10-25 14:00:32.534998
Honda Accord Hybrid Launched In India: Prices Start At Rs. 37 Lakh,NDTVAuto.com,2016-10-25 14:00:32.535586
Google's Standalone Mixed Reality Headset Will Integrate Eye-Tracking: Report,CNET,2016-10-25 14:00:32.536199
Ola teams up with BMW for luxury cabs segment,Firstpost,2016-10-25 14:00:32.536813
'7 Reasons why InFocus EPIC 1 is the only camera phone you need',FitnHit.com,2016-10-25 14:00:32.537428
Reliance Jio services to remain free till March 2017?,Gizbot,2016-10-25 14:00:32.538079
Twitter is reportedly planning to sack close to 300 employees this week,The Tech Portal,2016-10-25 14:00:32.538672
This is how the new Maruti Swift Dzire looks,Indian Autos Blog,2016-10-25 14:00:32.539284
"Mercedes Benz To Launch C300 and S500 Cabriolet On 9 November, 2016",Financial Express,2016-10-25 14:00:32.539898
iBall launches CompBookFlip-X5 with 360-degree foldable design at Rs 14999,India Today,2016-10-25 14:00:32.540509
Skoda Rapid facelift bookings start in India; comes with updated diesel engine,DriveSpark.com,2016-10-25 14:00:32.541127
10000 Primary Schools In Kerala To Have Internet Facilities,NDTV,2016-10-25 14:00:32.541761
"Facebook Safety Center redesigned, supports more languages",The Tech Portal,2016-10-25 14:00:32.549904
Techie traumatised as guard turns sexual predator,Times of India,2016-10-25 14:00:32.551579
Tata Hexa vs Mahindra XUV500: Specifications Comparison,NDTV,2016-10-25 14:00:32.553208
